username,user_handle,date,retweets,favorites,text,geological_location,mentions,hashtags,tweet_id,permalink
"UC Davis Vet Med",ucdavisvetmed,2018-11-15 17:49,202,765,"After losing everything in the #Campfire, this young woman found her family member of 16 years :) Coco has a bit more recovery but will go home soon! #ThankfulThursday @ucdavis @UCDavisDateline pic.twitter.com/0vJ84HQE99",,@ucdavis @UCDavisDateline,#Campfire #ThankfulThursday,"1063247579633209344",https://twitter.com/ucdavisvetmed/status/1063247579633209344
"Battle Born",BattleBornThom,2018-11-15 17:23,419,729,"I’m sending my prayers tonight for our heroes here at home! #CaliforniaFires #CampFire #PrayersForCalifornia #prayersforfirstresponders #1stresponders pic.twitter.com/iizuzA9Jmj",,,#CaliforniaFires #CampFire #PrayersForCalifornia #prayersforfirstresponders #1stresponders,"1063241186033328128",https://twitter.com/BattleBornThom/status/1063241186033328128
"Marcus Yam 火",yamphoto,2018-11-15 17:06,86,301,"Returning to Paradise: Michael & Charlie Ramirez returned after the #Campfire destroyed their home and managed to recover Charlie's precious keepsake bracelet that Michael had bought for her. Everything else was mostly lost. The couple was ecstatic to recover the bracelet. pic.twitter.com/vUYvmc4wIC",,,#Campfire,"1063236956744634368",https://twitter.com/yamphoto/status/1063236956744634368
"BerkeleyFirefighters",BerkeleyFD,2018-11-15 17:04,90,322,"Today: Day 8 of Engine 305’s deployment to the #campfire. The crew is in good health and has been a critical asset, along with the rest of their strike team, in securing very active regions of the fire. The loss is unfathomable, and we are doing everything we can to stop further. pic.twitter.com/SGOKd6mpkG",,,#campfire,"1063236210183725058",https://twitter.com/BerkeleyFD/status/1063236210183725058
"David Scott",elshagon,2018-11-15 17:01,142,535,"#CampFire Aaron Rodgers arriving at tonight's game pic.twitter.com/MDHMhhPoBT",,,#CampFire,"1063235466084806656",https://twitter.com/elshagon/status/1063235466084806656
"Eric Holthaus",EricHolthaus,2018-11-15 16:48,614,1273,"We can’t continue on as if the #CampFire in Paradise was just a fluke. By failing to take action on climate change, we are actively choosing to create the ideal conditions for future, unfightable fires. Extreme weather is a choice we make every day. https://grist.org/article/the-bizarre-and-frightening-conditions-that-sparked-the-camp-fire/ …",,,#CampFire,"1063232180225216512",https://twitter.com/EricHolthaus/status/1063232180225216512
"David Little",ER_DavidLittle,2018-11-15 15:52,778,1660,"Here is the ⁦ @ParadisePost⁩, the newspaper we can’t deliver, so we are dropping bundles off at evacuation centers. #CampFire pic.twitter.com/V8UnWNEZHG",,@ParadisePost,#CampFire,"1063218243081400320",https://twitter.com/ER_DavidLittle/status/1063218243081400320
"John Myers",johnmyers,2018-11-15 15:52,268,363,"California’s state Capitol and the afternoon sun, choked in #CampFire smoke. Sacramento’s fashion accessory has become a mask. pic.twitter.com/SKj3QjEqu2",,,#CampFire,"1063218236219523072",https://twitter.com/johnmyers/status/1063218236219523072
"Eric Swalwell",ericswalwell,2018-11-15 15:33,144,464,"Don't think we'll just forget about your insults after #CampFire and #Woolseyfires and then pretend it's ok. https://www.sfchronicle.com/california-wildfires/article/Trump-coming-to-California-on-Saturday-to-meet-13396022.php …",,,#CampFire #Woolseyfires,"1063213307274895360",https://twitter.com/ericswalwell/status/1063213307274895360
"Eric Holthaus",EricHolthaus,2018-11-15 15:31,277,235,"Oakland's air quality index just hit 307 = Hazardous, the worst category. Hazardous: Health warnings of emergency conditions. The entire population is likely to be affected. They're closing schools today and tomorrow. All from wildfire smoke 175mi away. #CampFire https://twitter.com/NWSSacramento/status/1063203676528001025 …",,,#CampFire,"1063213022439706624",https://twitter.com/EricHolthaus/status/1063213022439706624
"KQED News",KQEDnews,2018-11-15 15:25,95,154,"And, of course, you can check the AQI here (hourly) #AirQuality #CampFire http://bit.ly/kqedmapairquality …",,,#AirQuality #CampFire,"1063211487479574528",https://twitter.com/KQEDnews/status/1063211487479574528
"Dan Diamond",ddiamond,2018-11-15 15:18,386,691,"This iconic photo of the #CampFire was taken by the editor of the @ChicoER newspaper — whose staff has shrunk from 45 to 10, and whose only photographer is out on medical leave. http://www.latimes.com/local/lanow/la-me-chico-newspaper-editor-20181115-story.html … by @boreskes",,@ChicoER @boreskes,#CampFire,"1063209740191313920",https://twitter.com/ddiamond/status/1063209740191313920
"Alexis Roucourt",AlexisRoucourt,2018-11-15 15:16,2090,2781,"Mind-boggling. SF tops world ranking for worst air quality today. #sf #AirQuality #campfire pic.twitter.com/DgN1ruU3Ha",,,#sf #AirQuality #campfire,"1063209037867577344",https://twitter.com/AlexisRoucourt/status/1063209037867577344
"Democracy Now!",democracynow,2018-11-15 15:15,76,112,"Two Prisoner Firefighters Among Those Injured Battling Wildfires http://ow.ly/DTcy30mDe18 #CampFire #WoolseyFire pic.twitter.com/0nnzqhA90h",,,#CampFire #WoolseyFire,"1063208814239989760",https://twitter.com/democracynow/status/1063208814239989760
"Daniel Alrick",SFmeteorologist,2018-11-15 15:07,93,87,"Air quality has deteriorated across #NorCal, into the very unhealthy range in many locations including San Francisco. Inversion & light winds continue to trap smoke in the region. Spare the Air Alert extended through Tuesday 11/20. http://www.baaqmd.gov/news-and-events/page-resources/2018-news/111518-wsta … #CAwx #CAfire #CampFire pic.twitter.com/THTz3dK07S",,,#NorCal #CAwx #CAfire #CampFire,"1063206985909161984",https://twitter.com/SFmeteorologist/status/1063206985909161984
"NWS Sacramento",NWSSacramento,2018-11-15 14:54,166,140,"Air quality continues to be very unhealthy to hazardous across the area. Stay indoors! #cawx #CampFire pic.twitter.com/dEXJzIVsL5",,,#cawx #CampFire,"1063203676528001025",https://twitter.com/NWSSacramento/status/1063203676528001025
"Robert Ghilduta",robertghilduta,2018-11-15 14:44,1304,1874,"Turned NOAA's HRRR Smoke satellite images of #CampFire into a time-lapse. The giant plume of smoke covering the SF & the bay area doesn't really seem to be dispersing, and is instead occasionally blown back from the ocean. pic.twitter.com/9CO6HrmUIa",,,#CampFire,"1063201058158129152",https://twitter.com/robertghilduta/status/1063201058158129152
"Cat Wise",CatWisePDX,2018-11-15 14:42,82,189,"Clothing donations have poured into makeshift camp for wildfire evacuees at the Chico Walmart. Our report on @NewsHour tonight. #campfire pic.twitter.com/7iFM8hnL6f",,@NewsHour,#campfire,"1063200649544839168",https://twitter.com/CatWisePDX/status/1063200649544839168
"ABC7 Eyewitness News",ABC7,2018-11-15 13:54,89,335,"AMAZING! A horse was able to rescue itself from the #CampFire by taking shelter inside a pool: http://abc7.la/2qNhCmL pic.twitter.com/Aq9Q3Jt7F3",,,#CampFire,"1063188434049654784",https://twitter.com/ABC7/status/1063188434049654784
"CAL FIRE",CAL_FIRE,2018-11-15 13:32,130,95,"#CampFire [update] The Butte County Public Health Department has been using public health measures to stop a gastrointestinal illness (GI) outbreak in all monitored shelters. Please see below for more information on preventing the spread of the illness. https://twitter.com/CountyofButte/status/1063173038571569152 …",,,#CampFire,"1063182903453003776",https://twitter.com/CAL_FIRE/status/1063182903453003776
"ifaw",action4ifaw,2018-11-15 13:26,89,145,"Our mission to help animals affected by the deadly #CampFire continues today. We're currently helping with the sheltering of around 1,900 animals & the search and rescue of animals in burn areas. Your support makes it all possible: https://g.ifaw.org/2RSXjzy pic.twitter.com/odrOquBJkM",,,#CampFire,"1063181430048546817",https://twitter.com/action4ifaw/status/1063181430048546817
"ABC30 Fresno",ABC30,2018-11-15 13:15,137,255,"Satellite imagery from NASA shows how a plume of smoke from the #CampFire has spread across Central California. Full story: https://abc30.tv/2QJDt9L pic.twitter.com/eWMdK7dEeT",,,#CampFire,"1063178620888330241",https://twitter.com/ABC30/status/1063178620888330241
"Bay Area Air Quality",AirDistrict,2018-11-15 13:12,52,57,"The first and best action you can take to protect your health from #CampFire smoke impacts is to stay indoors with windows and doors closed. Follow our wildfire safety tips here: http://www.baaqmd.gov/about-air-quality/incidents-and-advisories/wildfire-safety …",,,#CampFire,"1063177893440700416",https://twitter.com/AirDistrict/status/1063177893440700416
"Bay Area Air Quality",AirDistrict,2018-11-15 13:10,97,70,"Due to continued heavy smoke moving into the Bay Area from the #CampFire in #ButteCounty, the Air District is extending the Winter @SpareTheAir Alert through Tuesday, November 20. Follow current air quality here: https://bit.ly/2Dnza06 . Photo in Berkeley on 11-14 via @BenPaulos pic.twitter.com/m6fpEGlldg",,@SpareTheAir @BenPaulos,#CampFire #ButteCounty,"1063177552485744640",https://twitter.com/AirDistrict/status/1063177552485744640
"NWS Bay Area",NWSBayArea,2018-11-15 12:52,70,61,"Satellite imagery and unofficial air quality sensors indicate that air quality in the Bay Area is currently just as bad or worse than any other time since the #CampFire began. Learn how to protect your lungs from wildfire smoke here: http://www.bepreparedcalifornia.ca.gov/documents/protect%20your%20lungs%20respirator.pdf … pic.twitter.com/qhx2XGxvnf",,,#CampFire,"1063173006757937154",https://twitter.com/NWSBayArea/status/1063173006757937154
"NWS Sacramento",NWSSacramento,2018-11-15 12:00,69,67,"The best way to avoid health problems from wildfire smoke is to stay indoors , especially for children and sensitive groups. When you need to be outdoors, wear a N95 or P100 mask. #cawx #CampFire pic.twitter.com/ukQYdbk66W",,,#cawx #CampFire,"1063159709992148998",https://twitter.com/NWSSacramento/status/1063159709992148998
"Luna Lovegood ✨💥✨",LunaLuvgood2020,2018-11-15 11:57,134,128,"#CampFire #ParadiseCA Location : Butte County 135,000 acres burned 56 fatalities confirmed, 3 firefighters injured 297 confirmed missing most in their 80’s and 90’s 9,817 structures destroyed, 8,700 of them Homes Average income 24,430 yr",,,#CampFire #ParadiseCA,"1063159069584703488",https://twitter.com/LunaLuvgood2020/status/1063159069584703488
"Camp Fire Animals",isthisyourpet,2018-11-15 11:52,168,235,"No info on location but if this sweet kitty belongs to you or friend/family you can know she is safe https://www.facebook.com/1275003700/posts/10216927103271229/ … #CampFire pic.twitter.com/4bSUlwafHS",,,#CampFire,"1063157816611921920",https://twitter.com/isthisyourpet/status/1063157816611921920
"Cristobal Barboza",21barboza_,2018-11-15 11:38,67,57,"For the #campfire victims, behind the goodwill on Colusa Avenue, Yuba City, you are more than welcome to come and grab clothing at no charge, we also have blankets, tents, jackets, and shoes. For people volunteering at shelters and such spread the word!!!! pic.twitter.com/qg5brnKJwV",,,#campfire,"1063154211263721472",https://twitter.com/21barboza_/status/1063154211263721472
"Chip Vaughan",VaughanChip,2018-11-15 10:44,38,102,"#Campfire @KTVU What is the dinosaur wearing... The city of Chico. pic.twitter.com/wPR7pOApxu",,@KTVU,#Campfire,"1063140638709886976",https://twitter.com/VaughanChip/status/1063140638709886976
"UC Davis Vet Med",ucdavisvetmed,2018-11-15 10:42,55,142,"This kitty wanted to say thanks so much for all the love and support shown to him and other animals impacted by the #CampFire. We recently received large donations of critical supplies and medications from @HenryScheinVet, @Zoetis and @MerckAH. pic.twitter.com/Kcs4EypA78 – at UC Davis Veterinary Medical Teaching Hospital",,@HenryScheinVet @Zoetis @MerckAH,#CampFire,"1063140266024923136",https://twitter.com/ucdavisvetmed/status/1063140266024923136
"SFGate",SFGate,2018-11-15 10:23,399,354,"From Instagram: @marcstokes79 took a photo of San Francisco from the same angle and compared the two shots after a week. The comparison shows how bad the air quality has been since the #CampFire started a week ago. #regram #airquality #smoke #sf #sanfra… https://ift.tt/2OLSAO6 pic.twitter.com/czJgLJW5i2",,@marcstokes79,#CampFire #regram #airquality #smoke #sf #sanfra,"1063135531985526784",https://twitter.com/SFGate/status/1063135531985526784
"Butte County, CA",CountyofButte,2018-11-15 10:19,85,42,"CORRECTION -Local Assistance Center Opening Tomorrow at 9am to 7pm at the former Sears in Chico (1982 E 20th St, Chico, CA 95928) for Residents Impacted by the #CampFire @paradise_ca @femaregion9 @ButteSheriff @CALFIRE_ButteCo @BC_PubHealth pic.twitter.com/ZdHNSGwnLm",,@paradise_ca @femaregion9 @ButteSheriff @CALFIRE_ButteCo @BC_PubHealth,#CampFire,"1063134443907428352",https://twitter.com/CountyofButte/status/1063134443907428352
"Karl Mondon",karlmondon,2018-11-15 10:17,210,464,"As Chico steps up in response to the #Campfire calamity, so too does their little newspaper, the Enterprise-Record. The state’s 5th oldest paper (where many work for minimum wage and a dozen have lost their own homes) keeps putting out the DAMN paper. http://www.latimes.com/local/lanow/la-me-chico-newspaper-editor-20181115-story.html …",,,#Campfire,"1063133904230436864",https://twitter.com/karlmondon/status/1063133904230436864
"NWS Sacramento",NWSSacramento,2018-11-15 10:09,103,98,"Smoke from the #CampFire will continue to impact the area. Here's the latest smoke forecast for today through Friday. #cawx pic.twitter.com/EDQwB4F6Tb",,,#CampFire #cawx,"1063131915736244224",https://twitter.com/NWSSacramento/status/1063131915736244224
"The Weather Network",weathernetwork,2018-11-15 10:00,61,204,"When Jeff Hill of Paradise, California returned to his evacuated neighborhood during the #CampFire, he found a horse in a backyard swimming pool. pic.twitter.com/hXMY2OKbu4",,,#CampFire,"1063129510193872898",https://twitter.com/weathernetwork/status/1063129510193872898
"Rep. Doug LaMalfa",RepLaMalfa,2018-11-15 09:42,84,78,"According to FEMA, the Main Disaster Assistance Center will be open tomorrow morning at 9:00 am to assist victims of the #CampFire. It will be located in the old Sears building at the Chico Mall.",,,#CampFire,"1063125160021110786",https://twitter.com/RepLaMalfa/status/1063125160021110786
"Jena Reynolds",JustJenaR,2018-11-15 09:37,44,242,"We know now our house is completely gone #CampFire. We have had so many #CriticalRole critters help! They keep telling us to get in touch w/ @VoiceOfOBrien @matthewmercer @Marisha_Ray @LauraBaileyVO @WillingBlam @samriegel @executivegoth & @TheVulcanSalute so here’s my shout out pic.twitter.com/dtTN5WglTD",,@VoiceOfOBrien @matthewmercer @Marisha_Ray @LauraBaileyVO @WillingBlam @samriegel @executivegoth @TheVulcanSalute,#CampFire #CriticalRole,"1063123813326442496",https://twitter.com/JustJenaR/status/1063123813326442496
"Daniel Swain",Weather_West,2018-11-15 09:34,50,82,"Uncertainty remains, but still pretty strong multi-model ensemble signal for at least *some* rain around Thanksgiving in California. Still have a dry and smokey week to come before that, though. #CAwx #CAfire #CampFire #WoolseyFire pic.twitter.com/w40inCQGlN",,,#CAwx #CAfire #CampFire #WoolseyFire,"1063122971550670848",https://twitter.com/Weather_West/status/1063122971550670848
"Matt",nosoupforgeorge,2018-11-15 09:07,75,157,"This isn't fog. It's smoke. It's been one week since #CampFire, and no sign of #airquality improving. Other parts of the country have have #snowday for #firstsnow. Here in #California, many schools closed for #smokeday. #CaliforniaWildfires #CaliforniaFires #ThursdayThoughts pic.twitter.com/WDto6h8J9i",,,#CampFire #airquality #snowday #firstsnow #California #smokeday #CaliforniaWildfires #CaliforniaFires #ThursdayThoughts,"1063116304834383874",https://twitter.com/nosoupforgeorge/status/1063116304834383874
"Emily Bazar",emilybazar,2018-11-15 08:51,68,44,"Will a surgical mask help protect you from #wildfire smoke? How about a bandana? Nope. You’ll need a special #N95 respirator mask – and you’ll need to wear it correctly: https://khn.org/news/for-wildfire-safety-only-particular-masks-guard-against-toxic-particulate-matter/ … @KHNews #Sacramento #CampFire pic.twitter.com/2D7zXQGb5g",,@KHNews,#wildfire #N95 #Sacramento #CampFire,"1063112149910732800",https://twitter.com/emilybazar/status/1063112149910732800
"ABC7 Eyewitness News",ABC7,2018-11-15 08:38,199,917,"AMAZING! A horse was able to rescue itself from the #CampFire by taking shelter inside a pool: https://abc7.la/2qNhCmL pic.twitter.com/bgWaGxtN1X",,,#CampFire,"1063109046549405696",https://twitter.com/ABC7/status/1063109046549405696
"USDA Forest Service",forestservice,2018-11-15 08:35,78,162,"More than 480 USDA Forest Service personnel are fighting the #CampFire in Northern California. This #wildfire is currently active on 140,000 acres and is 40 percent contained. pic.twitter.com/rGbyFeS1W6",,,#CampFire #wildfire,"1063108307307687940",https://twitter.com/forestservice/status/1063108307307687940
"AJ+",ajplus,2018-11-15 08:32,78,128,"Air quality is so bad in parts of northern California that people are being advised to avoid all physical outdoor activity. Some stores have completely sold out of respirator masks. Smoke is spreading more than 100 miles away from the #CampFire. pic.twitter.com/Zns0R5ppYA",,,#CampFire,"1063107395814088704",https://twitter.com/ajplus/status/1063107395814088704
"Audrey Denney",audrey4congress,2018-11-15 08:26,67,63,"This is the #CampFire update as of 11/15/18: 8,756 homes and 260 commercial buildings destroyed, 140,000 acres burned, 56 lives claimed so far, 40% containment, classified as deadliest and most destructive in California’s history. https://twitter.com/CALFIRE_ButteCo/status/1063087403496173571 …",,,#CampFire,"1063106034619768832",https://twitter.com/audrey4congress/status/1063106034619768832
"CAL FIRE Butte Unit/Butte County Fire Department",CALFIRE_ButteCo,2018-11-15 08:12,76,123,"Camp Fire Incident Video Update 11.15.18 #CampFire #ButteCounty @ButteSheriff @paradise_ca @CHP_Valley @CountyofButte @CHP_Oroville @USFSPlumas @USFSLassen @CHP_Chico @CAL_FIRE pic.twitter.com/KatVFniLd4",,@ButteSheriff @paradise_ca @CHP_Valley @CountyofButte @CHP_Oroville @USFSPlumas @USFSLassen @CHP_Chico @CAL_FIRE,#CampFire #ButteCounty,"1063102399714222080",https://twitter.com/CALFIRE_ButteCo/status/1063102399714222080
"Xeni Jardin",xeni,2018-11-15 07:05,73,170,"There’s a huge new population of displaced people in California. Just this week. There are hundreds maybe thousands of them. We don’t know their names. Not the migrant caravan. California residents displaced by the #WoolsleyFire & #campFire.",,,#WoolsleyFire #campFire,"1063085597940572160",https://twitter.com/xeni/status/1063085597940572160
"Hailey Branson-Potts",haileybranson,2018-11-15 07:04,100,138,"“Why my senior year, you know?” Paradise High School — which already struggled with rural poverty — is still standing, physically. But its fate is unclear after the #CampFire left most of its students homeless. http://www.latimes.com/local/lanow/la-me-ln-paradise-high-school-camp-fire-20181114-story.html …",,,#CampFire,"1063085376422633473",https://twitter.com/haileybranson/status/1063085376422633473
"Ginger Zee",Ginger_Zee,2018-11-15 06:49,11,232,"I can’t imagine surviving the #CampFire ... let alone hours after a c-section. So glad this woman will have the chance to be a mother. https://twitter.com/ABC10/status/1063056563324248065 …",,,#CampFire,"1063081572704903169",https://twitter.com/Ginger_Zee/status/1063081572704903169
"Hailey Branson-Potts",haileybranson,2018-11-15 06:43,86,138,"Iconic #CampFire photo was taken on an iPhone from roof of Chico Enterprise-Record by paper’s editor, David Little, because their only photographer is on leave. He also oversees Paradise Post. “How do you distribute a newspaper to a town that’s not there?” http://www.latimes.com/local/lanow/la-me-chico-newspaper-editor-20181115-story.html …",,,#CampFire,"1063080085815615493",https://twitter.com/haileybranson/status/1063080085815615493
"CDC Emergency",CDCemergency,2018-11-15 06:24,26,26,"#Norovirus can spread quickly in places like hospitals, schools, & even #emergency shelters. Here are 5 ways to help protect yourself from norovirus: http://ow.ly/z2qD30mD3iN #ThursdayThoughts #PrepYourHealth #CampFire #WoolseyFire pic.twitter.com/KUZZ1K6gCc",,,#Norovirus #emergency #ThursdayThoughts #PrepYourHealth #CampFire #WoolseyFire,"1063075327713386496",https://twitter.com/CDCemergency/status/1063075327713386496
"Nate Hamilton",DomiNateFF,2018-11-15 06:19,33,33,"In all seriousness, @KeatonDenlay does a wonderful job discussing the #CampFire & how’s it’s affecting so many in CA. A town 15 mins from his house was 90% consumed by the fires. Please listen to Keaton on this episode & reach out to him if you would like to help! #PleaseHelp https://twitter.com/FantasyTiltPod/status/1062932166621818880 …",,@KeatonDenlay,#CampFire #PleaseHelp,"1063074033091129344",https://twitter.com/DomiNateFF/status/1063074033091129344
"Dina Kupfer",DinaKupfer,2018-11-15 05:17,87,159,"One week ago today at exactly 6:33AM the first flames were reported in Paradise. No one knew then what this fire would become. With 56 lives lost & more than 10,000 structures destroyed, the #CampFire has become the deadliest & most destructive wildfire in California history. https://twitter.com/CBSSacramento/status/1062981149297991680 …",,,#CampFire,"1063058328492814337",https://twitter.com/DinaKupfer/status/1063058328492814337
"We Don't Have Time",WeDontHaveTime0,2018-11-15 04:53,36,39,"Shocking before and after pictures. #campfire in Northern California has burned 135,00 acres in 6 days. It blazed through the town of Paradise resulting in 7860 structures burning down. 97% of those were homes. So far, 48 people have died. #WeDontHaveTime pic.twitter.com/PH6b3j5Zze",,,#campfire #WeDontHaveTime,"1063052415719628800",https://twitter.com/WeDontHaveTime0/status/1063052415719628800
"🇺🇸🌵TruthRocks🇺🇸🇵🇱 🌺✨",DJTsavesAmerica,2018-11-15 01:43,111,83,"This should scare everyone, not just Californians #Agenda21 #campfire @RealJamesWoods https://youtu.be/UHIqycFgCBc pic.twitter.com/D50XCfykom",,@RealJamesWoods,#Agenda21 #campfire,"1063004591556460545",https://twitter.com/DJTsavesAmerica/status/1063004591556460545
"ABC News",ABC,2018-11-14 22:43,55,69,"Authorities in Northern California said the remains of 8 more people were found Wednesday after the devastating #CampFire swept through the town of Paradise. The death toll from the inferno now stands at 56, with more than 100 people still missing. https://abcn.ws/2DDw8WG pic.twitter.com/h0qGpjJdIM",,,#CampFire,"1062959248051658752",https://twitter.com/ABC/status/1062959248051658752
"Josh",joshcozine,2018-11-14 22:04,42,95,"Outside the Walmart, evacuees of the #CampFire have been showing up. They've received huge community support in the form of donations, and people showing up and preparing meals. Paradise Police showed up, as well, saying they were here to check on their people. @theorion_news pic.twitter.com/bW0i5ygWXq",,@theorion_news,#CampFire,"1062949388761235456",https://twitter.com/joshcozine/status/1062949388761235456
"KTVU",KTVU,2018-11-14 21:39,33,34,"The images have been striking, dramatic and even pretty, but the #CampFire smoke providing the sun's filter certainly isn't easy on the lungs. Poor air quality conditions persist throughout the #BayArea. This was taken around 4:30 pm in #SantaClara pic.twitter.com/H5k6uXOMmf",,,#CampFire #BayArea #SantaClara,"1062943131346198528",https://twitter.com/KTVU/status/1062943131346198528
"#ResistTyranny",calbennett1,2018-11-14 21:39,37,67,"I’m in Lake County and would more than welcome elderly into my home. I had shoulder surgery recently and can’t drivenmuch right now. Do you know where I can reach people that this might suit? DM if so. #StrongerTogether #CampFire #TentCity I’m an RN, chronically ill preferred",,,#StrongerTogether #CampFire #TentCity,"1062943070323265536",https://twitter.com/calbennett1/status/1062943070323265536
"Courtney J",JustCourt22,2018-11-14 21:30,48,60,"People displaced by the #CampFire are staying in tents in the WalMart parking lot. I’m a couple hours south and it’s been dropping down in the 30’s at night. This is ridiculous I’m hearing reports nobody can locate a #FEMA rep, where is the gov assistance?",,,#CampFire #FEMA,"1062940985573834753",https://twitter.com/JustCourt22/status/1062940985573834753
"Josephine",JosephineResist,2018-11-14 21:10,37,58,"This is a humanitarian crisis.The military at the border should be here helping these people. #CampFire #California #californiawildfirehttps://twitter.com/BreakingNews_RS/status/1062525533618081793 …",,,#CampFire #California #californiawildfirehttps,"1062935738193309696",https://twitter.com/JosephineResist/status/1062935738193309696
"HadEnoughOfTrump",callkurt,2018-11-14 21:02,33,67,"Thank you #CampFire https://twitter.com/TedLandK5/status/1061720933897924609 …",,,#CampFire,"1062933951772127232",https://twitter.com/callkurt/status/1062933951772127232
