username,user_handle,date,retweets,favorites,text,geological_location,mentions,hashtags,tweet_id,permalink
"Brandon Wagoner",BrandonWagoner,2018-11-11 09:11,190,90,"Looking for my Uncle last seen Thursday in Magalia on Andover. His name is Gary Hunter and he would not leave his home. We have checked all the local shelters with no luck. Please share!!! #CampFire pic.twitter.com/3mc59t8hF6",,,#CampFire,"1061667774857043968",https://twitter.com/BrandonWagoner/status/1061667774857043968
"Matt",nosoupforgeorge,2018-11-11 09:07,45,332,"Corrections: With proper #ClimateAction, we can prevent further devastation going on in California. Get smart! #ClimateChange #ClimateChangeIsReal #SundayMorning #CaliforniaFires #CaliforniaWildfires #WoolseyFire #CampFire pic.twitter.com/l3UZdowaWt",,,#ClimateAction #ClimateChange #ClimateChangeIsReal #SundayMorning #CaliforniaFires #CaliforniaWildfires #WoolseyFire #CampFire,"1061666794107097088",https://twitter.com/nosoupforgeorge/status/1061666794107097088
"David Little",ER_DavidLittle,2018-11-11 08:31,102,52,"Two @ChicoER employees from Magalia are still unaccounted for, Gary Putty ad Dan Sloane. Please, if you have seen them, please let me know. #CampFire",,@ChicoER,#CampFire,"1061657800554766336",https://twitter.com/ER_DavidLittle/status/1061657800554766336
"Gursewak Ghoman",GhomanGursewak,2018-11-11 08:17,42,52,"The community of Hamilton City has come together to help the victims of the #campfire. We have clothes, food, water, hygiene items and more at Double EE Market in Hamilton City, right on HWY 32. We would love for you to stop by and spread the word. @ChicoER @ER_DavidLittle pic.twitter.com/PsCX3XXkZx",,@ChicoER @ER_DavidLittle,#campfire,"1061654103200169984",https://twitter.com/GhomanGursewak/status/1061654103200169984
"WeatherNation",WeatherNation,2018-11-11 08:16,43,67,"UPDATE! The #CampFire is now 25% contained and has burned ~109,000 acres. #CAwx pic.twitter.com/ZDuiVLKLo9",,,#CampFire #CAwx,"1061653876254752769",https://twitter.com/WeatherNation/status/1061653876254752769
"James “Bo” Kirk Pine",jameskirkpine,2018-11-11 07:50,246,677,"Firefighters in California #CampFire #HillFire #WoolseyFire #CaliforniaFires Bless you all thank you all pic.twitter.com/AMd70USvqm",,,#CampFire #HillFire #WoolseyFire #CaliforniaFires,"1061647287934435328",https://twitter.com/jameskirkpine/status/1061647287934435328
"KTLA",KTLA,2018-11-11 07:44,338,330,"Death toll in 170-square-mile #CampFire expected to rise from 23. Some 110 people are unaccounted for. Containment is at 25%. http://on.ktla.com/NepbD",,,#CampFire,"1061645892132851712",https://twitter.com/KTLA/status/1061645892132851712
"Gigi Graciette",GigiGraciette,2018-11-11 07:33,367,382,"Update on #CampFire burning in Butte County, CA: - Fire at 109,000 acres and is 25% contained. - 23 people have died and three firefighters have been injured. - 6453 homes have been destroyed, along with 260 businesses. - 4000+ personnel assigned @FOXLA pic.twitter.com/3uUpQxqzK8",,@FOXLA,#CampFire,"1061643080602796032",https://twitter.com/GigiGraciette/status/1061643080602796032
"CAL FIRE",CAL_FIRE,2018-11-11 07:31,177,181,"#CampFire [update] Pulga Road at Camp Creek Road near Jarbo Gap (Butte County) is now 109,000 acres and 25% contained. Evacuations in place. Unified Command: @CALFIRE_ButteCo , @ButteSheriff, @paradise_ca, @CHP_Valley, and Paradise P.D. http://www.fire.ca.gov/current_incidents/incidentdetails/Index/2277 … … pic.twitter.com/8dpJew5UjV",,@CALFIRE_ButteCo @ButteSheriff @paradise_ca @CHP_Valley,#CampFire,"1061642622559612930",https://twitter.com/CAL_FIRE/status/1061642622559612930
"NewsandGuts",NewsandGuts,2018-11-11 07:24,113,416,"“The president’s message attacking California... is Ill-informed, ill-timed and demeaning to those who are suffering as well as the men and women on the front lines. -Brian K. Rice, CA Professional Firefighters President https://www.newsandguts.com/firefighters-group-condemns-donald-trumps-victim-shaming/ … #CaliforniaWildfires #campfire",,,#CaliforniaWildfires #campfire,"1061640842283229184",https://twitter.com/NewsandGuts/status/1061640842283229184
"CAL FIRE Butte Unit/Butte County Fire Department",CALFIRE_ButteCo,2018-11-11 07:19,124,102,"Camp Fire Incident Update 11.11.18 AM #campfire @ButteSheriff @paradise_ca @CHP_Valley @CountyofButte @CHP_Oroville pic.twitter.com/u4z8MDqtPC",,@ButteSheriff @paradise_ca @CHP_Valley @CountyofButte @CHP_Oroville,#campfire,"1061639584574885888",https://twitter.com/CALFIRE_ButteCo/status/1061639584574885888
"Sean21",Mc21Sean,2018-11-11 07:03,51,224,"Surreal photo. God Bless California. @jack should hire Mr. Woods as a guest lecturer. Here’s your title: “Mobilizations for the Greater Good Through @Twitter w/James Woods.” Everything Mr. Woods did regarding the #campfire and others was spot on and showed great humanity.",,@jack @Twitter,#campfire,"1061635592235241473",https://twitter.com/Mc21Sean/status/1061635592235241473
"Sacramento Police",SacPolice,2018-11-11 06:59,25,218,"Good morning from the night shift at the #CampFire, not that a simple thank you would ever suffice, but thank you to all the #Veterans everywhere, we honor you today and everyday #sacpd #VeteransDay2018 pic.twitter.com/s7VONuZb58",,,#CampFire #Veterans #sacpd #VeteransDay2018,"1061634440395350016",https://twitter.com/SacPolice/status/1061634440395350016
"Butte County, CA",CountyofButte,2018-11-11 06:55,113,68,"The #CampFire is affecting these water systems: Big Bend Mobile Home Park, Gran Mutual Water Company and Blue Oak Terrace Mutual Water System. The @CaWaterBoard, the Division of Drinking Water & @BC_PubHealth have issued boil water advisories for customers of these systems.",,@CaWaterBoard @BC_PubHealth,#CampFire,"1061633627035860994",https://twitter.com/CountyofButte/status/1061633627035860994
"San Francisco Chronicle",sfchronicle,2018-11-11 06:23,573,443,"Here's how you can help the victims of Butte County's devastating #CampFire Read more: https://trib.al/3Xy1GfL pic.twitter.com/2mGvUjvOIb",,,#CampFire,"1061625499502415872",https://twitter.com/sfchronicle/status/1061625499502415872
"Mike Pesto",MikePesto,2018-11-11 06:15,43,375,"24 people in California (so far) are dead and this is how you help heal a community? “Get smart?!?!” Why don’t you “get smart” and come out to the #CampFire to see the devastation for yourself? I wonder if you’d still decide to strike the same tone then. #CaliforniaWildfires",,,#CampFire #CaliforniaWildfires,"1061623358846984192",https://twitter.com/MikePesto/status/1061623358846984192
"Najeh Ahmad, MD, MPH",KPbewelldoc,2018-11-11 05:53,66,84,"#California #smoke Info? Spread this excellent website: http://californiasmokeinfo.blogspot.com/p/smoke-and-health.html?m=1 … #Publichealth #AirQuality #Health #Safety #Asthma #COPD #CampFire #WoolseyFire #CaliforniaFires pic.twitter.com/ZrqaNw6YWj",,,#California #smoke #Publichealth #AirQuality #Health #Safety #Asthma #COPD #CampFire #WoolseyFire #CaliforniaFires,"1061617996534149120",https://twitter.com/KPbewelldoc/status/1061617996534149120
"dababy",dababy00377681,2018-11-11 05:46,88,90,"This is my childhood cat monster he lived with my mother in Magalia near Imperial and Rosewood please if you see him message me right away he is a service animal my mother was at work and was not able to get back into town and barely made it out of paradise #CampFire pic.twitter.com/F9djwGI8Rt",,,#CampFire,"1061616068651667456",https://twitter.com/dababy00377681/status/1061616068651667456
"grist",grist,2018-11-11 04:07,47,30,"These are firestorms — towering, fast-moving walls of flames hundreds of feet high — the kind of fires that are not only uncontrolled by firefighters, but uncontrollable. #CampFire https://buff.ly/2T07vrC",,,#CampFire,"1061591120185036800",https://twitter.com/grist/status/1061591120185036800
"Copernicus EU",CopernicusEU,2018-11-11 01:41,56,58,"Particulate Matter from #MalibuFire #WoolseyFire #HillFire #CampFire is strongly affecting #AirQuality in California Data from our @CopernicusECMWF Atmosphere Monitoring Service #DIY http://earth.nullschool.net/fr/#current/particulates/surface/level/overlay=pm10/orthographic=-109.19,34.02,1602/loc=-119.018,34.244 … pic.twitter.com/SYjHW2FsqF",,@CopernicusECMWF,#MalibuFire #WoolseyFire #HillFire #CampFire #AirQuality #DIY #current,"1061554524236795904",https://twitter.com/CopernicusEU/status/1061554524236795904
"Tiffany Ariana Trump",TiffanyATrump,2018-11-11 01:04,150,1038,"Praying for everyone affected by the tragic wildfires in CA. #WoolseyFire #CampFire #HillFire pic.twitter.com/77E2Son1Gg",,,#WoolseyFire #CampFire #HillFire,"1061545148637741060",https://twitter.com/TiffanyATrump/status/1061545148637741060
"Luna Lovegood ✨💥✨",LunaLuvgood2020,2018-11-11 00:29,60,74,"#CampFire #CaliforniaFires Please Retweet this to stop this misinformation Leaving water for wild animals is painting a target on their backs. Mountain lions and bears are usually shot on sight Please don’t put them in danger because of misplaced kindness Love, Lunahttps://twitter.com/LunaLuvgood2020/status/1061521842077224962 …",,,#CampFire #CaliforniaFires,"1061536415983357952",https://twitter.com/LunaLuvgood2020/status/1061536415983357952
"Dylan Bouscher",DylanBouscher,2018-11-11 00:28,130,208,"23 people are dead and 120,000 acres are burned. The #CampFire is 20% contained. Some residents of Paradise, Calif., who were under evacuation orders, stayed put to save their homes. “It was like fighting an elephant with a piece of spaghetti,” Brad Weldon said #CaliforniaFires pic.twitter.com/1griw8YplM",,,#CampFire #CaliforniaFires,"1061536163649835010",https://twitter.com/DylanBouscher/status/1061536163649835010
"Alisande 🇺🇸",Alisand3,2018-11-10 22:47,124,146,"I have to rant ; the last two days I have helped pulled many animals from the #CampFire in #California . I’ve never been so angry and disheartened at the cruelty I witnessed. People leaving their dogs and cats (other species too) TO BURN. Stuffing their cars with TVS. #Evil",,,#CampFire #California #Evil,"1061510821493129216",https://twitter.com/Alisand3/status/1061510821493129216
"Bryce Lauritzen",bnl1282,2018-11-10 22:44,325,182,"My cousin is still missing from the #CampFire. He reportably left Magalia on Friday Nov 9 at approximately 12 p.m. in his 1995 Chevy Berretta. He has not been heard of since. He is a Type 1 Diabetic and his family is quite worried about his location. #magaliafire #Paradise pic.twitter.com/f2e70YbLUw",,,#CampFire #magaliafire #Paradise,"1061509953041575937",https://twitter.com/bnl1282/status/1061509953041575937
"McWinner",LauraWinner5,2018-11-10 22:20,100,278,"#CampFire love our firefighters more and more. God bless you as you risk your lives to save others. pic.twitter.com/yetjr2iJ5b",,,#CampFire,"1061503904750329856",https://twitter.com/LauraWinner5/status/1061503904750329856
"Carpe Donktum🔹",CarpeDonktum,2018-11-10 22:12,133,379,"If you have not been paying attention to @RealJamesWoods over the last few days, HE HAS BEEN INCREDIBLE. He has been working tirelessly to reunite people with their missing loved ones, pets, friends, and neighbors. JAMES YOU ARE AN AMAZING HUMAN. THANK YOU #CampFire",,@RealJamesWoods,#CampFire,"1061501935814107136",https://twitter.com/CarpeDonktum/status/1061501935814107136
"Kevin Sorbo",ksorbs,2018-11-10 22:08,91,283,"· Thankful for the firefighters risking their lives and getting people to safety during these horrendous wildfires. Show your support and donate to @CAFireFound at http://cafirefound.org #CampFire #HillFire #WoolseyFire",,@CAFireFound,#CampFire #HillFire #WoolseyFire,"1061500824780709889",https://twitter.com/ksorbs/status/1061500824780709889
"Bev Maccario",BevMaccario,2018-11-10 22:05,135,125,"If you’ve lost a pet in the fire please go look for them at the Chico Airport. They have 729 animals and are still rescuing. You can leave your information with them and they will call when they think they’ve found your pet. #CampFire #campfirepets #paradise #magalia",,,#CampFire #campfirepets #paradise #magalia,"1061500168753672193",https://twitter.com/BevMaccario/status/1061500168753672193
"RainnWilson",rainnwilson,2018-11-10 22:02,2768,7271,"CALIFORNIANS: #WoolsleyFire #CampFire pic.twitter.com/hHBeawBU24",,,#WoolsleyFire #CampFire,"1061499392878727169",https://twitter.com/rainnwilson/status/1061499392878727169
"CA Fire Scanner",CAFireScanner,2018-11-10 21:09,40,227,"Came across this while scouting out some more feeds on Broadcastify for the #CampFire. This person lost their home & still has desire to host the feed again. Without dedicated people like this, myself & others wouldn't be able to listen to these feeds to provide info. Respect. pic.twitter.com/6ARHKzODm8",,,#CampFire,"1061486161971933184",https://twitter.com/CAFireScanner/status/1061486161971933184
"World Central Kitchen",WCKitchen,2018-11-10 21:07,352,1226,"Hundreds displaced by the #CampFire have gathered at the Chico Wal-Mart parking lot, setting up an informal distribution site for clothes, diapers and other needs. WCK was able to provide everyone fresh meals tonight and we will be back! pic.twitter.com/rYIcs2Z09X",,,#CampFire,"1061485640192327680",https://twitter.com/WCKitchen/status/1061485640192327680
"Inudewaruika",SweetAppleAcre,2018-11-10 21:04,164,207,"Inlaws were not able to reach their house b4 they were evacuated & unable 2 save their 2 dogs. They were outside in yard on Lofty Ln Paradise. Jules is a Shepard mix with golden retriever, Romeois a purebred Great Pyrenees & has his declaws still. Both are fixed. #CampFire pic.twitter.com/CDIGSpIDS8",,,#CampFire,"1061484763461017600",https://twitter.com/SweetAppleAcre/status/1061484763461017600
"kent winter",kentwinter90,2018-11-10 21:03,139,746,"What would the federal government do with out the nearly 400 billion dollars #California gives you. The farmers in #Iowa would not get their #welfare checks. Your kids couldn't fly around the world on our dime. #WoolseyFire #CampFire #CaliforniaFires pic.twitter.com/9s4P4alWwL",,,#California #Iowa #welfare #WoolseyFire #CampFire #CaliforniaFires,"1061484564223156224",https://twitter.com/kentwinter90/status/1061484564223156224
"Carolyn Cole",Carolyn_Cole,2018-11-10 20:57,165,226,"In the town of #Paradise there are a few animals that have been missing their human companions since the #CampFire. If you know this cat, contact me for information. pic.twitter.com/Jq9gN7oDCS",,,#Paradise #CampFire,"1061483038167584768",https://twitter.com/Carolyn_Cole/status/1061483038167584768
"Mamy",mayy_ray,2018-11-10 20:30,136,460,"An ENTIRE town is gone because of #campfire & the media is more focused on the SoCal fires because of the celebrities who live near it.",,,#campfire,"1061476277549318144",https://twitter.com/mayy_ray/status/1061476277549318144
"Sacramento Police",SacPolice,2018-11-10 20:28,57,151,"So many images from the #Campfire just seem so surreal, another rough day - thinking of those who were lost & those who have lost so much #ParadiseStrong #sacpd #buttecounty pic.twitter.com/nSt2ZlYmtb",,,#Campfire #ParadiseStrong #sacpd #buttecounty,"1061475804817702913",https://twitter.com/SacPolice/status/1061475804817702913
"James Woods",RealJamesWoods,2018-11-10 20:17,774,818,"#SearchingFor: James Selby Clements, 60 yrs, and his Mother Nancy Clements, 83 yrs, they are at 6303 Harvey Road in #Paradise. Contact: Robyn #CampFireJamesWoods #CampFire https://twitter.com/Robyn1158/status/1061405484391915520 …",,,#SearchingFor #Paradise #CampFireJamesWoods #CampFire,"1061472919421890560",https://twitter.com/RealJamesWoods/status/1061472919421890560
"San Francisco Chronicle",sfchronicle,2018-11-10 20:00,78,157,"Cowboys at the #CampFire: Jerry Kirk has been rescuing animals since the Carr Fire in Redding, when he desperately wanted to help https://www.sfchronicle.com/california-wildfires/article/Cowboy-volunteers-ride-to-the-rescue-of-horses-13381324.php …",,,#CampFire,"1061468792910360576",https://twitter.com/sfchronicle/status/1061468792910360576
"Eric Holthaus",EricHolthaus,2018-11-10 19:57,79,82,"Another round of dry, gusty winds is predicted for the #CampFire in N California and the #WoolseyFire in S California starting TONIGHT. This is an incredibly dangerous situation -- as bad as Thursday. Please pay attention to local authorities.https://twitter.com/NWSSPC/status/1061346778203729922 …",,,#CampFire #WoolseyFire,"1061467836646866944",https://twitter.com/EricHolthaus/status/1061467836646866944
"Eric Holthaus",EricHolthaus,2018-11-10 19:51,132,98,"UPDATE: Officials have identified an additional 14 bodies, bringing the #CampFire death toll to 23. This is the most destructive wildfire in California history -- and now one of the deadliest. 6,713 buildings 6,453 homes 23 people dead 20% contained https://grist.org/article/entire-cities-evacuate-as-hellish-wildfires-whip-through-california/ …",,,#CampFire,"1061466423036395520",https://twitter.com/EricHolthaus/status/1061466423036395520
"Don Hankins",Pyrogeographer,2018-11-10 19:18,102,263,"Spent the better part of today helping animals in Paradise. Devastation is an understatement with maybe 1% of structures standing still. Looks like nuclear holocaust. Among the loss of life and livelihood, there is hope. #CampFire here is one positive sighting. pic.twitter.com/KUTSO447Mx",,,#CampFire,"1061458029911072768",https://twitter.com/Pyrogeographer/status/1061458029911072768
"Jessica Christian",jachristian,2018-11-10 18:56,92,277,"Watched as a group of local volunteers rescued 8 horses from a property that was completely burnt to the ground. Thankful to be telling stories of the helpers in this tragic #CampFire. Stay tuned for the story by @MelodyGutierrez. We'll be back in Paradise tomorrow @sfchronicle pic.twitter.com/sZmyhp27fL",,@MelodyGutierrez @sfchronicle,#CampFire,"1061452484772655105",https://twitter.com/jachristian/status/1061452484772655105
"ABC7 Eyewitness News",ABC7,2018-11-10 18:52,133,222,"#BREAKING: Northern California sheriff says 14 additional bodies recovered, bringing death toll for #CampFire to 23 in massive wildfire https://abc7.la/2zJPtkn pic.twitter.com/prrPCPeQgX",,,#BREAKING #CampFire,"1061451673686618118",https://twitter.com/ABC7/status/1061451673686618118
"The Weather Channel",weatherchannel,2018-11-10 18:52,191,234,"Northern California's #CampFire has now burned an area the size of New Orleans as the death toll more than doubles. Fierce fire weather conditions are expected once again on Sunday. The latest news: https://wxch.nl/2z4XkJU pic.twitter.com/xRUzzFhBVD",,,#CampFire,"1061451470594293761",https://twitter.com/weatherchannel/status/1061451470594293761
"Lizzie Johnson",lizziejohnsonnn,2018-11-10 18:50,418,727,"To understand what was lost, you need to understand what the town of #Paradise was. Before the #CampFire wiped it off the map, when it was still a small place defined mostly by its proximity to bigger places. My latest from the fire line: https://www.sfchronicle.com/california-wildfires/article/This-was-Paradise-How-do-you-quantify-13381061.php …",,,#Paradise #CampFire,"1061450960529018881",https://twitter.com/lizziejohnsonnn/status/1061450960529018881
"UC Davis Vet Med",ucdavisvetmed,2018-11-10 18:45,113,345,"Our #animalheroes helping critters of all size affected by the #campfire! pic.twitter.com/dUWuq7yV0V",,,#animalheroes #campfire,"1061449736769626113",https://twitter.com/ucdavisvetmed/status/1061449736769626113
"One America News",OANN,2018-11-10 18:39,203,199,"Officials: The #CampFire has claimed the lives of 23 people in Northern California, more than 6,400 homes destroyed pic.twitter.com/Kgck3Py0eW",,,#CampFire,"1061448204124737537",https://twitter.com/OANN/status/1061448204124737537
"Chico State",ChicoState,2018-11-10 18:31,192,420,"While we are still waiting on numbers, we know many in our Chico State community have lost their homes or been displaced by the #CampFire. The Wildcats Rise Fire Recovery Fund will support students, faculty, & staff with assistance and relief https://bit.ly/2z4qgSp #WildcatsRise",,,#CampFire #WildcatsRise,"1061446358203285504",https://twitter.com/ChicoState/status/1061446358203285504
"PM Breaking News",PMBreakingNews,2018-11-10 18:30,341,295,"Breaking: Death toll rises to 23 from #Campfire in Butte County, California. At least 110 people are missing. https://twitter.com/carolyn_cole/status/1061442154105495552/video/1 …",,,#Campfire,"1061446101616746496",https://twitter.com/PMBreakingNews/status/1061446101616746496
"Daniel Swain",Weather_West,2018-11-10 18:28,138,208,"The awful reality in #Paradise. It's still far worse than most folks realize. #CampFire #CaliforniaWildfires #CaFirehttps://twitter.com/engineco16/status/1061444721547993089 …",,,#Paradise #CampFire #CaliforniaWildfires #CaFirehttps,"1061445598627299328",https://twitter.com/Weather_West/status/1061445598627299328
"James Woods",RealJamesWoods,2018-11-10 18:25,1228,1728,"#MissingDogsFound currently in #Oroville and #Chico #CampFireJamesWoods #CampFire https://twitter.com/YoloCoSheriff/status/1061442082391285760 …",,,#MissingDogsFound #Oroville #Chico #CampFireJamesWoods #CampFire,"1061444872136212486",https://twitter.com/RealJamesWoods/status/1061444872136212486
"James Woods",RealJamesWoods,2018-11-10 18:12,1071,880,"#Info Here is a great resource for lost and found #DisasterAnimals #CampFireJamesWoods #CampFire #SoCalFiresJamesWoodshttps://twitter.com/Jr3597/status/1061440786007502848 …",,,#Info #DisasterAnimals #CampFireJamesWoods #CampFire #SoCalFiresJamesWoodshttps,"1061441473579831302",https://twitter.com/RealJamesWoods/status/1061441473579831302
"kat ❔",heyitsblondie,2018-11-10 18:01,563,1651,"Located at the Chico Mall. #campfire pic.twitter.com/fb2IKCbZ6D",,,#campfire,"1061438681540517891",https://twitter.com/heyitsblondie/status/1061438681540517891
"James Woods",RealJamesWoods,2018-11-10 17:52,1245,977,"#Missing: Gerald Clark from 1437 Mayhew Lane in #Paradise California. His son lived with him and his name is Dana Anthony Clark. #ButteSheriff #ParadiseFire #CampFire #CampFireButte #CampFireJamesWoods https://twitter.com/MarketingKey/status/1061433970024476674 …",,,#Missing #Paradise #ButteSheriff #ParadiseFire #CampFire #CampFireButte #CampFireJamesWoods,"1061436588331360261",https://twitter.com/RealJamesWoods/status/1061436588331360261
"Aleksandr Yarmolatii",sanextv,2018-11-10 17:50,353,326,"I met this guy at #paradise He survived with his mom. They decided to stay home and don’t have chance to connect with family. Do you know them? #CampFire #ParadiseFire #CaliforniaFire pic.twitter.com/VAdhKYAeTP",,,#paradise #CampFire #ParadiseFire #CaliforniaFire,"1061435989527121920",https://twitter.com/sanextv/status/1061435989527121920
"James Woods",RealJamesWoods,2018-11-10 17:49,697,1720,"For some reason I am blocked by the Twitter feed of the individual posting this. He was one of our missing persons. Glad he’s been found. #CampFireJamesWoods #CampFire pic.twitter.com/SV6a9RKabg",,,#CampFireJamesWoods #CampFire,"1061435627172978688",https://twitter.com/RealJamesWoods/status/1061435627172978688
"James Woods",RealJamesWoods,2018-11-10 17:42,580,614,"#Update: #CampFire: #Chico evacuation center at capacity; still receiving, giving supplies http://bit.ly/2QyczSd #CampFireJamesWoodshttps://twitter.com/ABC10/status/1061430907339505665 …",,,#Update #CampFire #Chico #CampFireJamesWoodshttps,"1061433893084114949",https://twitter.com/RealJamesWoods/status/1061433893084114949
"James Woods",RealJamesWoods,2018-11-10 17:28,852,807,"#SoCalFiresJamesWoods Gloria Marie has a #FB group dedicated to reunion with lost #CampFirePets Give a look #CampFireJamesWoods #CampFire https://twitter.com/gloria2marie/status/1060768645901479936 …",,,#SoCalFiresJamesWoods #FB #CampFirePets #CampFireJamesWoods #CampFire,"1061430383160508416",https://twitter.com/RealJamesWoods/status/1061430383160508416
"Nathanial Garrison",n8_garrison,2018-11-10 17:09,503,1918,"1st tweet ever. Lived in Paradise Ca my whole life, our family is devastated. We've lost everything and only escaped by the grace of God. The tweet from our President this morning made me literally vomit. Its vile, disrespectful, unamerican, political garbage. #campfire",,,#campfire,"1061425696889700353",https://twitter.com/n8_garrison/status/1061425696889700353
"NWS Sacramento",NWSSacramento,2018-11-10 16:59,202,155,"Very unhealthy to hazardous air quality conditions over much of the Sacramento valley due to smoke from the #CampFire #cawx pic.twitter.com/PhuKeW17uw",,,#CampFire #cawx,"1061423028356177920",https://twitter.com/NWSSacramento/status/1061423028356177920
"katskillz27",Katskillz27,2018-11-10 16:39,364,700,"REPOSTING FROM https://www.facebook.com/tracy.grant.568 I adopted a 94yr old, evacuee. He’s coming home with me. His name is LEE Brundige if anyone is looking for or knows him #CampFire #ParadiseFire pic.twitter.com/Pqj958ACpY",,,#CampFire #ParadiseFire,"1061418151479521280",https://twitter.com/Katskillz27/status/1061418151479521280
"James Woods",RealJamesWoods,2018-11-10 16:35,960,714,"#Missing: Kimberly and Brandon Thompson, their friend Ducky, and two dogs. From #Magalia #CampFire #CampFireJamesWoods https://twitter.com/LilithMeows/status/1061413815290654721 …",,,#Missing #Magalia #CampFire #CampFireJamesWoods,"1061417162416537600",https://twitter.com/RealJamesWoods/status/1061417162416537600
"nat🇺🇸🗽",_si_se_puede,2018-11-10 16:28,167,211,"This informative thread below shows exactly why climate change is a big culprit of the #CAWildfires, despite what BS dear leader says #ClimateChangeIsReal #Campfire #WoolsleyFire #CaliforniaFireshttps://twitter.com/Weather_West/status/1061316105308753920 …",,,#CAWildfires #ClimateChangeIsReal #Campfire #WoolsleyFire #CaliforniaFireshttps,"1061415263302635520",https://twitter.com/_si_se_puede/status/1061415263302635520
