username,user_handle,date,retweets,favorites,text,geological_location,mentions,hashtags,tweet_id,permalink
"Barbi Twins",Barbi_Twins,2018-11-25 20:51,86,48,"#CampFire rescuers claim blocked- @CountyofButte say @NVADG+Cowboy911 are caring for pets-Pickup: Chico Municipal Airport- @ButteCountyFair- @VCAnimalService-Old Co Hospital- @buttehumane- @ucdavisvetmed- @sfspca-Richvale(HSUS)- #LOST>https://sites.google.com/view/campfirerescuedanimals/ …https://www.actionnewsnow.com/content/news/Animals-in-Camp-Fire-Shelters-Need-to-Be-Fostered-Soon-or-Will-Be-Offered-for-Adoption-501209111.html …",,@CountyofButte @NVADG @ButteCountyFair @VCAnimalService @buttehumane @ucdavisvetmed @sfspca,#CampFire #LOST,"1066917421573783553",https://twitter.com/Barbi_Twins/status/1066917421573783553
"Dave Toussaint",engineco16,2018-11-25 19:36,61,76,"#CampFire 11/25 - 85 fatalities (down 2), 296 unaccounted for - 153336 acres 100% contained, not 100% out - 13954 single/multi family homes destroyed - 514 commercial buildings destroyed - 4265 other structures destroyed - 18733 structures destroyed - 570 structures damaged",,,#CampFire,"1066898555627945985",https://twitter.com/engineco16/status/1066898555627945985
"Chico State",ChicoState,2018-11-25 17:49,36,177,"Tomorrow, November 26, classes will resume as scheduled. Amid the loss that many of us are feeling and experiencing, we know challenges will accompany the return to classes after an unexpected week away and the fall break, but they are challenges we will face together. #CampFire",,,#CampFire,"1066871637679599616",https://twitter.com/ChicoState/status/1066871637679599616
"Brian Stelter",brianstelter,2018-11-25 11:45,70,143,"The #CampFire death toll is still rising -- and 249 people are unaccounted for -- so it's arguably becoming a bigger story by the day. But it's no longer breaking news, and coverage is fading... pic.twitter.com/J0L4BvLTld",,,#CampFire,"1066779939116969984",https://twitter.com/brianstelter/status/1066779939116969984
"AccuWeather",breakingweather,2018-11-25 10:55,36,134,"The #CampFire is now 100% contained. Fire suppression repair personnel continue to work on rehab while search and rescue crews continue with search efforts: http://ow.ly/10y730mK5wt https://twitter.com/CAL_FIRE/status/1066708807177265152 …",,,#CampFire,"1066767284306395136",https://twitter.com/breakingweather/status/1066767284306395136
"San Francisco SPCA",sfspca,2018-11-25 10:08,93,400,"Rambo has been reunited! He was lost and hurt during the #CampFire, and had been recovering in our hospital. As soon as Rambo saw his family, his face lit up and his tail stared wagging faster than we’d ever seen! It was a very tearful reunion. Rambo is back where he belongs pic.twitter.com/B4XhJAJNym",,,#CampFire,"1066755492289089538",https://twitter.com/sfspca/status/1066755492289089538
"The Weather Channel",weatherchannel,2018-11-25 09:57,83,246,"California's deadliest #wildfire, the #CampFire, is now 100% contained: https://wxch.nl/2RPvgAZ pic.twitter.com/xdbQWLjr6k",,,#wildfire #CampFire,"1066752844433420288",https://twitter.com/weatherchannel/status/1066752844433420288
"Lizzie Johnson",lizziejohnsonnn,2018-11-25 09:45,264,477,"BREAKING: the #CampFire is 100 percent contained at 153,336 acres burned. 13,696 homes and 528 businesses destroyed and 85 people killed. #Paradise",,,#CampFire #Paradise,"1066749806859579392",https://twitter.com/lizziejohnsonnn/status/1066749806859579392
"Sunrise Movement 🌅",sunrisemvmt,2018-11-25 09:10,158,374,"#CampFire is contained. With more than 80 ppl dead, 100s still missing & scientific consensus that this was a climate change fueled disaster, there's no choice: dem leaders must support a Select Committee on a #GreenNewDeal. Make sure they follow through http://bit.ly/rampup4gnd https://twitter.com/CAL_FIRE/status/1066708807177265152 …",,,#CampFire #GreenNewDeal,"1066740799801569282",https://twitter.com/sunrisemvmt/status/1066740799801569282
"David Begnaud",DavidBegnaud,2018-11-25 08:28,394,577,"The #campfire in Northern California is 100% contained 85 civilians died 249 people are unaccounted for 153,336 acres burned 13,972 residences destroyed Cause of the fire is still under investigation",,,#campfire,"1066730340411211783",https://twitter.com/DavidBegnaud/status/1066730340411211783
"Eric Holthaus",EricHolthaus,2018-11-25 07:55,92,235,"Good news: The #CampFire is now fully contained. With more than 80 people dead, hundreds still missing, and an entire American city almost totally destroyed, this fire must force a reckoning. We can't continue on the same as before. https://twitter.com/CAL_FIRE/status/1066708807177265152 …",,,#CampFire,"1066722128236552194",https://twitter.com/EricHolthaus/status/1066722128236552194
"NBC Bay Area",nbcbayarea,2018-11-25 07:48,70,146,"#BREAKING: #CampFire now 100 percent contained after burning 153,336 acres in Butte County, Cal Fire says. http://nbcbay.com/OjxuCcP ? pic.twitter.com/i5ONYUC347",,,#BREAKING #CampFire,"1066720311666712578",https://twitter.com/nbcbayarea/status/1066720311666712578
"CAL FIRE Butte Unit/Butte County Fire Department",CALFIRE_ButteCo,2018-11-25 07:26,100,179,"Camp Fire Update 11.25.18 AM: #CampFire #ButteStrong #ParadiseStrong #ButteRecovers @ButteSheriff @paradise_ca @CHP_Valley @CountyofButte pic.twitter.com/clxsSCfEgp",,@ButteSheriff @paradise_ca @CHP_Valley @CountyofButte,#CampFire #ButteStrong #ParadiseStrong #ButteRecovers,"1066714634546163712",https://twitter.com/CALFIRE_ButteCo/status/1066714634546163712
"KRON4 News",kron4news,2018-11-25 07:19,107,344,"JUST IN: #CampFire is 100% contained https://www.kron4.com/news/california/cal-fire-announces-camp-fire-100-contained/1617283692 … pic.twitter.com/ccucpo2V97",,,#CampFire,"1066712996599091200",https://twitter.com/kron4news/status/1066712996599091200
"Justin Michaels",JMichaelsNews,2018-11-25 07:16,222,709,"Some good news: The #CampFire is now 100% contained thanks to the tireless work of @CAL_FIRE and dozens of local fire departments. It is the deadliest and most destructive #wildfire in #California history. So far 85 have died, 285 still unaccounted. BUT containment is a WIN! pic.twitter.com/d7vgkSKnJK",,@CAL_FIRE,#CampFire #wildfire #California,"1066712188558151680",https://twitter.com/JMichaelsNews/status/1066712188558151680
"ABC7 News",abc7newsbayarea,2018-11-25 07:12,136,485,"#BREAKING: 100 percent containment reached in #CampFire in #ButteCounty.https://abc7ne.ws/2P28yUG",,,#BREAKING #CampFire #ButteCounty,"1066711280377942016",https://twitter.com/abc7newsbayarea/status/1066711280377942016
"CAL FIRE",CAL_FIRE,2018-11-25 07:02,1051,2649,"#CampFire [final] Pulga Road at Camp Creek Road near Jarbo Gap (Butte County) is now 100% contained at 153,336 acres. Unified Command: @CALFIRE_ButteCo, @ButteSheriff, Paradise Police Department, and the USFS. http://www.fire.ca.gov/current_incidents/incidentdetails/Index/2277 … pic.twitter.com/TjMmiLrRQQ",,@CALFIRE_ButteCo @ButteSheriff,#CampFire,"1066708807177265152",https://twitter.com/CAL_FIRE/status/1066708807177265152
"Nest Bedding",nestbedding,2018-11-24 21:20,25,84,"#campfire we have two new working portable generators for family in need. Please message us.",,,#campfire,"1066562129661030401",https://twitter.com/nestbedding/status/1066562129661030401
"Butte County Sheriff",ButteSheriff,2018-11-24 21:06,143,133,"Press Release #ButteSheriff #CampFire pic.twitter.com/wIm2X3JZcj",,,#ButteSheriff #CampFire,"1066558654529171457",https://twitter.com/ButteSheriff/status/1066558654529171457
"Eric Holthaus",EricHolthaus,2018-11-24 20:18,134,171,"UPDATE: The #CampFire began 16 days ago. There are still 475 people missing. It remains the deadliest and most destructive wildfire in the past 100 years of U.S. history. https://twitter.com/engineco16/status/1066544988232679424 …",,,#CampFire,"1066546578238910465",https://twitter.com/EricHolthaus/status/1066546578238910465
"ABC7 News",abc7newsbayarea,2018-11-24 19:36,46,185,"BREAKING NEWS UPDATE: Crews are closing in on the #CampFire in Butte County. Containment is now 98%. https://abc7ne.ws/2TG0w7r",,,#CampFire,"1066536182102712322",https://twitter.com/abc7newsbayarea/status/1066536182102712322
"World Central Kitchen",WCKitchen,2018-11-24 14:10,85,392,"Our Thanksgiving celebration may be over, but we are still cooking thousands of meals for #CampFire evacuees and first responders! Josh @JPh3lps reports in from Paradise today: pic.twitter.com/7kQrOD9J60",,@JPh3lps,#CampFire,"1066454137573949442",https://twitter.com/WCKitchen/status/1066454137573949442
"Unicorn Riot",UR_Ninja,2018-11-24 12:25,104,120,"NEW: At California's Chico Walmart Camp, #CampFire Survivors Receive #MutualAid North Valley Mutual Aid is a grassroots group that has been providing aid to fire victims from day one of the fire. See our past coverage: https://unicornriot.ninja/2018/wildfire-survivors-endure-homelessness-toxic-air-hazardous-water-virus-outbreak/ … pic.twitter.com/aWBFK7Hyvz",,,#CampFire #MutualAid,"1066427726142296069",https://twitter.com/UR_Ninja/status/1066427726142296069
"Carin Dorghalli",CarinDorghalli,2018-11-24 11:35,132,475,"James Faircloth made an 18-hour trek from Colorado with his 6-year-old daughter to gift an RV to James Wood, a father of four, who lost his Paradise home during the #CampFire. The two were strangers before this meeting. pic.twitter.com/NuBO0fYnUZ",,,#CampFire,"1066414981011267585",https://twitter.com/CarinDorghalli/status/1066414981011267585
"Butte County, CA",CountyofButte,2018-11-24 11:19,96,101,"DONATION UPDATE- Donation centers are full and can’t accept material donations. The best way to help #CampFire survivors and evacuees is sending monetary donations through trusted local organizations. Visit http://ButteCountyRecovers.org/donations for a list. #ButteStrong #ParadiseProud pic.twitter.com/G6b6KXXooY",,,#CampFire #ButteStrong #ParadiseProud,"1066411005108867072",https://twitter.com/CountyofButte/status/1066411005108867072
"Chico State",ChicoState,2018-11-24 11:05,46,164,"When a group of Chico State students found a #CampFire evacuation shelter in need of aid to track those in its care, they launched into action, establishing a medical records system and helping with filling prescriptions. https://bit.ly/2QeuSPD #WildcatsRise",,,#CampFire #WildcatsRise,"1066407524352622594",https://twitter.com/ChicoState/status/1066407524352622594
"In Kind",inkindlife,2018-11-24 06:43,25,69,"Local residents have gathered together to give up their holidays, and spend their time helping these victims still have theirs. #CampFire https://medium.com/@inkind/california-town-hosts-victims-of-camp-fire-for-thanksgiving-fd89af8b4a82 …",,@inkind,#CampFire,"1066341634353360898",https://twitter.com/inkindlife/status/1066341634353360898
"AS Roma English",ASRomaEN,2018-11-24 03:43,95,428,"#ASRoma’s Twitter Team of the Day is #USL side @SacRepublicFC. A real community club, this week they rehoused a family of 7 in one of their player residences after the family was forced to shelter in a nearby parking lot after the Californian #CampFire burnt down their home. pic.twitter.com/XYW7iV03os",,@SacRepublicFC,#ASRoma #USL #CampFire,"1066296216932241409",https://twitter.com/ASRomaEN/status/1066296216932241409
"Ahda Hann",Ahdahann,2018-11-24 00:20,112,40,"#CampFirePets Breaking News : NVDAG and Butte County Animal Control have shut down experienced volunteer trappers, and non-AC animal rescue efforts for the #CampFire despite eyewitness accounts of pets still in need. Contact your reps! Info here https://docs.google.com/document/d/1UW-UhAqjv90Az83YJndJtk9nY1GHr4RS0YOzBVGInhY/edit …",,,#CampFirePets #CampFire,"1066245031936299008",https://twitter.com/Ahdahann/status/1066245031936299008
"Shane Wallen",swallen20,2018-11-23 19:49,173,94,"With 2 days left, we’re at 124K retweets which means $124,000 donated to the @NVCF for #campfire victims of Paradise, CA. For every retweet with the hashtag #retweet4good @StateFarm will donate $1 and up to $1 million to camp fire relief victims. Let’s make this happen!https://twitter.com/AaronRodgers12/status/1065265967897415682 …",,@NVCF @StateFarm,#campfire #retweet4good,"1066176854460121089",https://twitter.com/swallen20/status/1066176854460121089
"Butte County Sheriff",ButteSheriff,2018-11-23 19:35,131,128,"Press Release #ButteSheriff #CampFire pic.twitter.com/rsQ5kpXvj5",,,#ButteSheriff #CampFire,"1066173411175489537",https://twitter.com/ButteSheriff/status/1066173411175489537
"CAL FIRE",CAL_FIRE,2018-11-23 19:05,75,193,"#CampFire [update] Pulga Road at Camp Creek Road near Jarbo Gap (Butte County) remains 153,336 acres and 95% contained. Unified Command: CAL FIRE, @ButteSheriff, Paradise Police Department, and the USFS. http://www.fire.ca.gov/current_incidents/incidentdetails/Index/2277 … pic.twitter.com/RvTrhNaq7J",,@ButteSheriff,#CampFire,"1066165991082577920",https://twitter.com/CAL_FIRE/status/1066165991082577920
"Corinne Smith",Cocoluces,2018-11-23 18:06,154,164,". @Walmart has hired a private security firm, Brosnan Security, to patrol the rain-soaked field where #CampFire evacuees are camping. There are no reports of security concerns or crime. They wear vests, handcuffs & pepper spray & patrol the field in trucks day and night @nsprnews pic.twitter.com/XwcLYPSJbc",,@Walmart @nsprnews,#CampFire,"1066151106881904640",https://twitter.com/Cocoluces/status/1066151106881904640
"UC Davis Vet Med",ucdavisvetmed,2018-11-23 17:01,307,830,"Feather, the goat, from the #Campfire continues to make a steady recovery after 12 days in the care of @ucdavisvetmed. Her owner, Jim, says she led the other 17 goats in his herd to safety, taking the brunt of the burn injures. She's an #animalhero in his eyes. @ucdavis pic.twitter.com/2SCZpClfAA",,@ucdavisvetmed @ucdavis,#Campfire #animalhero,"1066134707283255296",https://twitter.com/ucdavisvetmed/status/1066134707283255296
"ABC7 Eyewitness News",ABC7,2018-11-23 15:07,131,726,"Northern California nurse who drove his truck through #CampFire flames to save patients at his hospital now has a new set of wheels - thanks to Toyota https://abc7.la/2znnyrf pic.twitter.com/i0DkOsdAPY",,,#CampFire,"1066106005568671744",https://twitter.com/ABC7/status/1066106005568671744
"ABC7 Eyewitness News",ABC7,2018-11-23 14:25,17,126,"#GuyFieri helps first responders, #CampFire evacuees celebrate #Thanksgiving https://abc7.la/2FAPcqk pic.twitter.com/Jj278kSW45",,,#GuyFieri #CampFire #Thanksgiving,"1066095295904149504",https://twitter.com/ABC7/status/1066095295904149504
"CAL FIRE Butte Unit/Butte County Fire Department",CALFIRE_ButteCo,2018-11-23 13:24,84,347,"Firefighters & personnel assigned to the #CampFire rotated through several locations yesterday to help with serving Thanksgiving meals to those displaced and affected by the fire. Thank you to all those who volunteered, donated, and helped make these events possible. #ButteCounty pic.twitter.com/2tNZflw8zY",,,#CampFire #ButteCounty,"1066080000124739585",https://twitter.com/CALFIRE_ButteCo/status/1066080000124739585
"Jenn 🌀🔥📢 #DAT",Jr3597,2018-11-23 12:08,152,179,"The #CampFire is an unprecedented event - in scope/size. The support, coordination & collaboration of experienced animal rescue groups is essential to adequately care for over 1800 traumatized #animals. #CampfirePets #Resources #DisasterAssistTeam #Info https://docs.google.com/document/d/1UW-UhAqjv90Az83YJndJtk9nY1GHr4RS0YOzBVGInhY/edit?usp=drivesdk …",,,#CampFire #animals #CampfirePets #Resources #DisasterAssistTeam #Info,"1066060969271533568",https://twitter.com/Jr3597/status/1066060969271533568
"José Andrés",chefjoseandres,2018-11-23 11:29,156,902,"Grateful for the hundreds of volunteers that helped @WCKitchen serve thousands of #Thanksgiving meals yesterday... many who are also #CampFire survivors themselves pic.twitter.com/P2qdhWoVcF",,@WCKitchen,#Thanksgiving #CampFire,"1066051146018578432",https://twitter.com/chefjoseandres/status/1066051146018578432
"Karl Mondon",karlmondon,2018-11-23 10:24,36,174,"Thank you firefighters. Thank you rain. Thank you Chico for holiday dinners for Paradise residents. https://bayareane.ws/2QiZpM0 #CampFire pic.twitter.com/406f1TB9eB",,,#CampFire,"1066034756515651584",https://twitter.com/karlmondon/status/1066034756515651584
"San Francisco SPCA",sfspca,2018-11-23 10:24,146,125,"We just transferred 9 more injured #CampFire cats into our hospital, and we're searching for their owners. If one of these animals is yours, call us at 415-554-3030. Please share this album!! http://bit.ly/SFSPCACampFire pic.twitter.com/c9H1bIJdDg",,,#CampFire,"1066034716720025600",https://twitter.com/sfspca/status/1066034716720025600
"NBC Bay Area",nbcbayarea,2018-11-23 08:26,88,228,"The #CampFire is now 95 percent contained thanks to the help from the rain, @Cal_Fire says. 563 people are still unaccounted for.http://nbcbay.com/Tkigm39",,@Cal_Fire,#CampFire,"1066004995840114688",https://twitter.com/nbcbayarea/status/1066004995840114688
"AJ+",ajplus,2018-11-23 06:52,70,96,"The #CampFire death toll has risen to 84. Over 500 people remain unaccounted for, while thousands have been left homeless. The fire is 95% contained. pic.twitter.com/lPBz9dH2pF",,,#CampFire,"1065981515509755909",https://twitter.com/ajplus/status/1065981515509755909
"ABC7 News",abc7newsbayarea,2018-11-22 23:32,28,79,"A Colorado man found a way to give shelter to a #CampFire survivor, and now his act of kindness is inspiring others to do the same. @DionLimTV tells the story:https://abc7ne.ws/2OYSfYu",,@DionLimTV,#CampFire,"1065870632938725376",https://twitter.com/abc7newsbayarea/status/1065870632938725376
"News Breaking LIVE",NewsBreaking,2018-11-22 20:11,71,82,"CONTAINMENT OF CALIFORNIA WILDFIRES: #CampFire 95% #WoolseyFire 100% DEATH TOLLS: Camp Fire 84 Woolsey Fire 3",,,#CampFire #WoolseyFire,"1065819980850126848",https://twitter.com/NewsBreaking/status/1065819980850126848
"ABC7 News",abc7newsbayarea,2018-11-22 19:44,30,177,"Our men and women in uniform and celebrity chef @GuyFieri were in Butte County making sure #CampFire victims had a warm Thanksgiving meal. @JobinaFortson reports:https://abc7ne.ws/2qZtd27",,@GuyFieri @JobinaFortson,#CampFire,"1065813300628271104",https://twitter.com/abc7newsbayarea/status/1065813300628271104
"CAL FIRE",CAL_FIRE,2018-11-22 19:03,262,575,"#CampFire [update] Pulga Road at Camp Creek Road near Jarbo Gap (Butte County) is now 153,336 acres and 95% contained. Unified Command: CAL FIRE, @ButteSheriff, Paradise Police Department, and the USFS. http://www.fire.ca.gov/current_incidents/incidentdetails/Index/2277 … pic.twitter.com/9MYeZYr7Lm",,@ButteSheriff,#CampFire,"1065803087175008256",https://twitter.com/CAL_FIRE/status/1065803087175008256
"Dave Toussaint",engineco16,2018-11-22 18:50,33,103,"Happy Thanksgiving! #CampFire 11/22 - It's been a long 2 weeks since the fire started. Hopefully today some were able to have a nice dinner and take a time out for a few hours - 84 fatalities, 605 missing - 18,652 structures destroyed - 153,336 acres burned, 95% containment",,,#CampFire,"1065799809175445504",https://twitter.com/engineco16/status/1065799809175445504
"CAL FIRE Butte Unit/Butte County Fire Department",CALFIRE_ButteCo,2018-11-22 18:48,128,134,"Camp Fire Incident Update 11.22.18 PM #CampFire #ButteCounty @ButteSheriff @CountyofButte @townofparadise @chicofd @chicopolice @CHP_Valley @CHP_Oroville @CHP_Chico #ButteCounty @CAL_FIRE pic.twitter.com/m83s0tcJvG",,@ButteSheriff @CountyofButte @townofparadise @chicofd @chicopolice @CHP_Valley @CHP_Oroville @CHP_Chico @CAL_FIRE,#CampFire #ButteCounty #ButteCounty,"1065799096437374976",https://twitter.com/CALFIRE_ButteCo/status/1065799096437374976
"American Red Cross",RedCross,2018-11-22 17:49,70,215,"Alongside our friends from @Walmart, volunteers brought the #Thanksgiving spirit to #CampFire evacuees staying in shelters this holiday. (cc: @WalmartAction) pic.twitter.com/csrjuchDzi",,@Walmart @WalmartAction,#Thanksgiving #CampFire,"1065784254259519488",https://twitter.com/RedCross/status/1065784254259519488
"Unicorn Riot",UR_Ninja,2018-11-22 17:47,50,55,"November 22, 2018 Thanksgiving at the Chico, CA Walmart #CampFire survivor encampment Volunteers providing food, supplies and wellness checks 24/7. The rain that is helping the firefighters is making it harder for some evacuees. pic.twitter.com/KrH9R8IXDw",,,#CampFire,"1065783769502670848",https://twitter.com/UR_Ninja/status/1065783769502670848
"Michael Anthony Adams",MichaelAdams317,2018-11-22 16:26,121,442,"Spent #Thanksgiving in #Paradise w/ a group of firefighters who traded plates of turkey & time w/ loved ones for sack lunches & metal rakes. On a day many are spending in the comfort of their own home, they're combing through what's left here, searching for the #CampFire dead. pic.twitter.com/KKCa1eZ9VY",,,#Thanksgiving #Paradise #CampFire,"1065763606468251648",https://twitter.com/MichaelAdams317/status/1065763606468251648
"CBS Evening News",CBSEveningNews,2018-11-22 15:44,131,263,"Recovery crews weren’t slowing down this Thanksgiving holiday as the search for victims continued just hours after a rainstorm all but extinguished the massive #CampFire in California. The #WoolseyFire has been 100 percent contained. Here's @carterevans https://cbsn.ws/2POiztX pic.twitter.com/r4Rr3lmHrJ",,@carterevans,#CampFire #WoolseyFire,"1065752876629323777",https://twitter.com/CBSEveningNews/status/1065752876629323777
"World Central Kitchen",WCKitchen,2018-11-22 15:12,234,933,"Happy #Thanksgiving from Chico, California! It’s been an honor to get to know the amazing community of @paradise_ca and #CampFire first responders who continue to work tirelessly. We are inspired by their resiliency & know Paradise will build back strong! #ChefsForCalifornia pic.twitter.com/rgwXppJAMu",,@paradise_ca,#Thanksgiving #CampFire #ChefsForCalifornia,"1065744895669821440",https://twitter.com/WCKitchen/status/1065744895669821440
"Steve Patterson",PattersonNBC,2018-11-22 14:55,61,284,"#FLAVORTOWN: My attempt to interview @GuyFieri about all the good he's doing for survivors of the #CampFire... literally turned into him enlisting me to carve turkeys. Seriously. Great guy, really cares, loved this. More: @NBCNightlyNews tonight. Happy Thanksgiving! @NBCNews pic.twitter.com/RtGjxEkuUD",,@GuyFieri @NBCNightlyNews @NBCNews,#FLAVORTOWN #CampFire,"1065740468607057921",https://twitter.com/PattersonNBC/status/1065740468607057921
"Butte County, CA",CountyofButte,2018-11-22 14:29,68,96,"THANK YOU for all the donations! Donation centers are full and can’t accept more material donations. Best way to help #CampFire survivors and pets is monetary donations. Visit http://ButteCountyRecovers.org/donations to donate to trusted organizations.https://www.youtube.com/watch?v=sG5oGpqkLxI …",,,#CampFire,"1065734032296566784",https://twitter.com/CountyofButte/status/1065734032296566784
"Jobina Fortson",JobinaFortson,2018-11-22 14:11,31,83,"Here’s the set up right now at #Chico State. There are dozens of volunteers here to feed #CampFire evacuees @abc7newsbayarea pic.twitter.com/XumQLA801n",,@abc7newsbayarea,#Chico #CampFire,"1065729596404842497",https://twitter.com/JobinaFortson/status/1065729596404842497
"San Francisco SPCA",sfspca,2018-11-22 12:17,44,151,"Our staff is working tirelessly through the Thanksgiving holiday to provide care and treatment for the #CampFire victims. We expect many of these animals to need weeks, and possibly months, of treatment. We are so #thankful to our incredible team for their dedication! pic.twitter.com/cgiSDPwNZq",,,#CampFire #thankful,"1065700903620149248",https://twitter.com/sfspca/status/1065700903620149248
"Chico Fire Department",ChicoFD,2018-11-22 10:55,238,384,"Thank you @AaronRodgers12 for your incredible donation towards the #CampFire recovery efforts. For our followers, you can help. Retweet this video using #retweet4good and State Farm will donate $1 towards recovery efforts. Thank you! #ButteStrong #CampFireParadise #ChicoFDhttps://twitter.com/AaronRodgers12/status/1065265967897415682 …",,@AaronRodgers12,#CampFire #retweet4good #ButteStrong #CampFireParadise #ChicoFDhttps,"1065680115890155520",https://twitter.com/ChicoFD/status/1065680115890155520
"Vicki Gonzalez",KCRAVicki,2018-11-22 10:52,31,137,"#Thanksgiving begins for #CampFire evacuees at @SierraNevada in Chico. The first of several meals hosted by @paradise_ca & @WCKitchen @kcranews pic.twitter.com/6tc4iHa7s9 – at Sierra Nevada Big Room",,@SierraNevada @paradise_ca @WCKitchen @kcranews,#Thanksgiving #CampFire,"1065679460664455168",https://twitter.com/KCRAVicki/status/1065679460664455168
"AJ+",ajplus,2018-11-22 09:47,182,400,"These #CampFire evacuees spent Thanksgiving eve camped out around a Chico Walmart parking lot. California's deadliest wildfire has claimed 83 lives and over 500 people are still missing. The fire is 90% contained. pic.twitter.com/93xhuvTfz2",,,#CampFire,"1065663011711578112",https://twitter.com/ajplus/status/1065663011711578112
"FrancesSteadSellers",FrancesSSellers,2018-11-22 05:37,48,137,"The people of Paradise reveal the true meaning of gratitude. Via ⁦ @emrosenberg⁩ #campfire #calfirehttps://www.washingtonpost.com/national/best-thanksgiving-of-my-life-amid-wildfire-destruction-evacuees-find-meaning-in-holiday/2018/11/21/f5e02e28-ede6-11e8-8679-934a2b33be52_story.html …",,@emrosenberg,#campfire #calfirehttps,"1065600128533389313",https://twitter.com/FrancesSSellers/status/1065600128533389313
"Marcus Yam 火",yamphoto,2018-11-22 01:58,32,406,"That concludes my photo thread. What we do isn't glamorous, but I'm thankful to everyone affected by the #CampFire for sharing their stories and allowing us to spend time with them during this tragedy.",,,#CampFire,"1065544957052633089",https://twitter.com/yamphoto/status/1065544957052633089
