username,user_handle,date,retweets,favorites,text,geological_location,mentions,hashtags,tweet_id,permalink
"Melissa Daugherty",MaddogDaugherty,2019-02-28 10:28,11,12,"Read and share this story. This is huge, and unfortunately really devastating to the efforts to rebuild #Paradise in the wake of the #campfire. It’s a public health issue and it’s a very serious one—and it is not being addressed.” --Andrew Whelton, Purdue University professor https://twitter.com/ChicoNR/status/1101166259742240768 …",,,#Paradise #campfire,"1101187465895792641",https://twitter.com/MaddogDaugherty/status/1101187465895792641
"NBC Bay Area",nbcbayarea,2019-02-28 09:21,27,20,"JUST IN: PG&E says its equipment may have ignited the 2018 #CampFire, which killed 86 people in Northern California. http://nbcbay.com/pYrKfRH",,,#CampFire,"1101170500997402625",https://twitter.com/nbcbayarea/status/1101170500997402625
"KTLA",KTLA,2019-02-28 09:06,83,59,"#BREAKING: PG&E says its equipment likely caused the #CampFire that left 85 people dead and destroyed thousands of homes in NorCal http://on.ktla.com/g5Wat",,,#BREAKING #CampFire,"1101166709187047424",https://twitter.com/KTLA/status/1101166709187047424
"Joe Serna, LAT",JosephSerna,2019-02-28 08:43,20,12,"PG&E admits its equipment likely caused California’s worst fire ever, the #Campfire https://www.latimes.com/local/lanow/la-me-pge-paradise-fire-20190228-story.html …",,,#Campfire,"1101160879012241413",https://twitter.com/JosephSerna/status/1101160879012241413
"J.D. Morris",thejdmorris,2019-02-28 07:26,30,26,"This is big: PG&E believes it is probable that it its equipment is an ignition point of last year's #CampFire, for which the company recorded a $10.5 billion charge, according to its latest earnings report today. Story TK @sfchronicle pic.twitter.com/1CFwyZz5vr",,@sfchronicle,#CampFire,"1101141568650600451",https://twitter.com/thejdmorris/status/1101141568650600451
"Lady V👩‍💻🔥💚",ChaliceGarden,2019-02-27 22:15,11,7,"NEW CALL TO ACTION for #CampFirePets! 100s still in #CampFire burn zone needing rescue; 100s more in shelters/foster awaiting owners to find them before they're adopted! Please help (from anywhere!). RT! THANK YOU! https://docs.google.com/document/d/1UW-UhAqjv90Az83YJndJtk9nY1GHr4RS0YOzBVGInhY/ … #WednesdayWisdom #ParadiseStrong",,,#CampFirePets #CampFire #WednesdayWisdom #ParadiseStrong,"1101002938124627969",https://twitter.com/ChaliceGarden/status/1101002938124627969
"Butte County History",buttecohistory,2019-02-27 19:13,19,55,"When @ButteSheriff Sgt. Greg Reeves took this #OrovilleDamSpillway photo #OTD in 2017, we had no idea what the next two years would bring...the #WallFire, #PonderosaFire, #CherokeeFire, #HoneyFire, #LaPorteFire, #StoneyFire, and the devastating #CampFire. We are #ButteStrong! pic.twitter.com/IU29RJazkb",,@ButteSheriff,#OrovilleDamSpillway #OTD #WallFire #PonderosaFire #CherokeeFire #HoneyFire #LaPorteFire #StoneyFire #CampFire #ButteStrong,"1100957070629584899",https://twitter.com/buttecohistory/status/1100957070629584899
"Jenn 🌀🔥📢 #DAT",Jr3597,2019-02-27 16:06,11,8,"#CampFire - application at link for help paying cell phone bill or with gas gift cards from . @BGCA_Clubs. #DisasterRelief #Resources #WednesdayWisdom #DisasterAssistTeam https://bgcnv.org/camp-fire-gift-card-application-for-cell-phone-bills-and-gas?fbclid=IwAR2oAuPCMjy20rEoGXKZK9bekmsyBPicc_gZM9PYd0OxOkezHGv3MyZ1fi0 …",,@BGCA_Clubs,#CampFire #DisasterRelief #Resources #WednesdayWisdom #DisasterAssistTeam,"1100910129451593728",https://twitter.com/Jr3597/status/1100910129451593728
"Garvin Thomas",garvinthomas,2019-02-27 10:53,5,13,"Wonderful announcement from the folks at @ClifBar: 100% of net profits from sale of Sierra Trail Mix bar will go to new Second Responder Fund for victims of natural disasters. First $1.5 million will go to help #CampFire communities. #bayareaproud @nbcbayarea pic.twitter.com/grq7RW7NoM",,@ClifBar @nbcbayarea,#CampFire #bayareaproud,"1100831322254147584",https://twitter.com/garvinthomas/status/1100831322254147584
"👸🏿Tel",HiRolla1,2019-02-27 00:33,13,20,"#Canoeing #Hiking #boating #birdwatching #Ziplining #swimming #CampFire .... explore Lake Bunyonyi. Log on http://www.hawkseyelodge.co.ug to make your reservations for the best experience at the best rates. Follow them @HawksEyeLodge #Hawkseyeug #Travel #TourismUganda pic.twitter.com/e1GXXNT4SH",,@HawksEyeLodge,#Canoeing #Hiking #boating #birdwatching #Ziplining #swimming #CampFire #Hawkseyeug #Travel #TourismUganda,"1100675174871879680",https://twitter.com/HiRolla1/status/1100675174871879680
"Jenn 🌀🔥📢 #DAT",Jr3597,2019-02-25 21:35,21,15,"#CampFire Notice #ButteCounty Disaster Recovery Centers *CLOSED* due to weather. Stay safe! Stay informed! #DisasterAssistTeam #Paradise #TuesdayMotivation *Information #TuesdayThoughts #Magalia #Concow #YankeeHill #Pulgahttps://www.actionnewsnow.com/content/news/Disaster-Recovery-Centers-closed-in-Butte-County-due-to-weather-conditions-506348501.html?fbclid=IwAR1qgsBs00NOB9LtQDHrUWLVybvvoR5dzLkomz1X9HF9Tx-YWe66Fo_JDxI …",,,#CampFire #ButteCounty #DisasterAssistTeam #Paradise #TuesdayMotivation #TuesdayThoughts #Magalia #Concow #YankeeHill #Pulgahttps,"1100268049633079296",https://twitter.com/Jr3597/status/1100268049633079296
"David Little",ER_DavidLittle,2019-02-25 12:06,7,29,"Hope and beauty at Lookout Point near Paradise on Friday. #CampFire pic.twitter.com/BUOxkNalFy",,,#CampFire,"1100124889543929856",https://twitter.com/ER_DavidLittle/status/1100124889543929856
"Kim Jaxon",drjaxon,2019-02-24 11:48,14,12,"You'll want to read our #teacherstories series: stories of teachers who were impacted by the #CampFire told to future educators at #ChicoState. You'll learn what it means to teach in times of trauma. Up first: Hannah tells the story of @BlaschkeErica https://coloraclassroom.org/2019/02/24/teacher-stories-erica-blaschke/ … #NCTE",,@BlaschkeErica,#teacherstories #CampFire #ChicoState #NCTE,"1099757927018094592",https://twitter.com/drjaxon/status/1099757927018094592
"Alec in WILDerland",AlecWILDerland,2019-02-23 17:11,6,40,"New WILDsides! Learn how to make the ultimate SPAMwich on your next camping trip! #spam #cooking #campfire #scoutshttps://youtu.be/4UCFrRQrsJk",,,#spam #cooking #campfire #scoutshttps,"1099476867575246849",https://twitter.com/AlecWILDerland/status/1099476867575246849
"Ricardo Lara",ICRicardoLara,2019-02-23 10:26,8,21,"Big crowd today for our #CampFire #insurance workshop @ChicoState. We will be here Saturday and Sunday...no appointment needed & free to the public. Proud to be here @CountyofButte @J_GallagherAD3 pic.twitter.com/BqTzOtDgPL",,@ChicoState @CountyofButte @J_GallagherAD3,#CampFire #insurance,"1099375020113948672",https://twitter.com/ICRicardoLara/status/1099375020113948672
"Alley Cat Allies",alleycatallies,2019-02-22 06:46,89,139,"Every day, the Alley Cat Allies Recovery Center in Marysville, California, is caring for the cats who survived the deadly #CampFire. Here are some of their stories. http://qoo.ly/vkpx4",,,#CampFire,"1098957096954019840",https://twitter.com/alleycatallies/status/1098957096954019840
"Dani Anguiano",Dani_Anguiano,2019-02-21 10:30,4,17,"All around Paradise there are still so many reminders of how life stopped on November 8 - leftover Halloween pumpkins at Ponderosa school and an ad for Christmas preview #CampFire pic.twitter.com/6Gu81Zmi0H",,,#CampFire,"1098651105381105665",https://twitter.com/Dani_Anguiano/status/1098651105381105665
"Madison Meyer",madisonmeyer,2019-02-19 18:14,4,20,"Excuse my excitement but Kingston’s story aired on @ABCWorldNews just now! I’m so happy this group is getting national attention for what they are doing to reunite pets! It’s incredible and Kingston’s story goes to show, you should never lose hope! #CampFire #Paradise @ABC10 pic.twitter.com/hpgNayAIZQ",,@ABCWorldNews @ABC10,#CampFire #Paradise,"1098043105356337153",https://twitter.com/madisonmeyer/status/1098043105356337153
"2nd Shift Brewing",2ndshiftbrewing,2019-02-17 15:24,3,157,"Our staff is incredible. They donated all tips from today’s #resiliencefest to the #campfire cause. We are truly so so so lucky",,,#resiliencefest #campfire,"1097275675675893761",https://twitter.com/2ndshiftbrewing/status/1097275675675893761
"High Country News",highcountrynews,2019-02-28 15:28,7,7,"As #Campfire survivors navigate trauma and disappointment, they place what might be false hope in their lawsuits against PG&E. https://hcne.ws/2IJRyEE",,,#Campfire,"1101262780060000256",https://twitter.com/highcountrynews/status/1101262780060000256
"Wildfire Today  🔥",wildfiretoday,2019-02-28 14:47,14,14,"PG&E admits their equipment probably caused the devastating #CampFire at Paradise, CA that killed 85 people and destroyed 14,000 homes. A “broken C-hook” attached to the 115-kilovolt tower was the probable cause. https://www.sacbee.com/news/state/california/article226921019.html … #Wildfires",,,#CampFire #Wildfires,"1101252663675682817",https://twitter.com/wildfiretoday/status/1101252663675682817
"Sonseeahray Tonsall",tonsalltv,2019-02-28 09:43,10,10,"NEW TODAY: @PGE4Me now has this to say about the #CampFire....the company believes it is probable that its equipment will be determined to be an ignition point of the 2018 Camp Fire. That fire killed more than 80 people and has displaced thousands of others. @FOX40 pic.twitter.com/1w3Z9h66Ts",,@PGE4Me @FOX40,#CampFire,"1101176089529876481",https://twitter.com/tonsalltv/status/1101176089529876481
"Ed Joyce",EdJoyce,2019-02-28 08:52,4,5,"PG&E says it’s ‘probable’ its equipment started the #CampFire and the company has recorded a $10.5 billion charge related to claims from the #wildfire Story from @sfchronicle https://bit.ly/2GQUy0a pic.twitter.com/cnAbdo9DKQ",,@sfchronicle,#CampFire #wildfire,"1101163136168603648",https://twitter.com/EdJoyce/status/1101163136168603648
"Tay Austin",Jasamsdestiny,2019-02-28 08:06,16,9,"Attention #Marysville - who lost a Golden Lab? Anyone know this handsome guy? He was found yesterday afternoon on 193 & Fowler. Is he yours? If so he's at Lincoln PD. #LincolnCounty #FoundDog #GoldenLab #lostdog #CampFire #ParadiseFirePets #ParadiseFire pic.twitter.com/422W17tGsQ",,,#Marysville #LincolnCounty #FoundDog #GoldenLab #lostdog #CampFire #ParadiseFirePets #ParadiseFire,"1101151697609605123",https://twitter.com/Jasamsdestiny/status/1101151697609605123
"Peanut 🐾",MoreThanWalkies,2019-02-28 04:33,3,26,"I LOVE my hiking boots @vango @WildCampingUK #Adventure #Hiking #hikingdog #campingwithdogs #camping #dogcamping #campfire #tent @dogcelebration #dogs #DogsOfTwitter @walthollick @BERTIE_LAKELAND @RuthJeffery9 @samsBellabob @olive_blacklab @RagamuffinLewis #dogsthatexplore pic.twitter.com/H23FCLxkfq",,@vango @WildCampingUK @dogcelebration @walthollick @BERTIE_LAKELAND @RuthJeffery9 @samsBellabob @olive_blacklab @RagamuffinLewis,#Adventure #Hiking #hikingdog #campingwithdogs #camping #dogcamping #campfire #tent #dogs #DogsOfTwitter #dogsthatexplore,"1101097945263472640",https://twitter.com/MoreThanWalkies/status/1101097945263472640
"Brianna Sacks",bri_sacks,2019-02-27 14:24,14,14,"California's public utility commission, which oversees PG&E, responds to filings that show that the company repeatedly put off fixing a major line suspected of igniting the #CampFire, but refuses to acknowledge/explain its role in the delayed repairs https://www.wsj.com/articles/pg-e-delayed-safety-work-on-power-line-that-is-prime-suspect-in-california-wildfire-11551292977?mod=breakingnews … pic.twitter.com/lSyHOWQYYD",,,#CampFire,"1100884501289291778",https://twitter.com/bri_sacks/status/1100884501289291778
"Jeremy B. White",JeremyBWhite,2019-02-27 13:12,9,15,"Big scoop by @WSJ: PG&E delayed work for years on line where #CampFire started -- some of whose equipment nearly a century old -- and has since shut down https://twitter.com/murraymatt/status/1100863443152842753 …",,@WSJ,#CampFire,"1100866402133651456",https://twitter.com/JeremyBWhite/status/1100866402133651456
"Doug Sovern",SovernNation,2019-02-27 11:25,6,4,"Breaking: Scoop from the @WSJ: federal regulatory filings reveal that @PGE4Me kept postponing repairs on the high voltage line that is suspected of sparking the #CampFire that killed 85 people and devastated the town of Paradise. https://twitter.com/WSJ/status/1100829753878241280 …",,@WSJ @PGE4Me,#CampFire,"1100839314680819712",https://twitter.com/SovernNation/status/1100839314680819712
"Josh Peete",JoshPeete,2019-02-26 19:18,3,12,"Post #CampFire - The K9 Service Dog program we’ve been working on started today. Our service dog in training, handled by the #VFW will be on campus once a week until the end of the year! #bcoe #RuralEdChat #ButteCOE #suptchat #momsasprincipals #dadsasprincipals pic.twitter.com/RQqcnLmgyb",,,#CampFire #VFW #bcoe #RuralEdChat #ButteCOE #suptchat #momsasprincipals #dadsasprincipals,"1100595933069348864",https://twitter.com/JoshPeete/status/1100595933069348864
"RV4CampfireFamily",RV4CampfireFams,2019-02-26 09:23,12,20,"This momma hasn’t been with her youngest son since the fire due to lack of housing. Now he’s home. #home #RV4CampfireFamily #ButteCounty #paradise #campfire #dosomething #family #love #volunteer https://tinyurl.com/y9lajf4d pic.twitter.com/4ggLL3ZrUo",,,#home #RV4CampfireFamily #ButteCounty #paradise #campfire #dosomething #family #love #volunteer,"1100446383901892614",https://twitter.com/RV4CampfireFams/status/1100446383901892614
"Wild Camping International",jlbcenterprises,2019-02-25 11:48,8,28,"Simply the best! #campfire #campfirecooking #outdoorbreakfast #wildcamping pic.twitter.com/QcTArlYcT0",,,#campfire #campfirecooking #outdoorbreakfast #wildcamping,"1100120322379001856",https://twitter.com/jlbcenterprises/status/1100120322379001856
"California FTB",CalFTB,2019-02-25 09:12,13,10,"If you suffered losses from last year's #CampFire, you may be eligible for a deduction on your state income tax return. More info: https://bit.ly/2TdSPbc #Paradise #ButteCounty #California #wildfires #taxes #cagov pic.twitter.com/LU2SM197oj",,,#CampFire #Paradise #ButteCounty #California #wildfires #taxes #cagov,"1100081017036009478",https://twitter.com/CalFTB/status/1100081017036009478
"RedwoodGirl🌹 #MedicareForAllNowCowards",RedwoodGirl,2019-02-25 06:17,7,11,"An excellent #Chico public radio series, After Paradise, has been covering the recovery from the #CampFire. It's rough. Chico's rental housing shortage is at crisis level, some home-owners are not getting their insurance renewed, and most Paradise businesses haven't re-opened. https://twitter.com/nsprnews/status/1098970284365799424 …",,,#Chico #CampFire,"1100036961480241153",https://twitter.com/RedwoodGirl/status/1100036961480241153
"CA Ins. Commish Ricardo Lara",RicardoLara4CA,2019-02-23 12:21,4,12,"Department of #Insurance staff meeting this weekend with #CampFire survivors @ChicoState. Great to have @J_GallagherAD3 here ... Ds and Rs working together to help our community recover pic.twitter.com/53dsAd5piR",,@ChicoState @J_GallagherAD3,#Insurance #CampFire,"1099403828699381760",https://twitter.com/RicardoLara4CA/status/1099403828699381760
"Dr. Sarah E. DeYoung",SarahDeYoung2,2019-02-23 05:10,14,10,"My research team will be in @CountyofButte March 13-14 to interview people and groups who responded to pet rescue and animal reunification during the #Campfire. Please comment if you're interested in sharing your perspective with us. #CampFirePets #EMGTwitter pic.twitter.com/ApJBPBfkBi",,@CountyofButte,#Campfire #CampFirePets #EMGTwitter,"1099295408348692481",https://twitter.com/SarahDeYoung2/status/1099295408348692481
"Aram Fischer",aramfischer,2019-02-22 15:55,9,16,"Shame on @SenFeinstein I'm a constituent and this does not represent me. The climate is an emergency. Did she forget the #CampFire or #WoolseyFire or how sea-level rise impacts CA? And Belittling children?! @IndivisibleSF @IndivisibleTeam @sunrisemvmt want #GreenNewDeal #GNDhttps://twitter.com/_waleedshahid/status/1099076130089459712 …",,@SenFeinstein @IndivisibleSF @IndivisibleTeam @sunrisemvmt,#CampFire #WoolseyFire #GreenNewDeal #GNDhttps,"1099095463150546945",https://twitter.com/aramfischer/status/1099095463150546945
"Doing Things Differently",dtdchange,2019-02-20 17:19,7,11,"After the fire: Murals of hope in Paradise https://www.dw.com/en/after-the-fire-murals-of-hope-in-paradise/g-47530381 … #ParadiseFire #CampFire Last November, the Camp Fire in California killed 86 people. Three months later, the devastated town of Paradise is severely scarred but trying to move on pic.twitter.com/iuH2Dxo5X8",,,#ParadiseFire #CampFire,"1098391604442865664",https://twitter.com/dtdchange/status/1098391604442865664
"Manira Ahmad",ManiraAhmad,2019-02-20 03:57,5,8,"Joining the #Campfire sharing the importance of “putting people first...” Colin’s story is that he wants to be SEEN as an individual ! Our infrastructure, process and systems need to be joined up to support #equaity #DigiHealthAndCare19 #ImprovingLives #WMTY #Digital pic.twitter.com/jGtE441J8o",,,#Campfire #equaity #DigiHealthAndCare19 #ImprovingLives #WMTY #Digital,"1098189864334487555",https://twitter.com/ManiraAhmad/status/1098189864334487555
"Lady V👩‍💻🔥💚",ChaliceGarden,2019-02-19 19:59,14,14,"#CampFire #CampFirePets Updated daily, verified resources: giveaways, housing, $, jobs, food, tools, furniture, supplies, grants, events, mental health, finding pets, volunteer info, more! Please RT! https://docs.google.com/document/d/1sfabgciPL5ci3R3sTaapHibtqkDFURF5Hc8FsetE98Y/ … #ParadiseStrong #Paradise #Chico #DisasterAssistTeam",,,#CampFire #CampFirePets #ParadiseStrong #Paradise #Chico #DisasterAssistTeam,"1098069545812553728",https://twitter.com/ChaliceGarden/status/1098069545812553728
"NVCF",NVCF,2019-02-19 17:56,8,25,"An enormous thank you to @CacheCreekCR for its donation to the #CampFire Relief Fund. Cache Creek's employees and guests donated $200,000 to aid in the relief and recovery effort in Butte County. We appreciate you. pic.twitter.com/C4YhVLjTyI",,@CacheCreekCR,#CampFire,"1098038627374780421",https://twitter.com/NVCF/status/1098038627374780421
"Lady V👩‍💻🔥💚",ChaliceGarden,2019-02-19 01:06,38,31,"Does anyone know Jenny Lyle, #Paradise? Fieldhaven has her rescued #CampFire kitty! Microchipped, but to disconnected landline! Please let her know her cat is #CF553, 530-777-9080! #ParadiseStrong #ButteStrong @ButteSheriff @CountyofButte @paradise_ca @ParadisePost @chicoER RT pic.twitter.com/vWKKEUwqXa",,@ButteSheriff @CountyofButte @paradise_ca @ParadisePost @chicoER,#Paradise #CampFire #CF553 #ParadiseStrong #ButteStrong,"1097784548002213888",https://twitter.com/ChaliceGarden/status/1097784548002213888
"BT21",BT21_,2019-02-19 01:00,37281,173113,"Love you to the moon and back #FullMoon #Camping #Campfire #BT21 pic.twitter.com/olLyyiY0eD",,,#FullMoon #Camping #Campfire #BT21,"1097782860180680705",https://twitter.com/BT21_/status/1097782860180680705
"Tay Austin",Jasamsdestiny,2019-02-18 20:18,30,20,"Gridley #CampFire donation center is in need of pet foods [both cat & dog] along with litter. If you can donate, they're open Tuesdays 10-2pm Thursdays 1-4pm at 893 Hazel St #Gridley #paradise #magalia #concow #yankeehill #paradisefire #campfirepets",,,#CampFire #Gridley #paradise #magalia #concow #yankeehill #paradisefire #campfirepets,"1097711957807898624",https://twitter.com/Jasamsdestiny/status/1097711957807898624
"Mike McGuire",ilike_mike,2019-02-18 20:06,7,55,"Lake County has been through so much over the past four years. And - they continue to step up to help neighbors in need. Big thank you to the Kelseyville Unified School District for raising $2,400 to help Paradise Schools (and kids) get back on their feet from the #CampFire!",,,#CampFire,"1097709033077657600",https://twitter.com/ilike_mike/status/1097709033077657600
"Lady V👩‍💻🔥💚",ChaliceGarden,2019-02-18 11:56,45,25,"Hanging out on #PresidentsDay? 850+ rescued #CampFirePets who survived still waiting for their families, being adopted out now YOU can help reunite from home--it works!! See how here! Pls RT https://datcampfirepets.home.blog/2019/01/10/searchable-database-is-here/ … #CampFirePets #CampFire #animalrescue",,,#PresidentsDay #CampFirePets #CampFirePets #CampFire #animalrescue,"1097585730308587520",https://twitter.com/ChaliceGarden/status/1097585730308587520
"Lee Wardlaw",LeeWardlaw,2019-02-18 05:14,4,23,"184 authors/illustrators have donated copies of their books to help rebuild school libraries destroyed in the Paradise, CA #CampFire. Teachers, librarians, agents, and other kid lit fans have donated too. In March, I'll hand deliver 4,500 books to Paradise! pic.twitter.com/K6B5erojRq",,,#CampFire,"1097484515516108801",https://twitter.com/LeeWardlaw/status/1097484515516108801
"ABC7 Eyewitness News",ABC7,2019-02-17 20:19,48,144,"PARADISE LOST: 100 days after #CampFire, murals by LA artist decorate chimney forest in the ruins of Paradise https://abc7.la/2V2LF6P pic.twitter.com/eABXJmPbGw",,,#CampFire,"1097349846367752192",https://twitter.com/ABC7/status/1097349846367752192
"RV4CampfireFamily",RV4CampfireFams,2019-02-17 19:48,14,25,"James is with whistlebird productions from steamboat CO & he wants to donate his rv and shoot a documentary about the process and the fire recovery to help raise awareness #RV4CampfireFamily #CampFire #Paradise #ButteCounty pic.twitter.com/8eDYxScale",,,#RV4CampfireFamily #CampFire #Paradise #ButteCounty,"1097342082857951233",https://twitter.com/RV4CampfireFams/status/1097342082857951233
"2nd Shift Brewing",2ndshiftbrewing,2019-02-17 06:33,4,26,"Today’s the day! Try 15 STL & surrounding areas delicious versions of @SierraNevada’s Resilience IPA. Tickets are $30 at the door with 100% of the funds going to the Butte Co #campfire relief efforts. Our tasting room will be closed for normal business today pic.twitter.com/2lRbKRmlAb",,@SierraNevada,#campfire,"1097142007963795457",https://twitter.com/2ndshiftbrewing/status/1097142007963795457
"Don Hankins",Pyrogeographer,2019-02-15 20:32,3,17,"Observed fire effects from #CampFire on McNab cypress today. McNab is serotinous (sheds seeds after fire) and is thus fire dependent. Cones have opened and seeds are accumulating on the ground. Interesting to see some fire scars among older stumps. pic.twitter.com/KmOs9sajtq",,,#CampFire,"1096628403959152640",https://twitter.com/Pyrogeographer/status/1096628403959152640
"Chico State",ChicoState,2019-02-15 14:50,17,47,"A once-badly burned bobcat returned to the wild at the Big Chico Creek Ecological Reserve, 2 ½ months after sustaining severe injuries to its paws in the #CampFire: https://bit.ly/2TNtqlO",,,#CampFire,"1096542375315410944",https://twitter.com/ChicoState/status/1096542375315410944
"Ricardo Lara",ICRicardoLara,2019-02-15 11:24,14,18,"100 days after the #CampFire the scale of loss in @paradise_ca is still shocking. This is a must-read remembrance of those who died and a reminder of survivors who are putting their worlds back togetherhttps://twitter.com/JWilliamsAP/status/1096461616911130624 …",,@paradise_ca,#CampFire,"1096490435625791488",https://twitter.com/ICRicardoLara/status/1096490435625791488
"Chief Thom Porter",CALFIRE_CHIEF,2019-02-15 07:38,6,37,"Thank you @GavinNewsom and my partners @CalOES_Dir @CHPCommissioner @GeneralBaldwin for meeting with the communities of Paradise and Magalia. The road continues to recovery and we will be there for all the fire survivors. #CampFire pic.twitter.com/OFJjy5dNlp",,@GavinNewsom @CalOES_Dir @CHPCommissioner @GeneralBaldwin,#CampFire,"1096433561597468672",https://twitter.com/CALFIRE_CHIEF/status/1096433561597468672
"Senator Jim Nielsen",CASenatorJim,2019-02-14 15:58,9,25,"Thank you @GovPressOffice @GavinNewsom for your support of our community. The funding is a great down payment as we start to rebuild. #CampFire #ParadiseStrong pic.twitter.com/y5hZOGI43l",,@GovPressOffice @GavinNewsom,#CampFire #ParadiseStrong,"1096197027044548609",https://twitter.com/CASenatorJim/status/1096197027044548609
"Alley Cat Allies",alleycatallies,2019-02-13 11:41,152,167,"Even though #CampFire, the deadliest fire in California’s history, is no longer in the headlines, the hard work on the ground continues. We’re working with @FieldHaven to rescue cats and reunite them with their families. We need your support now. https://bit.ly/2N63PC6 pic.twitter.com/ffG1vIFQBj",,@FieldHaven,#CampFire,"1095769906216345600",https://twitter.com/alleycatallies/status/1095769906216345600
"George Boustras 🇪🇺",GeorgeBoustras,2019-02-12 12:58,8,30,"I was asked by @TheEconomist to contribute my opinion on the #Worldin2019 and I spoke about the #impacts of #climatechange on the environment. I spoke about recent catastrophes e.g. #Mati #CampFire etc and the need for our #society to play an active role in #prevention. pic.twitter.com/L2FHhgqqia",,@TheEconomist,#Worldin2019 #impacts #climatechange #Mati #CampFire #society #prevention,"1095427012498460674",https://twitter.com/GeorgeBoustras/status/1095427012498460674
"The Sacramento Bee",sacbee_news,2019-02-11 19:25,8,14,"This bobcat was discovered after the #CampFire with its bones visible through the burns on his paws. Now, he's back in the wild and healthy: https://www.sacbee.com/news/state/california/fires/article226108750.html …",,,#CampFire,"1095162027285274624",https://twitter.com/sacbee_news/status/1095162027285274624
"Nik & Marley Cat",ngremmy,2019-02-11 18:21,63,31,"#URGENT #CA #CATS #TeamKittySOS the recovery center for cats rescued from the rubble of the #CampFire needs our help! They are caring for over 100 cats and are desperately hoping to find the families of these cats! PLEASE SHARE! https://www.facebook.com/FieldHaven/ pic.twitter.com/ycdN6uceOO",,,#URGENT #CA #CATS #TeamKittySOS #CampFire,"1095145938278993920",https://twitter.com/ngremmy/status/1095145938278993920
