username,user_handle,date,retweets,favorites,text,geological_location,mentions,hashtags,tweet_id,permalink
"David French",DavidAFrench,2018-02-06 14:40,68,442,"Most ‘Murica thing ever — building a huge rocket and putting a car in orbit. Just because. Most Silicon Valley twist ever — it’s an electric car. #FalconHeavy",,,#FalconHeavy,"961006615725035520",https://twitter.com/DavidAFrench/status/961006615725035520
"DeeboDragon",Deebodragon,2018-02-06 14:40,5,66,"Feeling so accomplished right now but still in shock that this just happened... great job everyone and s/o to @ej_sa @KSpaceAcademy @MatoroIgnika for streaming live #SpaceX #falconheavy #humbled #accomplished #proud #VBI pic.twitter.com/H09kUfxXg0 – at SpaceX",,@ej_sa @KSpaceAcademy @MatoroIgnika,#SpaceX #falconheavy #humbled #accomplished #proud #VBI,"961006591297273856",https://twitter.com/Deebodragon/status/961006591297273856
"Falcon Starman",FalconStarman,2018-02-06 14:39,19,39,"They see me rollin. They hatin. #FalconHeavy #SpaceX #Starman pic.twitter.com/YfH0bYN3Xz",,,#FalconHeavy #SpaceX #Starman,"961006355002941441",https://twitter.com/FalconStarman/status/961006355002941441
"Daniel Fischer",cosmos4u,2018-02-06 14:38,9,31,"As the #FalconHeavy second stage climbs towards apogee, here's another screencap from the webcast https://www.youtube.com/watch?v=aBr2kKAHN6M … -while I'm already wondering what the separation of the Tesla from the stage will look like. And until which distance from Earth the webcast will continue ... pic.twitter.com/apVygmgc8V",,,#FalconHeavy,"961006309574434817",https://twitter.com/cosmos4u/status/961006309574434817
"UCF Football",UCF_Football,2018-02-06 14:38,133,850,"Our backyard >>> #FalconHeavy #UCFinSpace pic.twitter.com/87KICRNclJ",,,#FalconHeavy #UCFinSpace,"961006227944853504",https://twitter.com/UCF_Football/status/961006227944853504
"Make a Difference♻️RT",next2ubb,2018-02-06 14:37,110,31,"Plz, #HELP SAVE my #LIFE I dont want 2bDIE Scared & Alone~ I'm Waiting in MOBILEALABAMA https://www.facebook.com/mobilebaldwincountyurgents/photos/a.587804691272820.1073741828.193102227409737/1622481561138456/?type=3&theater … NeedsRESCUE 4 MED attn FosterPledge NOW #ANIMALSPETS #LOVE #FAMILYTIME #FalconHeavy SpaceX #ThursdayThoughts #BREAKINGNEWS #AL pic.twitter.com/fZ4kQjRoiQ",,,#HELP #LIFE #ANIMALSPETS #LOVE #FAMILYTIME #FalconHeavy #ThursdayThoughts #BREAKINGNEWS #AL,"961005925757865985",https://twitter.com/next2ubb/status/961005925757865985
"xerosome",xerosome,2018-02-06 14:35,71,215,"Starman with one hand on the wheel.. and not a care in the world. #FalconHeavy @elonmusk pic.twitter.com/alHy1E4DyF",,@elonmusk,#FalconHeavy,"961005548362653697",https://twitter.com/xerosome/status/961005548362653697
"Falcon Starman",FalconStarman,2018-02-06 14:35,705,2104,"Name a better selfie. I'll wait. #FalconHeavy #SpaceX #Starman pic.twitter.com/8q7STV2Omv",,,#FalconHeavy #SpaceX #Starman,"961005445958832128",https://twitter.com/FalconStarman/status/961005445958832128
"John Kinsella",johnlkinsella,2018-02-06 14:35,5,17,"2018 version of Blue Marble. Well done @elonmusk. #Spaceman #FalconHeavy pic.twitter.com/RzlvKa9eDa",,@elonmusk,#Spaceman #FalconHeavy,"961005352358744066",https://twitter.com/johnlkinsella/status/961005352358744066
"Workshed Podcast",workshedpod,2018-02-06 14:34,30,109,"Dear #FlatEarth people, can you all kindly please shut up now? Thank you. #FalconHeavy https://www.youtube.com/watch?v=aBr2kKAHN6M … pic.twitter.com/qEwi48ub4W",,,#FlatEarth #FalconHeavy,"961005249434673153",https://twitter.com/workshedpod/status/961005249434673153
"It Can Wait",ItCanWait,2018-02-06 14:34,36,42,"It’s not rocket science. It’s not even auto science. Behind the wheel, everything can wait. #FalconHeavy pic.twitter.com/xyXIDNb6KM",,,#FalconHeavy,"961005226152071168",https://twitter.com/ItCanWait/status/961005226152071168
"Pauline Acalin",w00ki33,2018-02-06 14:34,13,87,"Falcon Heavy TORE UP the sky today. Easily top 3 experiences of my life. SpaceX continues to inspire the world. #spacex #falconheavy pic.twitter.com/WdWc8S3qTb",,,#spacex #falconheavy,"961005163610853377",https://twitter.com/w00ki33/status/961005163610853377
"Cameron Grant",coolcam101,2018-02-06 14:33,6,28,"Aliens are coming! Everybody run! #FalconHeavy #SpaceX pic.twitter.com/kNd60RthRk",,,#FalconHeavy #SpaceX,"961005055020167168",https://twitter.com/coolcam101/status/961005055020167168
"Lord Arse! 🕹️",Lord_Arse,2018-02-06 14:33,33,128,"Yeah, sending a Tesla Roadster into space IS pretty cool @elonmusk but us Brits once sent a meat pie to space. A MEAT... PIE. Well, 29 miles above the earth's piecrust, anyway... #FalconHeavy pic.twitter.com/ebF9S7lxEb",,@elonmusk,#FalconHeavy,"961004926288752640",https://twitter.com/Lord_Arse/status/961004926288752640
"Christina Korp",Xtina_Korp,2018-02-06 14:33,9,81,"THAT. WAS. AWESOME! #falconheavy #spacexhttps://twitter.com/spacex/status/960980119312453632 …",,,#falconheavy #spacexhttps,"961004831858192384",https://twitter.com/Xtina_Korp/status/961004831858192384
"SpaceX SLC 4E",SpaceXSLC4e,2018-02-06 14:32,14,95,"That was the most beautiful thing I have ever seen, and will ever see until the BFR. Congrats SpaceX and amazing work making history today. This day will be long remembered. #FalconHeavy",,,#FalconHeavy,"961004795854143489",https://twitter.com/SpaceXSLC4e/status/961004795854143489
"Sam Anderson",Sam4nd,2018-02-06 14:32,3,152,"Someone slept through the #spacex #falconheavy launch . #mygirl pic.twitter.com/XIKUk4ixcL",,,#spacex #falconheavy #mygirl,"961004743148498944",https://twitter.com/Sam4nd/status/961004743148498944
"GuillaumeTC",GuillaumeTC,2018-02-06 14:32,51,193,"Well done, @elonmusk ! #FalconHeavy #SpaceX pic.twitter.com/3jFGFrpCNF",,@elonmusk,#FalconHeavy #SpaceX,"961004713910120449",https://twitter.com/GuillaumeTC/status/961004713910120449
"Wayward Plane ✈️",WaywardPlane,2018-02-06 14:31,9,60,"Oh. My. God. #falconheavy #feeltheheat #SpaceX pic.twitter.com/doqpoZN77y",,,#falconheavy #feeltheheat #SpaceX,"961004559706591239",https://twitter.com/WaywardPlane/status/961004559706591239
"Steve Davee",sdavee,2018-02-06 14:30,20,72,"#Earthrise images for a new era. Don 't underestimate the inspiration and eduction potential of this fun and silly stunt. Much better than a test weight of concrete blocks :) #FalconHeavy #CenterCore #spaceX #Apollo #makerEd pic.twitter.com/XGIq7x391G",,,#Earthrise #FalconHeavy #CenterCore #spaceX #Apollo #makerEd,"961004211277152256",https://twitter.com/sdavee/status/961004211277152256
"NBC Nightly News with Lester Holt",NBCNightlyNews,2018-02-06 14:30,57,147,"SpaceX's #FalconHeavy rocket nails its maiden test flight: http://nbcnews.to/2nIZFEs @tomcostellonbc will have all the details tonight on @NBCNightlyNews. pic.twitter.com/XQqcMHXrYo",,@tomcostellonbc @NBCNightlyNews,#FalconHeavy,"961004085297033216",https://twitter.com/NBCNightlyNews/status/961004085297033216
"Jason Grey",jasngrey,2018-02-06 14:29,1261,3265,"The scale just makes everything more impressive. #FalconHeavy pic.twitter.com/FiNdn6Oc36",,,#FalconHeavy,"961004044234915840",https://twitter.com/jasngrey/status/961004044234915840
"Bruce Hockin",Lardinio,2018-02-06 14:29,40,115,"Watching these rockets land is like something outta a Sci-Fi movie. Truly outstaning achievement #falconheavy #spacex pic.twitter.com/meQajLA1oa",,,#falconheavy #spacex,"961004004686823424",https://twitter.com/Lardinio/status/961004004686823424
"Make a Difference♻️RT",next2ubb,2018-02-06 14:29,160,60,"#HELPRT #Dogs Waiting in MOBILEALABAMA https://www.facebook.com/pg/mobilebaldwincountyurgents/posts/?ref=page_internal … SAVE-a- #LIFE b4PTS We dont want 2 DIEScared & Alone~ Take Us HOME~ a RESCUE FosterPledge #ANIMALSPETS #LOVE #FAMILYTIME #FalconHeavy SpaceX #ThursdayThoughts #BREAKINGNEWS #AL pic.twitter.com/CH4Vp8HJt3",,,#HELPRT #Dogs #LIFE #ANIMALSPETS #LOVE #FAMILYTIME #FalconHeavy #ThursdayThoughts #BREAKINGNEWS #AL,"961003925662044160",https://twitter.com/next2ubb/status/961003925662044160
"Center Core",FalconMainCore,2018-02-06 14:28,47,241,"Let's reinstate Pluto as a planet, and then we'll get serious about me coming back. #PlutoPlanet #FalconHeavy",,,#PlutoPlanet #FalconHeavy,"961003719675572225",https://twitter.com/FalconMainCore/status/961003719675572225
"~Marietta",MariettaDaviz,2018-02-06 14:26,86,224,"#FalconHeavy SpaceX Rocket Sent a Tesla To Mars With a Spacesuit Mannequin Named Starman In Drivers Seat. A David Bowie’s Song 'Life on Mars' Playing on Repeat. The Car Will Take at Least Six Months to Travel The 200 Million Miles to Mars & Just Hours To Be Sick Of The Song. pic.twitter.com/6FQvLNF8uj",,,#FalconHeavy,"961003297380454400",https://twitter.com/MariettaDaviz/status/961003297380454400
"AJarOfMayo",_AJarOfMayo_,2018-02-06 14:26,52,174,"This is truly breath taking.. #FalconHeavy pic.twitter.com/JerwiZa5eG",,,#FalconHeavy,"961003121903394816",https://twitter.com/_AJarOfMayo_/status/961003121903394816
"Tommy 🐝",ThomasMoszczuk,2018-02-06 14:26,25,50,"People tryna prove the Earth is flat... while we outchea launching cars into space. #FalconHeavy pic.twitter.com/cFfwg2EDnL",,,#FalconHeavy,"961003089493884940",https://twitter.com/ThomasMoszczuk/status/961003089493884940
"Giorgio Attorresi",scidox,2018-02-06 14:25,18,79,"So Long, and Thanks for All the Fish #FalconHeavy pic.twitter.com/0NT4ySzcpQ",,,#FalconHeavy,"961002967959777280",https://twitter.com/scidox/status/961002967959777280
"Safwan AhmedMia",SuperSaf,2018-02-06 14:25,850,6952,"The Starman is super cool, but imagine if they gave him a flamethrower? #FalconHeavy pic.twitter.com/1B1bWNcRYI",,,#FalconHeavy,"961002946417905666",https://twitter.com/SuperSaf/status/961002946417905666
"Kristin Fisher",KristinFisher,2018-02-06 14:25,7,126,"Bummed I couldn’t be there. But we did dress the part for our private #SpaceX #FalconHeavy launch party pic.twitter.com/fOY8LrkIsb",,,#SpaceX #FalconHeavy,"961002942794002434",https://twitter.com/KristinFisher/status/961002942794002434
"Kevin McCarthy",GOPLeader,2018-02-06 14:25,43,150,"Ingenuity has helped push commercial space flight innovators to new heights. Congrats to @SpaceX on their historic launch today. Godspeed Starman! #FalconHeavy https://www.pscp.tv/SpaceX/1DXxyXggQenJM …",,@SpaceX,#FalconHeavy,"961002883704606720",https://twitter.com/GOPLeader/status/961002883704606720
"Ars Technica",arstechnica,2018-02-06 14:25,95,298,"The #FalconHeavy tl;dr as of now? A payload into orbit, a dramatic side-by-side landing along the Florida coast, and you can still livestream the freakin' Starman / Tesla Roadster as it soars through the cosmos. Bravo, #SpaceX https://arstechnica.com/science/2018/02/watch-live-spacexs-colossal-falcon-heavy-may-finally-fly-today/ … pic.twitter.com/Eoe9bBVXsg",,,#FalconHeavy #SpaceX,"961002854122246145",https://twitter.com/arstechnica/status/961002854122246145
"Kevin M. Gill",kevinmgill,2018-02-06 14:24,73,250,"Just for fun: Stitched a bunch of frames together of #Starman and @elonmusk's car with a full horizon view of Earth #FalconHeavy #SpaceX pic.twitter.com/cvkuabUa5a",,@elonmusk,#Starman #FalconHeavy #SpaceX,"961002756143108102",https://twitter.com/kevinmgill/status/961002756143108102
"Starman",SpaceX_Starman,2018-02-06 14:24,166,526,"I wish I could have the same with Mars. #FalconHeavy pic.twitter.com/rKUAwE2TzW",,,#FalconHeavy,"961002614203801600",https://twitter.com/SpaceX_Starman/status/961002614203801600
"Falcon Starman",FalconStarman,2018-02-06 14:23,41,86,"Oh, btw. Earth is round. Confirmed. #FalconHeavy #SpaceX #Starman pic.twitter.com/GjO9iIGvXf",,,#FalconHeavy #SpaceX #Starman,"961002504845774848",https://twitter.com/FalconStarman/status/961002504845774848
"Ezra",sosoftwaredev,2018-02-06 14:23,160,141,"If the #centercore comes back I'll buy a beer for everyone that retweets this. #FalconHeavy",,,#centercore #FalconHeavy,"961002483349823489",https://twitter.com/sosoftwaredev/status/961002483349823489
"🍑Mayor Pete Bootyjig🍑",Ericrules4real,2018-02-06 14:23,33,202,"Prediction: Trump will take credit for the #FalconHeavy launch and landing of the side cores, but the #CenterCore was all Obama.",,,#FalconHeavy #CenterCore,"961002389284245504",https://twitter.com/Ericrules4real/status/961002389284245504
"Toby Turner",TobyTurner,2018-02-06 14:23,72,405,"There is now a mannequin driving a Tesla to Mars. And it’s only Tuesday. #spacex #falconheavy pic.twitter.com/7TjYy1cDDK",,,#spacex #falconheavy,"961002355503202304",https://twitter.com/TobyTurner/status/961002355503202304
"Elena.",HelenRosenrot,2018-02-06 14:22,37,155,"The future is now #FalconHeavy #SpaceX pic.twitter.com/XuxABIGgVw",,,#FalconHeavy #SpaceX,"961002272628101120",https://twitter.com/HelenRosenrot/status/961002272628101120
"Abby Garrett",abbygarrettX,2018-02-06 14:21,29,132,"Beyond beautiful and beyond words. Still can’t believe I witnessed it. Photo by Tom Cross of @teslarati #spacex #falconheavy pic.twitter.com/suNppKfJZx",,@teslarati,#spacex #falconheavy,"961001841940197376",https://twitter.com/abbygarrettX/status/961001841940197376
"Liam Dutton - Weatherman",liamdutton,2018-02-06 14:20,41,111,"This is awesome! A mannequin, sitting in a Tesla sports car, wearing a space suit, orbiting earth right now - and you can watch it live - https://youtu.be/aBr2kKAHN6M #spacex #falconheavy pic.twitter.com/6vnyuUGSqa",,,#spacex #falconheavy,"961001695974215680",https://twitter.com/liamdutton/status/961001695974215680
"Just A. Tinker",John_Gardi,2018-02-06 14:19,42,70,"#SpaceX Fans How cool is this! These are views from @elonmusk's CAR! #FalconHeavy #FalconHeavyLaunch #RoadsterToMars pic.twitter.com/fQCK0JMZ94",,@elonmusk,#SpaceX #FalconHeavy #FalconHeavyLaunch #RoadsterToMars,"961001496514088960",https://twitter.com/John_Gardi/status/961001496514088960
"Nat Geo Channel",NatGeoChannel,2018-02-06 14:19,98,562,"We found it. #FalconHeavy pic.twitter.com/AuArucx2Xt",,,#FalconHeavy,"961001423633899520",https://twitter.com/NatGeoChannel/status/961001423633899520
"Bill Doran",chinbeard,2018-02-06 14:19,9,143,"Holy shit this is amazing. #SpaceX #FalconHeavy pic.twitter.com/pJcLcRH96n",,,#SpaceX #FalconHeavy,"961001331174522880",https://twitter.com/chinbeard/status/961001331174522880
"Sean Kent",seankent,2018-02-06 14:17,29,120,"How effing rich do you have to be to shoot a car that most people can’t afford into space just because you can? Elon Musk is annoying af. #Starman #FalconHeavy pic.twitter.com/O2H3ymjSgy",,,#Starman #FalconHeavy,"961000925249916928",https://twitter.com/seankent/status/961000925249916928
"Motherboard",motherboard,2018-02-06 14:17,19,72,"Check out these amazing photos from the ground at the SpaceX Falcon Heavy launch http://bit.ly/2GV8Ae8 #FalconHeavy pic.twitter.com/lyOCDqT4LE",,,#FalconHeavy,"961000865921462272",https://twitter.com/motherboard/status/961000865921462272
"EVE Online",EveOnline,2018-02-06 14:16,39,248,"Heartfelt congratulations to SpaceX and the residents of Earth! #FalconHeavy #tech2landinghttps://twitter.com/SpaceX/status/960980119312453632 …",,,#FalconHeavy #tech2landinghttps,"961000737659674624",https://twitter.com/EveOnline/status/961000737659674624
"DIM",ThisIsDIM,2018-02-06 14:16,11,59,"It's out of this world being able to see the reflection of the Earth on the hood of a @Tesla. #FalconHeavy https://www.youtube.com/watch?v=aBr2kKAHN6M … pic.twitter.com/ZIM6Vm0zxy",,@Tesla,#FalconHeavy,"961000708542779392",https://twitter.com/ThisIsDIM/status/961000708542779392
"Felix Hagnö",skier1,2018-02-06 14:16,371,1241,"Photo of the year? #FalconHeavy @elonmusk pic.twitter.com/alNlhQWnWR",,@elonmusk,#FalconHeavy,"961000630629302273",https://twitter.com/skier1/status/961000630629302273
"Gen. Jay Raymond",AFSpaceCC,2018-02-06 14:16,429,4160,"Wow! @SpaceX just showed us how space can still inspire and thrill us all. Congrats to the whole launch team @45thSpaceWing @AF_SMC @NASAKennedy @Tesla #FalconHeavy. If #Starman gets back to Earth, he’s got a job with @AFSpace! #DontPanic pic.twitter.com/cSlRYfOKMs",,@SpaceX @45thSpaceWing @AF_SMC @NASAKennedy @Tesla @AFSpace,#FalconHeavy #Starman #DontPanic,"961000550216151041",https://twitter.com/AFSpaceCC/status/961000550216151041
"Dixie Chicks",dixiechicks,2018-02-06 14:15,39,320,"Seems appropriate for today - congrats @SpaceX! #FalconHeavy pic.twitter.com/FK5jkRZUUJ",,@SpaceX,#FalconHeavy,"961000470872342529",https://twitter.com/dixiechicks/status/961000470872342529
"Matt Reagan",ReaganMatt,2018-02-06 14:15,23,75,"Now I know what they mean when they say Welcome to the Future. #FalconHeavy #Space pic.twitter.com/Tah7VTs8dG",,,#FalconHeavy #Space,"961000462202888192",https://twitter.com/ReaganMatt/status/961000462202888192
"Catherine Q.",CatherineQ,2018-02-06 14:15,37,168,"I cannot stop watching. #FalconHeavy pic.twitter.com/m61kSVQVva",,,#FalconHeavy,"961000427415330817",https://twitter.com/CatherineQ/status/961000427415330817
"Jack Fischer",Astro2fish,2018-02-06 14:15,32,314,"Congrats @SpaceX for an epic #FalconHeavy demo slathered in awesome sauce - that was amazing! https://twitter.com/spacex/status/960980119312453632 …",,@SpaceX,#FalconHeavy,"961000358460960771",https://twitter.com/Astro2fish/status/961000358460960771
"Space Explorer Mike",MichaelGalanin,2018-02-06 14:14,273,1077,"Currently over Australia #elonmusk #spacex #falconheavy pic.twitter.com/bBAgAMzWVa",,,#elonmusk #spacex #falconheavy,"961000051869978625",https://twitter.com/MichaelGalanin/status/961000051869978625
"Tony Shepherd",tonysheps,2018-02-06 14:13,14,139,"Well they’ve certainly raised the bar for this new series of Top Gear! #FalconHeavy pic.twitter.com/DRbm52xU0v",,,#FalconHeavy,"961000031863132160",https://twitter.com/tonysheps/status/961000031863132160
"MOTHER OF KITTENS BREAKER OF WIND",Maeganerd,2018-02-06 14:13,47,289,"I for one would love to watch the center core landing (crashing), even if it is a spectacular failure. Because science is like drinking tequila. Some lessons you have to learn the hard way. #FalconHeavy #CenterCore",,,#FalconHeavy #CenterCore,"961000012246409218",https://twitter.com/Maeganerd/status/961000012246409218
"Dr Lauren Gavaghan",DancingTheMind,2018-02-06 14:13,26,84,"From #Suffragette100 to #FalconHeavy all in one day. Mind officially blown. pic.twitter.com/fKWaI5rwsN",,,#Suffragette100 #FalconHeavy,"960999972471701504",https://twitter.com/DancingTheMind/status/960999972471701504
"Senator Bill Nelson",SenBillNelson,2018-02-06 14:12,83,300,"Today’s test launch of the #FalconHeavy is a spectacular demonstration of the comeback of Florida’s Space Coast, which is succeeding in a big way. It’s good news for our space program. It's good news for national security. And it's great news for jobs and the economy. pic.twitter.com/NiBgfWcybE",,,#FalconHeavy,"960999763427627009",https://twitter.com/SenBillNelson/status/960999763427627009
"Thomas Helland-Hansen, aka jævla sosialist",SosialistThomas,2018-02-06 14:12,508,1605,"1980's; i bet we'll have flying cars in the future 2018: #FalconHeavy pic.twitter.com/Lv9h8a3ru3",,,#FalconHeavy,"960999739188801536",https://twitter.com/SosialistThomas/status/960999739188801536
"News from Science",NewsfromScience,2018-02-06 14:12,34,60,"How could #FalconHeavy boost the future of space science? We took a look last month: http://scim.ag/2E4NxEL",,,#FalconHeavy,"960999694984982529",https://twitter.com/NewsfromScience/status/960999694984982529
"Martin Hamilton",martin_hamilton,2018-02-06 14:12,17,24,"If you're hankering for a bit more #FalconHeavy action, catch the Roadster live stream http://youtu.be/aBr2kKAHN6M #OccupyMars pic.twitter.com/acgqp2bsvn",,,#FalconHeavy #OccupyMars,"960999616534794240",https://twitter.com/martin_hamilton/status/960999616534794240
"Dianna Cowern",thephysicsgirl,2018-02-06 14:11,308,1322,"Excuse me for a moment, that’s the reflection of EARTH OFF THE SIDE OF A CAR. #FalconHeavy pic.twitter.com/iCHC1YX52X",,,#FalconHeavy,"960999452826681350",https://twitter.com/thephysicsgirl/status/960999452826681350
"Starman",SpaceX_Starman,2018-02-06 14:11,642,1419,"Now let's talk seriously. TAKE CARE OF YOUR PLANET. Alright? Promise me. Please, promise me. #FalconHeavy pic.twitter.com/2fhoM0PlDT",,,#FalconHeavy,"960999428147605504",https://twitter.com/SpaceX_Starman/status/960999428147605504
"JBrown",GameJammer,2018-02-06 14:10,15,72,"Never thought id get to see how the Earth looks reflected through a car's body work #FalconHeavy pic.twitter.com/vmfmdvYNJQ",,,#FalconHeavy,"960999136450531329",https://twitter.com/GameJammer/status/960999136450531329
"WIRED",WIRED,2018-02-06 14:10,152,330,"Here's everything you need to know about that epic #FalconHeavy launch: https://www.wired.com/story/spacex-successfully-launches-the-falcon-heavyand-elon-musks-roadster/ …https://twitter.com/nova_road/status/960990126867472384 …",,,#FalconHeavy,"960999090438914049",https://twitter.com/WIRED/status/960999090438914049
"Infinity Cosmos™",astrography__,2018-02-06 14:10,23,74,"Another Big Leap in Space travel Elon Musk’s @spacex just had its successful Launch of Falcon Heavy Congratulations to @elonmusk and all Space Enthusiasts #space #spacex #rocket #falconheavy #falconheavylaunch #nasa pic.twitter.com/QqfvDnSWZv",,@spacex @elonmusk,#space #spacex #rocket #falconheavy #falconheavylaunch #nasa,"960999067978379264",https://twitter.com/astrography__/status/960999067978379264
"Anas Tipu",teepusahab,2018-02-06 14:10,25,102,"The roadster has 'DONT PANIC' sign too in case the dummy Starman opens his eyes. THIS IS NOT PHOTOSHOPPED #FalconHeavy pic.twitter.com/cRshwkY420",,,#FalconHeavy,"960999067881963520",https://twitter.com/teepusahab/status/960999067881963520
"Mary E. McGlynn",MaryEMcGlynn,2018-02-06 14:10,88,775,"I'm still weeping. Thank you for the amazing show, @elonmusk and cheers to all the scientists at @SpaceX for this stunning lift off and landing of the Falcons. Fair winds, Starman. #LifeOnMars #FalconHeavy pic.twitter.com/KAwptfeNyO",,@elonmusk @SpaceX,#LifeOnMars #FalconHeavy,"960999043475238912",https://twitter.com/MaryEMcGlynn/status/960999043475238912
"NOAA Satellites PA",NOAASatellitePA,2018-02-06 14:09,64,146,"From space, NOAA's #GOES16 caught from smoke from the #FalconHeavy launch today, Feb. 6, 2018. The images were capture between 3:42 and 3:47 pm EST pic.twitter.com/GZarjJpRZ8",,,#GOES16 #FalconHeavy,"960998944359747584",https://twitter.com/NOAASatellitePA/status/960998944359747584
"Starman",SpaceX_Starman,2018-02-06 14:09,78,335,"Too bad I didn't bring my sunglasses #FalconHeavy pic.twitter.com/8vuWDW7HyY",,,#FalconHeavy,"960998883399798784",https://twitter.com/SpaceX_Starman/status/960998883399798784
"Vlad ⚜",Vlad94i,2018-02-06 14:08,158,454,"Her: Babe, come over Me: But you're on Mars Her: My parents aren't home Me: #FalconHeavy #SpaceX pic.twitter.com/qqKjfziSiX",,,#FalconHeavy #SpaceX,"960998706630856705",https://twitter.com/Vlad94i/status/960998706630856705
"Dark Mode Dave",davemark,2018-02-06 14:08,33,82,"A picture of two side boosters successfully landing. Simultaneously. I find that amazing. An engineering marvel. #FalconHeavy pic.twitter.com/yvpRVySStd",,,#FalconHeavy,"960998704743374849",https://twitter.com/davemark/status/960998704743374849
"Nathan Moeller 🇺🇸",TheAstroN8,2018-02-06 14:08,8,28,"One small step for mannequin, one giant leap for mannequin kind. #FalconHeavy https://twitter.com/theastron8/status/960995835902382081 …",,,#FalconHeavy,"960998581170790401",https://twitter.com/TheAstroN8/status/960998581170790401
"Steven Bontenbal",StevenBontenbal,2018-02-06 14:07,87,345,"new on @ebay: 1 center core, f9h compatible. Kinda wet check out my other listings too #centercore #falconheavy pic.twitter.com/UPjeTDdHOk",,@ebay,#centercore #falconheavy,"960998499797143552",https://twitter.com/StevenBontenbal/status/960998499797143552
"Dr Lauren Gavaghan",DancingTheMind,2018-02-06 14:07,15,90,"Elon Musk. An immigrant from South Africa. Can’t wait to hear what #covfefe has to say about that. #FalconHeavy",,,#covfefe #FalconHeavy,"960998495162372096",https://twitter.com/DancingTheMind/status/960998495162372096
"Richard Dawkins Foundation for Reason & Science",rdfrs,2018-02-06 14:07,133,516,". @SpaceX accomplished an unprecedented and historic feat by simultaneously landing two of the #FalconHeavy cores today. pic.twitter.com/XffdR7xiQ1",,@SpaceX,#FalconHeavy,"960998454746021888",https://twitter.com/rdfrs/status/960998454746021888
"frheisenberg",frheisenberg13,2018-02-06 14:07,39,135,"Well, that escalated quickly. #DontPanic #Starman #SpaceX #Tesla #FalconHeavy #ElonMusk pic.twitter.com/xLIMklxImk",,,#DontPanic #Starman #SpaceX #Tesla #FalconHeavy #ElonMusk,"960998451067674624",https://twitter.com/frheisenberg13/status/960998451067674624
"Center Core",FalconMainCore,2018-02-06 14:07,15,105,"The Illuminati are definitely NOT responsible. #FalconHeavyTruth #FalconHeavy",,,#FalconHeavyTruth #FalconHeavy,"960998372336459777",https://twitter.com/FalconMainCore/status/960998372336459777
"Katie Diamond",KatieMcDiamond,2018-02-06 14:06,13,124,"Whoa. LIVE view of the Tesla in space! That #FalconHeavy launch was incredible!!! https://www.youtube.com/watch?v=aBr2kKAHN6M&sns=tw … via @youtube",,@youtube,#FalconHeavy,"960998062167506944",https://twitter.com/KatieMcDiamond/status/960998062167506944
"Jo Ⓥ",PhoenixJo47,2018-02-06 14:06,48,303,"Everyone refreshing Twitter until we get news of #CenterCore #FalconHeavy pic.twitter.com/RGNrCZpR95",,,#CenterCore #FalconHeavy,"960998057549713408",https://twitter.com/PhoenixJo47/status/960998057549713408
"Imgur",imgur,2018-02-06 14:05,92,427,"Dude. https://imgur.com/gallery/Xhlo5 #FalconHeavy pic.twitter.com/PrMvKlDH0h",,,#FalconHeavy,"960997929522638848",https://twitter.com/imgur/status/960997929522638848
