username,user_handle,date,retweets,favorites,text,geological_location,mentions,hashtags,tweet_id,permalink
"Michael Baylor",nextspaceflight,2019-05-10 14:43,14,136,"SpaceX says that they are targeting no-earlier than June 22nd for the launch of #FalconHeavy with STP-2 from Kennedy Space Center's LC-39A.",,,#FalconHeavy,"1126965969434234880",https://twitter.com/nextspaceflight/status/1126965969434234880
"Chris G - NSF",ChrisG_NSF,2019-05-06 14:34,29,122,"Have you ever wanted to see a #FalconHeavy launch up close and personal? Well @NASA is giving you that chance with the 3rd Falcon Heavy launch of #STP2 this summer! Apply through @NASASocial here:https://www.nasa.gov/social/spacex-falcon-heavy-launch …",,@NASA @NASASocial,#FalconHeavy #STP2,"1125514190091956224",https://twitter.com/ChrisG_NSF/status/1125514190091956224
"Murfam Post📷🎥🖋",Restrantek,2019-05-05 05:12,18,98,"Battle of the cranes. Present and future. #SpaceX may have hired the ports $6 Million Crane for off loading the #Starlink or #FalconHeavy booster next. pic.twitter.com/Vpao3gZWh7",,,#SpaceX #Starlink #FalconHeavy,"1125010251458199555",https://twitter.com/Restrantek/status/1125010251458199555
"Pauline Acalin",w00ki33,2019-05-03 16:26,34,416,"One of my remote cams grabbed a sunset shot the evening before Falcon Heavy liftoff. 4/10 #arabsat6a #spacex #falconheavy @MiopsTrigger #sunset pic.twitter.com/aDTvdp9xb0",,@MiopsTrigger,#arabsat6a #spacex #falconheavy #sunset,"1124455325669576705",https://twitter.com/w00ki33/status/1124455325669576705
"Tom McCool",Cygnusx112,2019-05-01 13:38,23,234,"The damaged #FalconHeavy core booster has been moved a few hundred yards, engine covers put on along with a tarp. #SpaceX #SpaceCoast pic.twitter.com/T36Hj2HJUc",,,#FalconHeavy #SpaceX #SpaceCoast,"1123688252106584064",https://twitter.com/Cygnusx112/status/1123688252106584064
"The Futurist 🚀",TheFuturist007,2019-04-29 06:52,111,207,"'Aerojet' is using 3D-printing to manufacture rocket engines, thereby reducing costs by over 25% @SpaceX @ElonMusk #NASA #Mars #Engineering #technology #innovation #FalconHeavy #starlink #3Dprinting pic.twitter.com/iVppx5tRiP",,@SpaceX @ElonMusk,#NASA #Mars #Engineering #technology #innovation #FalconHeavy #starlink #3Dprinting,"1122861108421976065",https://twitter.com/TheFuturist007/status/1122861108421976065
"Stan Shull",stanshull,2019-04-27 09:45,89,461,"Are you ready for Lightsail 2? Launch on @SpaceX #FalconHeavy as soon as late June. Go @exploreplanets! pic.twitter.com/8zC3mQWiZv",,@SpaceX @exploreplanets,#FalconHeavy,"1122180014814846978",https://twitter.com/stanshull/status/1122180014814846978
"Tom McCool",Cygnusx112,2019-04-25 13:28,76,408,"The damaged #SpaceX booster from #FalconHeavy is now sitting on the dock next to OCISLY. pic.twitter.com/d3AtEB9JG7",,,#SpaceX #FalconHeavy,"1121511415783809025",https://twitter.com/Cygnusx112/status/1121511415783809025
"Everyday Astronaut",Erdayastronaut,2019-04-23 15:06,36,593,"I’m going over some B-Roll from #FalconHeavy and noticed something on the fairing that I missed in real life. Didn’t honestly notice it!!! Crazy! Thanks for your help @andrutay pic.twitter.com/qSxvBLqK7s",,@andrutay,#FalconHeavy,"1120811106275090432",https://twitter.com/Erdayastronaut/status/1120811106275090432
"Evan Kirstel",evankirstel,2019-04-21 00:31,70,99,"The HASSELL design for a Mars N Habitat has reached the final 10 of NASA's 3D Printing Centennial Challenge. #mars #elonmusk #falconheavy #NASA #eso #blackhole #nasajpl #isro #physics #Chemistry #asrtonomy #photo #photography #beauty #space #science #art #Nature #amazing #spacex pic.twitter.com/nGhQEzy9HS",,,#mars #elonmusk #falconheavy #NASA #eso #blackhole #nasajpl #isro #physics #Chemistry #asrtonomy #photo #photography #beauty #space #science #art #Nature #amazing #spacex,"1119866193261809664",https://twitter.com/evankirstel/status/1119866193261809664
"Julia [SCLA]",julia_bergeron,2019-04-20 07:05,36,231,"I spy a #FalconHeavy center core still sitting on OCISLY today. There is not a person to be seen at the docks so they are either formulating a plan for transport or just enjoying a day off. #SpaceX pic.twitter.com/9wltX4RUyO",,,#FalconHeavy #SpaceX,"1119603119908904960",https://twitter.com/julia_bergeron/status/1119603119908904960
"Richard",RDAnglePhoto,2019-04-18 20:25,86,259,"The #FalconHeavy center core is lifted off the deck of #OCISLY to help with the removal of the last landing leg. Could hear the crunch as it set back down with the leg being put in the wrong position. It was still on board by time I left. #SpaceXFleet @SpaceXFleet pic.twitter.com/zYpEQLGzLd",,@SpaceXFleet,#FalconHeavy #OCISLY #SpaceXFleet,"1119079548782567425",https://twitter.com/RDAnglePhoto/status/1119079548782567425
"Tom McCool",Cygnusx112,2019-04-18 16:44,29,149,"Easy to tell what direction the booster fell with four damaged engine bells. #SpaceX #FalconHeavy pic.twitter.com/qErVfLBEYJ",,,#SpaceX #FalconHeavy,"1119023983360380928",https://twitter.com/Cygnusx112/status/1119023983360380928
"LikeTesla",LikeTeslaKim,2019-04-18 08:50,12,148,"Can’t believe its been a week since the Falcon Heavy launch & to celebrate we‘re posting our video. SO much good behind the scenes with the Tesla community in this vid. Go watch & tag someone you recognize! #LikeTesla #Tesla #SpaceX #FalconHeavy LINK: https://youtu.be/LbiI0rYrcZo pic.twitter.com/bOgHCzyr2n",,,#LikeTesla #Tesla #SpaceX #FalconHeavy,"1118904757995941889",https://twitter.com/LikeTeslaKim/status/1118904757995941889
"Michael Seeley",Mike_Seeley,2019-04-18 07:38,84,404,"And then the view of the #SpaceXFleet from @Explorationtwr observation deck: Look closely & in addition to the #FalconHeavy center core you can find the #Arabsat6A fairing halves & a #Dragon capsule all while the VAB @KSC looks on. (Pics: me / @WeReportSpace) pic.twitter.com/sSA1rXZw6j",,@Explorationtwr @KSC @WeReportSpace,#SpaceXFleet #FalconHeavy #Arabsat6A #Dragon,"1118886474852835328",https://twitter.com/Mike_Seeley/status/1118886474852835328
"Michael Seeley",Mike_Seeley,2019-04-18 06:28,46,219,"The #SpaceX recovery team has been busy this AM: one of the legs was just removed from the #FalconHeavy center core, tipped over (and shortened) in high seas on the deck of the OCISLY. The #SpaceXFleet slipped in to @PortCanaveral @2am. (Pics: me / @WeReportSpace) pic.twitter.com/jDvnmJDcVZ",,@PortCanaveral @2am @WeReportSpace,#SpaceX #FalconHeavy #SpaceXFleet,"1118869001579520000",https://twitter.com/Mike_Seeley/status/1118869001579520000
"Julia [SCLA]",julia_bergeron,2019-04-17 23:33,41,332,"Poor #Arabsat6A booster has finally made it home. #SpaceXFleet #FalconHeavy pic.twitter.com/GBNx6cVSFR",,,#Arabsat6A #SpaceXFleet #FalconHeavy,"1118764524557959168",https://twitter.com/julia_bergeron/status/1118764524557959168
"Michael Seeley",Mike_Seeley,2019-04-17 07:16,24,184,"The #SpaceX #ArabSat6a #FalconHeavy roll maneuver in sequence (and w/ motion). (Rocket by @elonmusk; pics by me; animation by @Plotaverse, inspired by @_TomCross_’s amazing launch animation.) pic.twitter.com/zaS7JGYzKb",,@elonmusk @Plotaverse @_TomCross_,#SpaceX #ArabSat6a #FalconHeavy,"1118518571418771457",https://twitter.com/Mike_Seeley/status/1118518571418771457
"William",WTMPhoto,2019-04-17 06:35,16,181,"Seems I never posted any of my #FalconHeavy launch photos from #arabsat-6a. Here's my favorite, shot on kodak #Ektar 100. Only 36 exposures to work with and even with launch being delayed, my Miops got the shot (no false triggers). *scanned w/ minimal edits (shadows/sharpness) pic.twitter.com/IDt3tidIxP",,,#FalconHeavy #arabsat #Ektar,"1118508403066920960",https://twitter.com/WTMPhoto/status/1118508403066920960
"Emre Kelly",EmreKelly,2019-04-15 14:08,47,247,"SpaceX confirms: #FalconHeavy core stage will not make it back to Port Canaveral due to rough seas. The “Octagrabber” / robot designed to secure stages isn’t (yet) compatible with FH cores, so it wasn’t used — but will be in the future.",,,#FalconHeavy,"1117897544422395905",https://twitter.com/EmreKelly/status/1117897544422395905
"Kerbal Space Academy",KSpaceAcademy,2019-05-15 09:26,15,53,"Standing Next to Launchpads: almost 2 hours of footage hanging out at various spots around SpaceX #FalconHeavy before #Arabsat6A launch. Live chat Q&A by @ChrisG_NSF of @NASASpaceflight... quite a field trip!https://youtu.be/erV_ScyZKyE",,@ChrisG_NSF @NASASpaceflight,#FalconHeavy #Arabsat6A,"1128698230311661568",https://twitter.com/KSpaceAcademy/status/1128698230311661568
"Chris G - NSF",ChrisG_NSF,2019-05-13 07:53,8,65,"This was SO much fun! Get ready for a great #FalconHeavy BTS treat today! https://twitter.com/KSpaceAcademy/status/1127947878230523904 …",,,#FalconHeavy,"1127950120564162560",https://twitter.com/ChrisG_NSF/status/1127950120564162560
"Sandy Athey",sandra_athey,2019-05-10 06:15,2,37,"I’m applying today to #NASAsocial for the @SpaceX #falconheavy launch on June 22! Admin has offered to pay for the trip if I’m selected & I will be sharing my experience with more than 2,600 staff and students in my school. I’ll be seeing this building again soon!!! @nasa pic.twitter.com/7aD8qOuHme",,@SpaceX @nasa,#NASAsocial #falconheavy,"1126838057313947648",https://twitter.com/sandra_athey/status/1126838057313947648
"K. Scott Piel",spiel2001,2019-05-10 04:12,8,57,"#SpaceX #FalconHeavy pierces the clouds on its maiden flight pic.twitter.com/ocYRBucyth",,,#SpaceX #FalconHeavy,"1126807138918072323",https://twitter.com/spiel2001/status/1126807138918072323
"Erik Kuna 🚀",erikkuna,2019-05-08 06:44,5,38,"#photoshopmath - took another image sequence of the #falconheavy into #photoshop and ran some statistics to create this image. Love how it adds the sense of motion in single frame that mirrors the beauty of these launches What do you think? Photo credit: @erikkuna pic.twitter.com/uvpIfbkdRV",,@erikkuna,#photoshopmath #falconheavy #photoshop,"1126120648806424576",https://twitter.com/erikkuna/status/1126120648806424576
"Heather D. Smith 🚀",TheHeathernaut,2019-05-07 10:31,16,81,"Apply to #NASASocial and your life will change. Period. #FalconHeavy https://twitter.com/NASASocial/status/1125476186363133952 …",,,#NASASocial #FalconHeavy,"1125815454323421184",https://twitter.com/TheHeathernaut/status/1125815454323421184
"Rocket Rundown",RocketRundown,2019-05-06 04:30,7,34,"Touchdown. The central core of the #FalconHeavy that launched the Arabsat-6A satellite in April touches down on the Of Course I Still Love You @SpaceX droneship. Credit: #SpaceX pic.twitter.com/sqDkm8Uhol",,@SpaceX,#FalconHeavy #SpaceX,"1125362148434169856",https://twitter.com/RocketRundown/status/1125362148434169856
"Pauline Acalin",w00ki33,2019-05-05 11:31,4,106,"Post-launch dystopia. #spacex #falconheavy #Arabsat6A pic.twitter.com/nnbeSzn6CV",,,#spacex #falconheavy #Arabsat6A,"1125105716371513344",https://twitter.com/w00ki33/status/1125105716371513344
"Tessa McEvoy",Dizbiz15,2019-05-02 22:00,5,17,"Who’s ready for the @SpaceX launch tonight at 3:11am ET? (Hopfully the weather holds up *Fingers crossed*) . . . #SpaceX #Falcon9 #FalconHeavy #SpaceDay #ISS #InternationalSpaceStation #spacecadetwannabe #TessaMcEvoy #Mars #ElonMusk #Tesla pic.twitter.com/YQ38drH2P2",,@SpaceX,#SpaceX #Falcon9 #FalconHeavy #SpaceDay #ISS #InternationalSpaceStation #spacecadetwannabe #TessaMcEvoy #Mars #ElonMusk #Tesla,"1124176844129837056",https://twitter.com/Dizbiz15/status/1124176844129837056
"Dogs of Tesla 🐾",dogsoftesla,2019-05-01 20:07,6,20,"The pups that were rescued & transported by @thedogist on 4/11/2019 are now available for adoption! Fun Fact: the journey from Fresno to San Diego happened on the same day as the 2nd ever @SpaceX #FalconHeavy launch! @Tesla #ModelX #AdoptDontShop #SanDiego #SoCalhttps://twitter.com/HWAC/status/1123658339253014528 …",,@thedogist @SpaceX @Tesla,#FalconHeavy #ModelX #AdoptDontShop #SanDiego #SoCalhttps,"1123786181899182080",https://twitter.com/dogsoftesla/status/1123786181899182080
"TomCross",_TomCross_,2019-05-01 12:26,5,37,". https://youtu.be/LbiI0rYrcZo see behind the scenes of Tesla’s Falcon Heavy Secret Level /// in this video by @LikeTeslaKim I make a cameo appearance at one point too - so does Starman. @MyTeslaAdventur @Sofiaan #tesla #FalconHeavy pic.twitter.com/k5sQB8tITr",,@LikeTeslaKim @MyTeslaAdventur @Sofiaan,#tesla #FalconHeavy,"1123670008742187015",https://twitter.com/_TomCross_/status/1123670008742187015
"Richard Bigg",D_Bigg_Rigg,2019-04-27 13:20,14,87,"I spy with my little eye @SpaceX #FalconHeavy @ChrisG_NSF #oops pic.twitter.com/LsVnkuKJLe",,@SpaceX @ChrisG_NSF,#FalconHeavy #oops,"1122233974066225152",https://twitter.com/D_Bigg_Rigg/status/1122233974066225152
"Ken Kremer",ken_kremer,2019-04-22 19:33,15,38,"Wrecked #SpaceX #FalconHeavy Core stage booster remains @PortCanaveral on April 21 several days arrival. Surprisingly they were uncovered and subject to wind and rain storms. Hard to believe these @SpaceX engines will ever be reused. Practice payload fairing also visible pic.twitter.com/CB1B0tPo4o",,@PortCanaveral @SpaceX,#SpaceX #FalconHeavy,"1120515994336800769",https://twitter.com/ken_kremer/status/1120515994336800769
"Rocket Rundown",RocketRundown,2019-04-22 04:30,9,67,"A shot of the toasty #FalconHeavy booster. Credit: SpaceX pic.twitter.com/QFEdMffKNQ",,,#FalconHeavy,"1120288671712804864",https://twitter.com/RocketRundown/status/1120288671712804864
"Reese Carges",AstroReeseW,2019-04-19 07:48,10,91,"Render of Falcon Heavy standing tall ready to launch the #STP2 mission of the Air Force #SpaceX #FalconHeavy #Bigboy pic.twitter.com/YZoLUjDuDg",,,#STP2 #SpaceX #FalconHeavy #Bigboy,"1119251478592540673",https://twitter.com/AstroReeseW/status/1119251478592540673
"Greg Scott 🚀",lake_sea_mtns,2019-04-18 13:36,7,45,"B1055 just lost its last leg, next up engines #SpaceXFleet #FalconHeavy #SpaceX pic.twitter.com/cYl84cGaZe",,,#SpaceXFleet #FalconHeavy #SpaceX,"1118976662459359232",https://twitter.com/lake_sea_mtns/status/1118976662459359232
"Emre Kelly",EmreKelly,2019-04-18 11:31,11,85,"Look at this photo colleague @MalcolmDenemark captured at Port Canaveral today of #FalconHeavy's core booster on OCISLY. Aside from being a great shot of the booster itself, the name of the sailboat makes this a winner. pic.twitter.com/J2tNHQERgr",,@MalcolmDenemark,#FalconHeavy,"1118945218357792770",https://twitter.com/EmreKelly/status/1118945218357792770
"Greg Scott 🚀",lake_sea_mtns,2019-04-18 01:25,10,89,"Go Searcher & B1055 side by side....not a good trip. #SpaceXFleet #FalconHeavy pic.twitter.com/oeE3CTj1Pb",,,#SpaceXFleet #FalconHeavy,"1118792530601152513",https://twitter.com/lake_sea_mtns/status/1118792530601152513
"Julia [SCLA]",julia_bergeron,2019-04-17 23:49,5,124,"Such a sad half booster. At least it didn't have to swim into port. #SpaceXFleet #FalconHeavy https://twitter.com/spacecoast_stve/status/1118763149413449728 …",,,#SpaceXFleet #FalconHeavy,"1118768513655758848",https://twitter.com/julia_bergeron/status/1118768513655758848
"Octocrab",SpaceXOctocrab,2019-04-15 15:18,16,77,"Hey matey. Sorry for dropping yer rocket, @elonmusk. To make up for it, I have a plan. Hope ye like it. Arrr. Sincerely, Octocrab P.S. I promise to not do arm day at the gym before a landing again. #spacex #falconheavy #ocisly #Arabsat6A #falcon9 #goforlaunch pic.twitter.com/NNYauWDrRz",,@elonmusk,#spacex #falconheavy #ocisly #Arabsat6A #falcon9 #goforlaunch,"1117915161547829248",https://twitter.com/SpaceXOctocrab/status/1117915161547829248
"Everyday Astronaut",Erdayastronaut,2019-04-15 14:23,233,2643,"Unfortunately @SpaceX lost the center core or #falconheavy as it was being towed into port (from 1,000 km down range) due to rough seas. They have a robot named “octagrabber” that apparently can’t grab onto the FH center core. This shouldn’t effect STP-2 which will use a new core pic.twitter.com/OfwI8LYyhr",,@SpaceX,#falconheavy,"1117901311503208449",https://twitter.com/Erdayastronaut/status/1117901311503208449
"Chris G - NSF",ChrisG_NSF,2019-04-15 13:36,50,241,"There you have it, folks! Next #FalconHeavy is NET 19 June!!!!!! Just 2 months from now! #SpaceX #STP2 @exploreplanetshttps://twitter.com/AF_SMC/status/1117836328182267907 …",,@exploreplanetshttps,#FalconHeavy #SpaceX #STP2,"1117889560019517440",https://twitter.com/ChrisG_NSF/status/1117889560019517440
"Brady Kenniston",TheFavoritist,2019-04-14 11:03,148,827,"Everyone have their landing buddy? Make sure your legs are down and locked! #FalconHeavy #Arabsat6A pic.twitter.com/EqAlrWzEip",,,#FalconHeavy #Arabsat6A,"1117488565062123522",https://twitter.com/TheFavoritist/status/1117488565062123522
"Glenn Davis",GDavisPhotos,2019-04-14 09:47,51,457,"Congrats to the #SpaceX team on their 2nd successful flight of the #FalconHeavy. pic.twitter.com/SY2IJugzsW",,,#SpaceX #FalconHeavy,"1117469489170456577",https://twitter.com/GDavisPhotos/status/1117469489170456577
"Weltraum-Nerd",NicosPanoptikum,2019-04-14 01:16,38,208,"How crazy awesome was the last space week? @AstroAnnimal and @Astro_DavidS performed a spacewalk on the @Space_Station @ehtelescope released the first image of a black hole Israel's #Beresheet made it to the moon @SpaceX launched the first satellite atop its #FalconHeavy pic.twitter.com/wssHSfo7BX",,@AstroAnnimal @Astro_DavidS @Space_Station @ehtelescope @SpaceX,#Beresheet #FalconHeavy,"1117340863846395909",https://twitter.com/NicosPanoptikum/status/1117340863846395909
"Everyday Astronaut",Erdayastronaut,2019-04-13 15:59,25,341,"I threw together a quick collage of launch and landing of Thursday's launch and landing of @SpaceX's #FalconHeavy in slo-mo. NOW you can see the sound waves move through the exhaust (and steam). Check it out! - https://youtu.be/Ne-hI31F2kk",,@SpaceX,#FalconHeavy,"1117200736264257541",https://twitter.com/Erdayastronaut/status/1117200736264257541
"Pauline Acalin",w00ki33,2019-04-13 11:42,76,420,"Watch Falcon Heavy high-speed liftoff with sound captured from the launch. It’s loud. #SpaceX #arabsat6a #falconheavy @Teslarati @_TomCross_ pic.twitter.com/60SoitjdV1",,@Teslarati @_TomCross_,#SpaceX #arabsat6a #falconheavy,"1117136062713860099",https://twitter.com/w00ki33/status/1117136062713860099
"Flight Club",flightclubio,2019-04-13 11:42,27,117,"Check out this absolute [Falcon] cracker from @Mike_Seeley - Michael used Flight Club to help frame this up! I'm super psyched with how close this prediction was, considering how little info I had on #FalconHeavy, the flight profile, booster throttling, etc, etc Bring on STP-2! pic.twitter.com/l5gyY7sVkR",,@Mike_Seeley,#FalconHeavy,"1117136017075724288",https://twitter.com/flightclubio/status/1117136017075724288
"Kerbal Space Academy",KSpaceAcademy,2019-04-13 10:52,75,371,"Tired of screaming nerds RUINING your ROCKET VIDEOS? For @SpaceX #FalconHeavy #Arabsat6A I placed a mic away from all the commentary to capture the sound of raw power. The headphone warning is no joke. KSA and @NASASpaceflight not responsible etc etchttps://youtu.be/76lwaWD9VrY",,@SpaceX @NASASpaceflight,#FalconHeavy #Arabsat6A,"1117123508813926401",https://twitter.com/KSpaceAcademy/status/1117123508813926401
"Everyday Astronaut",Erdayastronaut,2019-04-13 10:31,243,1955,"#falconHeavy from 10.5 km (6.5 miles) at 120 frames per second. Watch the sound waves ripple through the smoke (actually mostly steam from the water deluge) I cannot tell you how amazing it is to see this rocket fly (and land) @elonmusk @SpaceX pic.twitter.com/ymTMpcULCy",,@elonmusk @SpaceX,#falconHeavy,"1117118136560640002",https://twitter.com/Erdayastronaut/status/1117118136560640002
"FrunkYea",FrunkYea,2019-04-13 07:46,53,1096,"My dad, @billyhurin, was a Tesla purchase holdout until he joined us at @Tesla 's secrete level award event for @SpaceX launch of #FalconHeavy. Here is the rundown: https://www.teslarati.com/tesla-holdout-buys-model-x-spacex-falcon-heavy/amp/ … @elonmusk @Erdayastronaut pic.twitter.com/TB1w1UuKvU",,@billyhurin @Tesla @SpaceX @elonmusk @Erdayastronaut,#FalconHeavy,"1117076562090704896",https://twitter.com/FrunkYea/status/1117076562090704896
"Nathan Barker",NASA_Nerd,2019-04-13 05:30,45,334,"Climbing to Orbit. #FalconHeavy gently rolls and begins to arc on its trajectory to space with #Arabsat6A pic.twitter.com/qozz93zR9A",,,#FalconHeavy #Arabsat6A,"1117042302776676354",https://twitter.com/NASA_Nerd/status/1117042302776676354
"NASA's Kennedy Space Center",NASAKennedy,2019-04-12 16:14,61,383,"Did you hear about @SpaceX's #FalconHeavy liftoff this week? We're looking forward to the rocket's next launch, when it will carry several @NASA_Technology projects to space. Details: https://go.nasa.gov/2G90Mpx pic.twitter.com/wlkIda0Fk3",,@SpaceX @NASA_Technology,#FalconHeavy,"1116842056700321792",https://twitter.com/NASAKennedy/status/1116842056700321792
"Planetary Society",exploreplanets,2019-04-12 13:51,79,534,"Flames from yesterday's #FalconHeavy launch pic.twitter.com/ohw7PnVY6q",,,#FalconHeavy,"1116806154347147265",https://twitter.com/exploreplanets/status/1116806154347147265
"Orlando International Airport",MCO,2019-04-12 08:35,99,533,"Extremely jealous of the folks on this @JetBlue plane who had an OK view of yesterday's #FalconHeavy launch. pic.twitter.com/ZX606PEfVw",,@JetBlue,#FalconHeavy,"1116726649331044353",https://twitter.com/MCO/status/1116726649331044353
"📸Trevor Mahlmann",TrevorMahlmann,2019-04-12 08:14,95,487,"Oh, good lord #FalconHeavy + sunset warm/cold color gradient? This may be my new favorite. Settings/downloads/prints available of this photo here: https://www.tmahlmann.com/photos/Rockets/SpaceX/Falcon-Heavy-Arabsat-6A/i-Dbqxr7Z/ … pic.twitter.com/x222vasxDQ",,,#FalconHeavy,"1116721327161974785",https://twitter.com/TrevorMahlmann/status/1116721327161974785
"Michael Baylor",nextspaceflight,2019-04-12 07:41,167,945,"Engine shot of #FalconHeavy sending Arabsat-6A to orbit. #SpaceX pic.twitter.com/ecZRy3WQaZ",,,#FalconHeavy #SpaceX,"1116712894044037124",https://twitter.com/nextspaceflight/status/1116712894044037124
"Brady Kenniston",TheFavoritist,2019-04-12 07:38,65,438,"Inside the fence views from LC-39A as Falcon Heavy lifts its first commercial payload to GTO. #FalconHeavy #Arabsat6A pic.twitter.com/mSnzap37SY",,,#FalconHeavy #Arabsat6A,"1116712071557722112",https://twitter.com/TheFavoritist/status/1116712071557722112
"45th Space Wing",45thSpaceWing,2019-04-12 06:57,151,725,"What an incredible launch of the #FalconHeavy #Arabsat6A yesterday! Which of our photos is your favorite? Go @SpaceX! Go @NASAKennedy! Go Sharks! ( by 2nd Lt Alex Preisser and Airman 1st Class Zoe Thacker) #Driveto48 pic.twitter.com/p8KLANpxNY",,@SpaceX @NASAKennedy,#FalconHeavy #Arabsat6A #Driveto48,"1116701953050980353",https://twitter.com/45thSpaceWing/status/1116701953050980353
"LEGO® IDEAS",LEGOIdeas,2019-04-12 02:15,50,260,"Huge congratulations to everyone at @SpaceX for their monumental accomplishment in successfully landing all 3 boosters from their latest #FalconHeavy launch! Check out today’s Staff Pick “SpaceX Falcon Heavy” by Eiffleman on http://ow.ly/q2Gf30opdjJ . #SpaceX pic.twitter.com/X0bafurlSs",,@SpaceX,#FalconHeavy #SpaceX,"1116630939268812801",https://twitter.com/LEGOIdeas/status/1116630939268812801
"Remco Timmermans",timmermansr,2019-04-11 23:12,9,45,"To close the #FalconHeavy recovery story from yesterday... 5 of the 6 pieces used for the #Arabsat6A launch will be reused for future launches!https://twitter.com/elonmusk/status/1116514068393680896 …",,,#FalconHeavy #Arabsat6A,"1116584886045831168",https://twitter.com/timmermansr/status/1116584886045831168
"Stephen Marr",spacecoast_stve,2019-04-11 21:25,131,491,"Onlookers on @cocoabeachpier enjoy a beautiful dual landing during today’s @SpaceX #FalconHeavy launch. This was another one where I was working and had to literally run out to the beach to get this shot. But I’m so glad to live and work in a place where I can do such things! pic.twitter.com/c6i3OOK8jS",,@cocoabeachpier @SpaceX,#FalconHeavy,"1116557819954618369",https://twitter.com/spacecoast_stve/status/1116557819954618369
"CNET",CNET,2019-04-11 21:00,48,132,"Watch SpaceX’s #FalconHeavy core rocket land on the SpaceX droneship. pic.twitter.com/1yLXyM6J2U",,,#FalconHeavy,"1116551515429330950",https://twitter.com/CNET/status/1116551515429330950
"Ken Kremer",ken_kremer,2019-04-11 20:25,16,72,"Stunning fully revealed view as triple stick #SpaceX #FalconHeavy lifts off this evening at 635 PM ET on 5.1 million pounds of thrust carrying #Arabsat6A to GTO- as all 3 @SpaceX booster cores land successfully. From my remote camera #2. much more upcoming. Credit: @ken_kremer pic.twitter.com/Fxoc5B47SJ",,@SpaceX @ken_kremer,#SpaceX #FalconHeavy #Arabsat6A #2,"1116542807139864576",https://twitter.com/ken_kremer/status/1116542807139864576
"Ted Lieu",tedlieu,2019-04-11 20:04,362,1925,"Congratulations to @SpaceX for the first triple landing ever of the #FalconHeavy rocket! Another example of why the unique aerospace ecosystem of Southern California offers unparalleled advantages. https://twitter.com/CNET/status/1116506217239568384 …",,@SpaceX,#FalconHeavy,"1116537437281497089",https://twitter.com/tedlieu/status/1116537437281497089
"Kerbal Space Academy",KSpaceAcademy,2019-04-11 19:38,14,134,"Manual tracking of a @SpaceX #FalconHeavy booster on the way back to the LZ. All 3 landed successfully (but that's another clip)... I'm proud of this one, @elonmusk Clip with chat reactions here: https://clips.twitch.tv/RelentlessCulturedJaguarWOOP … pic.twitter.com/rtiDmhmI6w",,@SpaceX @elonmusk,#FalconHeavy,"1116530883597611009",https://twitter.com/KSpaceAcademy/status/1116530883597611009
"Bobak Ferdowsi",tweetsoutloud,2019-04-11 19:29,157,1174,"And congrats to @spacex on their incredibly landing of all three cores of the #FalconHeavy after a successful launch! pic.twitter.com/n9uHrnM5GL",,@spacex,#FalconHeavy,"1116528806100180992",https://twitter.com/tweetsoutloud/status/1116528806100180992
