username,user_handle,date,retweets,favorites,text,geological_location,mentions,hashtags,tweet_id,permalink
"TravelСhain",travelchainio,2018-02-07 11:12,60,70,"#FalconHeavy is heading to the mo... Oops #crypto syndrom To the asteroid belt. @Tesla car with an artificial #space tourist is heading there with the rocket Looks like an announcement of space #tourism, isn't it @ElonMusk? We will definitely go for it @SpaceX pic.twitter.com/AwgFl2QeWJ",,@Tesla @ElonMusk @SpaceX,#FalconHeavy #crypto #space #tourism,"961316873508925440",https://twitter.com/travelchainio/status/961316873508925440
"Terry Virts",AstroTerry,2018-02-07 10:59,15,94,"It was a good day to be excited about space again! #FalconHeavy https://twitter.com/CATCH_Eng/status/961002829040189440 …",,,#FalconHeavy,"961313447102251008",https://twitter.com/AstroTerry/status/961313447102251008
"Andy Marlette",AndyMarlette,2018-02-07 10:31,36,71,"New cartoon: #FalconHeavy @SpaceX pic.twitter.com/g9JRNSSaZ9",,@SpaceX,#FalconHeavy,"961306443830964224",https://twitter.com/AndyMarlette/status/961306443830964224
"Dave Dormer",Dave_Dormer,2018-02-07 10:22,18,47,"Calgarian @astrogeo had a front row seat to yesterday's Falcon Heavy launch and his photos are AMAZING! http://www.cbc.ca/news/canada/calgary/calgary-spacex-falcon-heavy-don-hladiuk-1.4524485 … #yyc #FalconHeavy #SpaceX pic.twitter.com/CUfbCiqqTS",,@astrogeo,#yyc #FalconHeavy #SpaceX,"961304152025501697",https://twitter.com/Dave_Dormer/status/961304152025501697
"G2 Esports",G2esports,2018-02-07 10:20,119,1199,"Thanks for the boost #FalconHeavy! @JKnapsRL taking aerial goals to a whole new level pic.twitter.com/bopXDwPbhq",,@JKnapsRL,#FalconHeavy,"961303562490871809",https://twitter.com/G2esports/status/961303562490871809
"Phil Plait",BadAstronomer,2018-02-07 10:19,30,87,"ICYMI yesterday: My summary of the launch of the #FalconHeavy: http://www.syfy.com/syfywire/update-falcon-heavy-roars-into-space … … and an overview of the launch highlights: http://www.syfy.com/syfywire/next-stop-the-orbit-of-mars-the-falcon-heavy-is-set-to-fly-today … pic.twitter.com/I2VThhVlkP",,,#FalconHeavy,"961303392311267330",https://twitter.com/BadAstronomer/status/961303392311267330
"Universal Orlando Resort",UniversalORL,2018-02-07 10:17,72,357,"Wow, @elonmusk the #FalconHeavy footage is simply breathtaking. pic.twitter.com/LkWxk71t3y",,@elonmusk,#FalconHeavy,"961302820686323712",https://twitter.com/UniversalORL/status/961302820686323712
"Planetary Society",exploreplanets,2018-02-07 10:13,137,728,"It’s a beautiful morning when space exploration dominates the global media headlines! #FalconHeavy",,,#FalconHeavy,"961301864661659648",https://twitter.com/exploreplanets/status/961301864661659648
"Ars Technica",arstechnica,2018-02-07 10:11,42,98,"Elon Musk had a pretty good night: The booster landings? “That was epic—it was probably the most exciting thing I’ve ever seen.” And Starman, the spacesuited mannequin? “You can tell it’s real because it looks so fake. We have way better CGI.” #FalconHeavy https://arstechnica.com/science/2018/02/this-may-be-the-moment-spacex-opened-the-cosmos-to-the-masses/ …",,,#FalconHeavy,"961301398154510336",https://twitter.com/arstechnica/status/961301398154510336
"Ivanka Trump",IvankaTrump,2018-02-07 10:07,781,5297,"An incredible feat for American innovation and space exploration, @SpaceX successfully launched #FalconHeavy. Excited for what’s to come pic.twitter.com/MvmEdXuCUF",,@SpaceX,#FalconHeavy,"961300525126955008",https://twitter.com/IvankaTrump/status/961300525126955008
"Bob Moran",bobscartoons,2018-02-07 10:01,24,41,"Latest @Telegraph cartoon #ElonMusk #FalconHeavy #Brexit #TheresaMay #Conservatives pic.twitter.com/lFIHB0x2tA",,@Telegraph,#ElonMusk #FalconHeavy #Brexit #TheresaMay #Conservatives,"961298944981573632",https://twitter.com/bobscartoons/status/961298944981573632
"Karen James ❄️",kejames,2018-02-07 09:49,26,106,"Better #FalconHeavy payloads: 1. Cubesats or low-risk, low cost experiments 2. Kids’ &/or #citizenscience experiments 3. More, better cameras to show us how puny we are 4. Art 5. An Indigenous territory acknowledgement 6. One of David Bowie’s guitars 7. #HiddenFigures on Blu-Ray",,,#FalconHeavy #citizenscience #HiddenFigures,"961295876584026112",https://twitter.com/kejames/status/961295876584026112
"Brandon",hiperfin,2018-02-07 09:44,41,120,"I give you 49 frames of #FalconHeavy at 200mm from about 1,000 feet away. Enjoy! pic.twitter.com/Tuc5CQZb8S",,,#FalconHeavy,"961294657232756738",https://twitter.com/hiperfin/status/961294657232756738
"Milind Deora",milinddeora,2018-02-07 09:34,28,88,"The launch of #FalconHeavy by @SpaceX is the most exciting development in space exploration in recent years. Congrats @elonmusk, hope to see the #BFR soon",,@SpaceX @elonmusk,#FalconHeavy #BFR,"961292046014337025",https://twitter.com/milinddeora/status/961292046014337025
"Swapna Krishna",skrishna,2018-02-07 09:32,8,66,"Not interested in anyone’s “the money spent on the rocket should have been instead spent doing X” takes. #FalconHeavy",,,#FalconHeavy,"961291609622171648",https://twitter.com/skrishna/status/961291609622171648
"Bonnie Norman",bonnienorman,2018-02-07 09:27,11,103,"If Starwoman had been driving, she would have stopped & asked directions. #StubbornManOvershootsOrbit @elonmusk #falconheavy https://www.theverge.com/2018/2/6/16983744/spacex-tesla-falcon-heavy-roadster-orbit-asteroid-belt-elon-musk-mars …",,@elonmusk,#StubbornManOvershootsOrbit #falconheavy,"961290409782603776",https://twitter.com/bonnienorman/status/961290409782603776
"SPACE.com",SPACEdotcom,2018-02-07 09:25,118,290,"Watch asStarman zooms through space just after launching aboard SpaceX's #FalconHeavy. To sweeten the view delivered by @SpaceX , guitar god Joe Satriani, ( @chickenfootjoe) has provided his new song Cherry Blossoms, (Amazon: https://goo.gl/BHcFUo ) pic.twitter.com/loNMgTolcK",,@SpaceX @chickenfootjoe,#FalconHeavy,"961289803126915072",https://twitter.com/SPACEdotcom/status/961289803126915072
"UbisoftVR",UbisoftVR,2018-02-07 09:15,30,181,"A special gift from Earth for this Spacer! #FalconHeavy #spacejunkies pic.twitter.com/Hqfus7y7U1",,,#FalconHeavy #spacejunkies,"961287424793079808",https://twitter.com/UbisoftVR/status/961287424793079808
"Oliver McGee PhD MBA",OliverMcGee,2018-02-07 09:13,74,145,"Retweet Our New Super Hero! @SpaceX & @ElonMusk have made U.S. Space Technology Innovation cool again with this awesome Video from space during their successful Feb 6, 2018 #FalconHeavy launch for @NASA science & technology commercialization & partnerships! #HigherEducation pic.twitter.com/pWZjaQWsj4",,@SpaceX @ElonMusk @NASA,#FalconHeavy #HigherEducation,"961286819739512832",https://twitter.com/OliverMcGee/status/961286819739512832
"Fmr. Rep. Tim Walz",RepTimWalz,2018-02-07 09:08,12,56,"Unreal. Congrats to @SpaceX and @elonmusk on #FalconHeavy. Pure awe and inspiration. A welcome reminder that nothing is out of our reach when we put our heads together to follow our imagination. Bravo! https://twitter.com/elonmusk/status/960992715579125760 …",,@SpaceX @elonmusk,#FalconHeavy,"961285478644363264",https://twitter.com/RepTimWalz/status/961285478644363264
"CNN",CNN,2018-02-07 09:00,172,604,"SpaceX launched its #FalconHeavy rocket for the first time ever on Tuesday. Here's a look back, in pictures http://cnn.it/2E9u6di pic.twitter.com/zoqQfuYZbF",,,#FalconHeavy,"961283574753263621",https://twitter.com/CNN/status/961283574753263621
"YouTube",YouTube,2018-02-07 08:55,192,1050,"This is what the #FalconHeavy landing looked like to ordinary bystanders. Check out the double sonic booms at 0:28. https://youtu.be/Z_kfM-BmVzQ pic.twitter.com/wUdkC3cXrM",,,#FalconHeavy,"961282353959075840",https://twitter.com/YouTube/status/961282353959075840
"Rafael",rmayani,2018-02-07 08:41,10,43,"So, @GiantAnt we got to do a video for @jamesvmcmorrow If you enjoyed yesterday’s @SpaceX #FalconHeavy launch, you might like this. https://twitter.com/jamesvmcmorrow/status/961228609255067648 …",,@GiantAnt @jamesvmcmorrow @SpaceX,#FalconHeavy,"961278827455369216",https://twitter.com/rmayani/status/961278827455369216
"Sputnik",SputnikInt,2018-02-07 08:35,18,30,". @SpaceX launches #FalconHeavy rocket, the most powerful in the world https://sptnkne.ws/gEjY pic.twitter.com/Nmaza9Svjc",,@SpaceX,#FalconHeavy,"961277172102193154",https://twitter.com/SputnikInt/status/961277172102193154
"Shannon Stirone",shannonmstirone,2018-02-07 08:21,12,25,"About those landings yesterday...you all need to watch this video. #SpaceX #FalconHeavy FALCON HEAVY LANDING 02/06/2018 https://youtu.be/Z_kfM-BmVzQ via @YouTube h/t @w00ki33",,@YouTube @w00ki33,#SpaceX #FalconHeavy,"961273604959711232",https://twitter.com/shannonmstirone/status/961273604959711232
"Ars Technica",arstechnica,2018-02-07 08:18,9,28,"#FalconHeavy is merely the latest awe-inspiring space happening; get your orbital fix today by looking to the insane know-how that saved #Apollo13 https://arstechnica.com/science/2018/02/the-greatest-leap-part-5-saving-the-crew-of-apollo-13/ … pic.twitter.com/vwkdTVBxAP",,,#FalconHeavy #Apollo13,"961272894931181568",https://twitter.com/arstechnica/status/961272894931181568
"Corey S. Powell",coreyspowell,2018-02-07 08:16,29,70,"Musk's roadster & its cargo (including a space-rated copy of Asimov's Foundation) will probably crash into the sun after a few million years due to solar-thermal effects. https://blogs.scientificamerican.com/observations/elon-musk-does-it-again/ … #FalconHeavy pic.twitter.com/jqQmZAW0TO",,,#FalconHeavy,"961272530727243777",https://twitter.com/coreyspowell/status/961272530727243777
"Dr Marco Langbroek",Marco_Langbroek,2018-02-07 08:16,19,36,"The orbital period of the #FalconHeavy / Tesla is ~2.4 years, meaning that every 2.4 years it is back near Earth's orbit (but not necessarily close to Earth). In 12 years from now, in February 2030, it should be relatively close to Earth again.",,,#FalconHeavy,"961272499983003648",https://twitter.com/Marco_Langbroek/status/961272499983003648
"Dr Marco Langbroek",Marco_Langbroek,2018-02-07 08:11,27,44,"So, now it is in a heliocentric orbit with aphelion at 2.61 AU, the #FalconHeavy /Tesla moves at an orbital speed of 36.3 km/s near perihelion (near earth orbit). Near aphelion, in the asteroid belt, it moves with 13.6 km/s. pic.twitter.com/pyo3u1P6kl",,,#FalconHeavy,"961271162209697792",https://twitter.com/Marco_Langbroek/status/961271162209697792
"Kennedy Space Center Visitor Complex",ExploreSpaceKSC,2018-02-07 07:59,15,78,"ICYMI and we hope you didn't - you can view the first flight of #SpaceX #FalconHeavy that launched February 6 from #KennedySpaceCenter at the link. https://youtu.be/bCc16uozHVE Photo credit: Sarah Wray pic.twitter.com/E8rb7HwdMI",,,#SpaceX #FalconHeavy #KennedySpaceCenter,"961268293381181440",https://twitter.com/ExploreSpaceKSC/status/961268293381181440
"Brianna Wu",BriannaWu,2018-02-07 07:57,44,185,"1/ I’m really excited to see the successful launch of #falconheavy with #spacex. But, I am also dismayed that the US has not made @NASA a priority. If the United States is going to thrive for the next 100 years, we cannot forfeit space exploration to private enterprise.",,@NASA,#falconheavy #spacex,"961267668262244353",https://twitter.com/BriannaWu/status/961267668262244353
"Brandon",hiperfin,2018-02-07 07:54,20,120,"The glorious #FalconHeavy as it clears the tower at LC-39A. Amazing to have witnessed this historic maiden launch. Congratulations, again, to @spacex. pic.twitter.com/kzvIAWA7PZ",,@spacex,#FalconHeavy,"961266992371195905",https://twitter.com/hiperfin/status/961266992371195905
"Andrew Wallace",fatproduce,2018-02-07 07:51,26,80,"I think we know what's going to happen in the future after this #FalconHeavy launch... @SomeGadgetGuy @theMrMobile @SethMacFarlane @booredatwork @mlathrom @kyleruggles @GavHull pic.twitter.com/vUayD03W8N",,@SomeGadgetGuy @theMrMobile @SethMacFarlane @booredatwork @mlathrom @kyleruggles @GavHull,#FalconHeavy,"961266091212312576",https://twitter.com/fatproduce/status/961266091212312576
"PBS NewsHour",NewsHour,2018-02-07 07:45,26,82,"WATCH: SpaceX's #FalconHeavy — a rocket the size of a 20-story building, containing 27 engines and a cherry-red Tesla Roadster as its payload — went up, up and away yesterday. (video by @JSkl) pic.twitter.com/x7XXeJfYua",,@JSkl,#FalconHeavy,"961264545225359365",https://twitter.com/NewsHour/status/961264545225359365
"Scott Bateman",jumbo747pilot,2018-02-07 07:41,8,128,"I am so sorry to have missed this by a whisker yesterday. But it’s an amazing feat of engineering. As my boy said this morning,”it’s like a 7-year old was given a few Billion $ and told to have some fun”. #FalconHeavy #SpaceX #SpaceXFalconHeavy pic.twitter.com/ZbTUG8nE8f",,,#FalconHeavy #SpaceX #SpaceXFalconHeavy,"961263763595898881",https://twitter.com/jumbo747pilot/status/961263763595898881
"NYT Science",NYTScience,2018-02-07 07:36,25,39,"Yesterday's #FalconHeavy launch by @SpaceX was a great reminder that there is a big year ahead in space and astronomy. Sync your calendar with ours and never miss a meteor shower, an eclipse or a space launch ever again: http://nyti.ms/2GUVrSe",,@SpaceX,#FalconHeavy,"961262392603791361",https://twitter.com/NYTScience/status/961262392603791361
"The Verge",verge,2018-02-07 07:31,40,169,"Here’s what’s next for SpaceX after #FalconHeavy’s first flight https://www.theverge.com/2018/2/7/16983040/spacex-falcon-heavy-rocket-launch-schedule-spaceflight?utm_campaign=theverge&utm_content=chorus&utm_medium=social&utm_source=twitter … pic.twitter.com/Gc1CMdzIq4",,,#FalconHeavy,"961261047230468097",https://twitter.com/verge/status/961261047230468097
"Center Core",FalconMainCore,2018-02-07 07:29,27,130,"We all live in a yellow submarine, yellow submarine, yellow submarine #FalconHeavy",,,#FalconHeavy,"961260714282438656",https://twitter.com/FalconMainCore/status/961260714282438656
"Jason Major",JPMajor,2018-02-07 07:24,15,55,"If anything at all yesterday's #FalconHeavy test flight sent a tsunami of suck-it over all the Flat Earth nonsense and for that I say GRA CI AS https://twitter.com/JPMajor/status/960995663445151744 …",,,#FalconHeavy,"961259481907761153",https://twitter.com/JPMajor/status/961259481907761153
"Jodi Mohrmann",jodi_mohrmann,2018-02-07 07:21,11,68,"After being shot into space aboard #FalconHeavy yesterday, this Tesla is in a solar orbit that stretches all the way to the asteroid belt between Mars & Jupiter. You can see by this video from @SpaceX chief @elonmusk, in the driver seat is a mannequin nicknamed Starman. #SpaceX pic.twitter.com/Y0SZpvS2Cd",,@SpaceX @elonmusk,#FalconHeavy #SpaceX,"961258729579663360",https://twitter.com/jodi_mohrmann/status/961258729579663360
"OnePlus India",OnePlus_IN,2018-02-07 06:59,60,1155,". @elonmusk's roadster got #ANewView. Have you got yours yet? #Spacex #FalconHeavy pic.twitter.com/cdSYPUxIgM",,@elonmusk,#ANewView #Spacex #FalconHeavy,"961253207434547200",https://twitter.com/OnePlus_IN/status/961253207434547200
"☕Morning Brew Show☕️",MyMorningBrewTV,2018-02-07 06:50,6,14,"The #MorningBrew Show lift-off is delayed until 11am EST due to Ice and School Closings! http://Twitch.tv/TheMorningBrewShow … Join us for: #SpaceX, #Tesla, #FalconHeavy, #Starman, #StarWars, #Gaming, #Space, & #CenterCore News pic.twitter.com/vPhjSdZ0Zp",,,#MorningBrew #SpaceX #Tesla #FalconHeavy #Starman #StarWars #Gaming #Space #CenterCore,"961250897836855296",https://twitter.com/MyMorningBrewTV/status/961250897836855296
"Honor India",HiHonorIndia,2018-02-07 06:49,47,144,"It's evident that #HonorView10 has covered all bases. But now we are in the space as well!!! Get ready to meet #AI powered #HonorView10 #SpaceX #FalconHeavy https://twitter.com/Honorglobal/status/961221609053872128 …",,,#HonorView10 #AI #HonorView10 #SpaceX #FalconHeavy,"961250626478002178",https://twitter.com/HiHonorIndia/status/961250626478002178
"Samson Mow",Excellion,2018-02-07 06:49,320,982,"The #Tesla Roadster in space is probably the most captivating imagery in spaceflight since the moon landing. #NextStopMars #FalconHeavy #Starman pic.twitter.com/SL9zmQ76DL",,,#Tesla #NextStopMars #FalconHeavy #Starman,"961250479857549317",https://twitter.com/Excellion/status/961250479857549317
"EL DEBER",Dexanfetamina,2018-02-07 06:48,8,32,"Did you know that Elon Musk send a Tesla Taxi Transformer to Mars #FalconHeavy pic.twitter.com/nfiOyjLXK3",,,#FalconHeavy,"961250269437841409",https://twitter.com/Dexanfetamina/status/961250269437841409
"Sean Alexander",SeanAlex,2018-02-07 06:43,6,12,"Hey @LEGO_Group, @elonmusk and @SpaceX can we get a Falcon Heavy LEGO Kit pretty please? #falconheavy #spacex #starman",,@LEGO_Group @elonmusk @SpaceX,#falconheavy #spacex #starman,"961249067643711489",https://twitter.com/SeanAlex/status/961249067643711489
"Ukraine / Україна",Ukraine,2018-02-07 06:41,216,480,"#DYK This January Ukrainian @AntonovCompany was hired by @SpaceX to deliver a crucial part of #FalconHeavy, crossing 3,600 km in 4 hrs, just in time for the scheduled launch pic.twitter.com/qEMReja66e",,@AntonovCompany @SpaceX,#DYK #FalconHeavy,"961248455795470337",https://twitter.com/Ukraine/status/961248455795470337
"The Mars Girl",eyeofastronomy,2018-02-07 06:37,9,28,"A little secret hidden within the cosmic car. The words made on Earth by humans are printed on the Tesla's circuit board. @spacex #FalconHeavy #space pic.twitter.com/eP8vYXkhcF",,@spacex,#FalconHeavy #space,"961247572139630593",https://twitter.com/eyeofastronomy/status/961247572139630593
"AmericaSpace",AmericaSpace,2018-02-07 06:34,10,36,"Three distinct flamethrowers, aka #FalconHeavy, long exposure from pad 39A by @rocketphoto for @AmericaSpace, #SpaceX. @boringcompany @elonmusk FULL STORY - http://www.americaspace.com/2018/02/06/long-awaited-maiden-voyage-of-falcon-heavy-brings-deep-space-exploration-closer … pic.twitter.com/5tqicMep5q",,@rocketphoto @AmericaSpace @boringcompany @elonmusk,#FalconHeavy #SpaceX,"961246785674141696",https://twitter.com/AmericaSpace/status/961246785674141696
"The Roadster Life",theroadsterlife,2018-02-07 06:30,53,383,"Early this morning, Elon Musk's Tesla #Roadster was shot into space on the most powerful rocket ever built. Good luck, you lucky car! Here's to breaking new ground. Photo by: SpaceX/AP #SpaceX #FalconHeavy #ElonMusk pic.twitter.com/Rp70fm9G5f",,,#Roadster #SpaceX #FalconHeavy #ElonMusk,"961245885807001601",https://twitter.com/theroadsterlife/status/961245885807001601
"Jonathan O’Callaghan",Astro_Jonny,2018-02-07 06:28,6,12,"Science Twitter: If you could have put a payload inside Musk's Mars-bound Tesla car, what would you have included? #FalconHeavy",,,#FalconHeavy,"961245219495858176",https://twitter.com/Astro_Jonny/status/961245219495858176
"Blakey",UkBlakey,2018-02-07 06:27,4,45,"My new screen saver!!! What a picture!! Thank you @elonmusk and @SpaceX and well done indeed! #falconheavy pic.twitter.com/idOUtwnrHk",,@elonmusk @SpaceX,#falconheavy,"961245152995086336",https://twitter.com/UkBlakey/status/961245152995086336
"Spelling Mistakes Cost Lives",darren_cullen,2018-02-07 06:22,6,16,"Shoot for the moon. Get this as a poster from my site, link in bio. #motivationalquotes #motivation #shootforthemoon #falconheavy #spacex #elonmusk #starman #mars http://ift.tt/2ENAurJ pic.twitter.com/ZZBVWAieXu",,,#motivationalquotes #motivation #shootforthemoon #falconheavy #spacex #elonmusk #starman #mars,"961243702634139648",https://twitter.com/darren_cullen/status/961243702634139648
"Christian Cowart",dtxErgaOmnes,2018-02-07 06:21,137,417,"Too bad @elonmusk didn’t launch this “Starman” 250 million miles away from Earth. #FalconHeavy pic.twitter.com/LamsdX0xw2",,@elonmusk,#FalconHeavy,"961243605871611904",https://twitter.com/dtxErgaOmnes/status/961243605871611904
"ABB Formula E",FIAFormulaE,2018-02-07 06:21,132,444,"The #SantiagoEPrix really was out of this world #FalconHeavy @SpaceX pic.twitter.com/jY8cdw0kws",,@SpaceX,#SantiagoEPrix #FalconHeavy,"961243575358033920",https://twitter.com/FIAFormulaE/status/961243575358033920
"The Verge",verge,2018-02-07 06:15,141,454,"Our own @lorengrush spoke to @ElonMusk about the #FalconHeavy launch and what it means for the future of space travel https://www.youtube.com/watch?v=I7LJIuB2CHE …",,@lorengrush @ElonMusk,#FalconHeavy,"961242118751744001",https://twitter.com/verge/status/961242118751744001
"Richard",RDAnglePhoto,2018-02-07 06:03,12,31,"My shots from yesterdays @SpaceX #FalconHeavy launch! I am still trying to figure out how to describe besides beastly and amazing! I can't wait for the next launch! Website: http://www.rdanglephoto.com Instagram: rdanglephoto #SpaceX @elonmusk #starman pic.twitter.com/JDsxk7CWyu",,@SpaceX @elonmusk,#FalconHeavy #SpaceX #starman,"961239073112444928",https://twitter.com/RDAnglePhoto/status/961239073112444928
"Starman",SpaceX_Starman,2018-02-07 06:03,42,264,"How are you doing, guys? I’m fine, enjoying the trip. Pretty big deal, yesterday‘s stuff, right? I couldn’t believe you when you said that I was on board of a rocket... sorry for that. Fucking big one, if you want my opinion. Thanks for the support by the way! #FalconHeavy",,,#FalconHeavy,"961239001402368007",https://twitter.com/SpaceX_Starman/status/961239001402368007
"Sarantos",SarantosMelogia,2018-02-07 06:00,42,42,"So cool! http://bit.ly/2Ebe5HG https://apple.co/2EFYzkl http://spoti.fi/2nAze3I #ElonMusk #elonmask #ElonMuskForPresident #spacexlaunch #SpaceX #space #FalconHeavy #WednesdayWisdom #wednesdaythoughts #Wednesday #IfThe70sHadTwitter pic.twitter.com/pqjUqs0qmB",,,#ElonMusk #elonmask #ElonMuskForPresident #spacexlaunch #SpaceX #space #FalconHeavy #WednesdayWisdom #wednesdaythoughts #Wednesday #IfThe70sHadTwitter,"961238324307550208",https://twitter.com/SarantosMelogia/status/961238324307550208
"Dr. Carolina Ödman",carolune,2018-02-07 05:26,2,18,"Last night in the usual #ICU insomnia, I watched the @SpaceX #FalconHeavy launch and cried when I saw the two rockets land next to each other in perfect synchronicity. It was one of the most beautiful things I have ever seen",,@SpaceX,#ICU #FalconHeavy,"961229625727823872",https://twitter.com/carolune/status/961229625727823872
"AgoristEarth",AgoristEarth,2018-02-07 05:16,18,36,"I have a bridge to sell you. This is clearly meant for the unwashed, proletariat peasants who enjoy eating their cake. #falconheavy #spacex pic.twitter.com/e4q7Wza0Zo",,,#falconheavy #spacex,"961227274610765825",https://twitter.com/AgoristEarth/status/961227274610765825
"Odin Omen",Odin_Omen,2018-02-07 05:16,6,42,"Have a SUPER day, everyone! I’m still pumped about watching that #SpaceX milestone yesterday. #falconheavy pic.twitter.com/1z4x1Aipfn",,,#SpaceX #falconheavy,"961227209599082496",https://twitter.com/Odin_Omen/status/961227209599082496
"Penguin Books UK",PenguinUKBooks,2018-02-07 05:10,11,44,"Intrigued by the #FalconHeavy launch and want to know more about the man behind it? This is the book you need to pick up: http://po.st/GetElonMusk pic.twitter.com/ch8eStIMl7",,,#FalconHeavy,"961225614580731904",https://twitter.com/PenguinUKBooks/status/961225614580731904
"Andrews & Arnold Ltd",aaisp,2018-02-07 05:10,17,63,"Our traffic graph for the launch even looks like a #FalconHeavy! pic.twitter.com/jN97fP27dR",,,#FalconHeavy,"961225594699763712",https://twitter.com/aaisp/status/961225594699763712
"CNN",CNN,2018-02-07 05:10,256,766,"SpaceX launched its #FalconHeavy rocket for the first time ever on Tuesday. Here's a look back, in pictures http://cnn.it/2GV5LK0 pic.twitter.com/XiMgNFmhK8",,,#FalconHeavy,"961225576542621697",https://twitter.com/CNN/status/961225576542621697
"Daniel Holland",DannyDutch,2018-02-07 05:03,26,65,"Oh, how the tides have turned. #FalconHeavy pic.twitter.com/NaKN2GZoaD",,,#FalconHeavy,"961224018442498048",https://twitter.com/DannyDutch/status/961224018442498048
"HONOR",Honorglobal,2018-02-07 04:54,27,163,"Good thing we launched already, or you'll be pretty bored in space. Meet with #AI powered #HonorView10. #SpaceX #FalconHeavy pic.twitter.com/oHQpEC97El",,,#AI #HonorView10 #SpaceX #FalconHeavy,"961221609053872128",https://twitter.com/Honorglobal/status/961221609053872128
"Chris G - NSF",ChrisG_NSF,2018-02-07 04:52,82,425,"Holy moly! So yesterday was an all-around & perfect success for #FalconHeavy! Trans-Mars Injection burn outperformed expectations and and confirmed the 2nd stage’s ability to send payloads interplanetary. Incredible! #SpaceXhttps://twitter.com/elonmusk/status/961083704230674438 …",,,#FalconHeavy #SpaceXhttps,"961221239833546752",https://twitter.com/ChrisG_NSF/status/961221239833546752
"STIB-MIVB",STIBMIVB,2018-02-07 04:51,79,262,"Meanwhile in Brussels... #falconheavy #stib #mivb #Brussels pic.twitter.com/g3VXzYcYoI",,,#falconheavy #stib #mivb #Brussels,"961220928775520256",https://twitter.com/STIBMIVB/status/961220928775520256
"Robert Llewellyn",bobbyllew,2018-02-07 04:46,18,247,"Just managed to catch up on the #FalconHeavy launch yesterday. What an incredible achievement, I haven't seen anything that big launch into space since I was 14 years old. Amazing times https://www.youtube.com/watch?v=sB_nEtZxPog …",,,#FalconHeavy,"961219578264252416",https://twitter.com/bobbyllew/status/961219578264252416
"PLD Space",PLD_Space,2018-02-07 04:43,16,51,"Today is a historic day for the astronautics, for launchers industry and for the entire mankind. @SpaceX #FalconHeavy rocket, also known as the beast, was successfully launched into orbit, opening the new heavy launchers era. Congratulations @SpaceX team! pic.twitter.com/CFB0IpyGfE",,@SpaceX @SpaceX,#FalconHeavy,"961218845800304640",https://twitter.com/PLD_Space/status/961218845800304640
