username,user_handle,date,retweets,favorites,text,geological_location,mentions,hashtags,tweet_id,permalink
"ty",tykoslowski,2018-02-06 12:59,9,17,". @elonmusk YOU ARE A GOD. Thank you for being an inspiration to me and many others that want to join the aerospace industry. #FalconHeavy",,@elonmusk,#FalconHeavy,"960981204886409216",https://twitter.com/tykoslowski/status/960981204886409216
"Geoff Brumfiel",gbrumfiel,2018-02-06 12:59,376,1124,"Well that appears to be a wrap there is a Tesla in space. #falconheavy #spacex pic.twitter.com/QcdkLoQNG6",,,#falconheavy #spacex,"960981193343815680",https://twitter.com/gbrumfiel/status/960981193343815680
"Iridium",IridiumComm,2018-02-06 12:58,25,136,"Congratulations @SpaceX on an absolutely #epic #FalconHeavy test flight! #mindblown",,@SpaceX,#epic #FalconHeavy #mindblown,"960981154185834497",https://twitter.com/IridiumComm/status/960981154185834497
"Gene J. Mikulka, CC",genejm29,2018-02-06 12:58,24,66,"#FalconHeavy Have lost signal with the center core still don't know status there... #SpaceX ending television, even if we lost the core stage not a bad debut to Falcon Heavy The payload is delivered. pic.twitter.com/lxQQFJpHdl",,,#FalconHeavy #SpaceX,"960981140763967488",https://twitter.com/genejm29/status/960981140763967488
"John Wack",JasonKirkSBN,2018-02-06 12:58,19,100,"only #FalconHeavy i particularly got time for pic.twitter.com/iYk0SLftaK",,,#FalconHeavy,"960981125089910784",https://twitter.com/JasonKirkSBN/status/960981125089910784
"Tiago",Tiago11F,2018-02-06 12:58,52,126,"What about the core? #FalconHeavy pic.twitter.com/FLCqcXRjsQ",,,#FalconHeavy,"960981123911372805",https://twitter.com/Tiago11F/status/960981123911372805
"Tom Hall ☘",TomHall,2018-02-06 12:58,263,626,"#FalconHeavy - there she goes! pic.twitter.com/Npf8MSalB8",,,#FalconHeavy,"960981122787110912",https://twitter.com/TomHall/status/960981122787110912
"Rachel Traylor",Mathpocalypse,2018-02-06 12:58,21,101,"If you are watching the #FalconHeavy launch you should be. This is what humans can do when we value intelligent thought and vision and push toward really doing something. Congrats to all the engineers, scientists, and mathematicians (past & present) who worked to make this happen",,,#FalconHeavy,"960981116852187136",https://twitter.com/Mathpocalypse/status/960981116852187136
"David Blanchflower BSc",DavidBflower,2018-02-06 12:58,14,41,"The Tesla on its way to orbit. #FalconHeavy @SpaceX screenshot. 6 February 2018. pic.twitter.com/RtGa6MPudd",,@SpaceX,#FalconHeavy,"960981114369265665",https://twitter.com/DavidBflower/status/960981114369265665
"Petr Šmejkal",p_smejkal,2018-02-06 12:58,16,32,"Don't panic by @SpaceX #SpaceX #FalconHeavy #FalconHeavyLaunch pic.twitter.com/TlipMENWdE",,@SpaceX,#SpaceX #FalconHeavy #FalconHeavyLaunch,"960981112599334913",https://twitter.com/p_smejkal/status/960981112599334913
"Jason Rabinowitz",AirlineFlyer,2018-02-06 12:58,954,1752,"Absolutely incredible job by @SpaceX, landing two rocket boosters at the same exact time. #FalconHeavy pic.twitter.com/BQizH3bKKm",,@SpaceX,#FalconHeavy,"960981111076737026",https://twitter.com/AirlineFlyer/status/960981111076737026
"Taylor Trogdon",TTrogdon,2018-02-06 12:58,42,272,"I will remember that image of simultaneous boosters landing forever. I got chills. #falconheavy",,,#falconheavy,"960981106307854336",https://twitter.com/TTrogdon/status/960981106307854336
"Anshel Sag",anshelsag,2018-02-06 12:58,40,148,"This made my day. Period. Look at this shit guys. This was just a test flight. #FalconHeavy pic.twitter.com/J3hjpJS0to",,,#FalconHeavy,"960981099265445890",https://twitter.com/anshelsag/status/960981099265445890
"Matthew Lewis",Mattdavelewis,2018-02-06 12:58,116,1554,"What a time to be alive. We’re off to Mars! #FalconHeavy #SpaceX",,,#FalconHeavy #SpaceX,"960981095767396352",https://twitter.com/Mattdavelewis/status/960981095767396352
"WPEC CBS12 News",CBS12,2018-02-06 12:58,39,60,"The @SpaceX #FalconHeavy rocket sticks the landing. http://bit.ly/2nIGo6h pic.twitter.com/NNt2ubIRaH",,@SpaceX,#FalconHeavy,"960981087903207432",https://twitter.com/CBS12/status/960981087903207432
"Anthony Quintano",AnthonyQuintano,2018-02-06 12:58,12,52,"I've never geeked out so much. Watching #FalconHeavy liftoff was AMAZING! #SpaceX pic.twitter.com/Ls5encf0L2",,,#FalconHeavy #SpaceX,"960981087819251714",https://twitter.com/AnthonyQuintano/status/960981087819251714
"Tony",TonyDrinksBeer,2018-02-06 12:58,21,62,"A billionaire just fired his sports car through space at mars. And saved the rockets for next time so he can do it again. #falconheavy #SpaceX",,,#falconheavy #SpaceX,"960981069657985024",https://twitter.com/TonyDrinksBeer/status/960981069657985024
"Alistair Coleman",alistaircoleman,2018-02-06 12:58,13,43,"SpaceX #FalconHeavy was the best space porn ever, and I might have got a bit over-excited at the H2G2 reference. pic.twitter.com/AKS08O18NA",,,#FalconHeavy,"960981067216965632",https://twitter.com/alistaircoleman/status/960981067216965632
"Chris G - NSF",ChrisG_NSF,2018-02-06 12:58,168,1061,"Tears. Tears and amazing emotion. That was incredible! #FalconHeavy #SpaceX",,,#FalconHeavy #SpaceX,"960981047105282048",https://twitter.com/ChrisG_NSF/status/960981047105282048
"Joel Gehringer",Joel_Gehringer,2018-02-06 12:58,36,100,"This is real thing floating in space now. #spaceX #FalconHeavy pic.twitter.com/bkn6A6OsMA",,,#spaceX #FalconHeavy,"960981030114091009",https://twitter.com/Joel_Gehringer/status/960981030114091009
"AIAA",aiaa,2018-02-06 12:58,21,74,"Congrats to @SpaceX and @elonmusk... well done on today's test flight. 3 stages and 27 engines! #FalconHeavy pic.twitter.com/eREVvVUmmJ",,@SpaceX @elonmusk,#FalconHeavy,"960981007372636161",https://twitter.com/aiaa/status/960981007372636161
"cpamoa",cpamoa,2018-02-06 12:58,61,74,"Don't Panic! They did it! #FalconHeavy pic.twitter.com/zwq8NQ7Qam",,,#FalconHeavy,"960980981732831236",https://twitter.com/cpamoa/status/960980981732831236
"David Jehl",realdavidjehl,2018-02-06 12:58,82,253,"Damn, that shot! #FalconHeavy pic.twitter.com/yAbzm07wF4",,,#FalconHeavy,"960980981032374272",https://twitter.com/realdavidjehl/status/960980981032374272
"Franck Marchis",AllPlanets,2018-02-06 12:58,16,52,"No news yet about the central core but it was epic and Spaceman has been launched. Success! #FalconHeavy pic.twitter.com/zp9QvYqgik",,,#FalconHeavy,"960980980369473536",https://twitter.com/AllPlanets/status/960980980369473536
"✍Leonardo d'Anchiano",HdAnchiano,2018-02-06 12:58,41,122,"#FalconHeavy What a time to be alive. Together with @becarioenhoth y @JaviTannhauser !! pic.twitter.com/kCChQeAkoR",,@becarioenhoth @JaviTannhauser,#FalconHeavy,"960980977634996224",https://twitter.com/HdAnchiano/status/960980977634996224
"Katie Jacobs Stanton",KatieS,2018-02-06 12:58,13,82,"Every Product Manager in Silicon Valley right now: um, let's launch next week. #FalconHeavy",,,#FalconHeavy,"960980972605865984",https://twitter.com/KatieS/status/960980972605865984
"Alan Boyle",b0yle,2018-02-06 12:58,46,116,"WOW: @SpaceX launches #FalconHeavy rocket, sends #Starman into space on @Tesla #Roadster sports car, lands at least 2 rocket cores! https://www.geekwire.com/2018/spacex-launches-falcon-heavy-roadster/ … pic.twitter.com/aa0o66WGof",,@SpaceX @Tesla,#FalconHeavy #Starman #Roadster,"960980968579518464",https://twitter.com/b0yle/status/960980968579518464
"Popular Mechanics",PopMech,2018-02-06 12:58,45,166,"The two boosters have landed back at Cape! #FalconHeavy pic.twitter.com/Y99ZnMDAiw",,,#FalconHeavy,"960980958131490817",https://twitter.com/PopMech/status/960980958131490817
"Peebles",iceddarkroast,2018-02-06 12:58,76,2398,"I’m so hyped up after #FalconHeavy",,,#FalconHeavy,"960980954763309056",https://twitter.com/iceddarkroast/status/960980954763309056
"FIRST",FIRSTweets,2018-02-06 12:58,29,162,"What an amazing moment in #STEM! Did you catch the #FalconHeavy launch? https://twitter.com/DigitalTrends/status/960980296760872960 …",,,#STEM #FalconHeavy,"960980940188258304",https://twitter.com/FIRSTweets/status/960980940188258304
"🎙ashley ✨",AshleyEsqueda,2018-02-06 12:58,76,264,"This is basically my new aesthetic forever #FalconHeavy pic.twitter.com/n45WvNY2LK",,,#FalconHeavy,"960980930453110784",https://twitter.com/AshleyEsqueda/status/960980930453110784
"StarTalk",StarTalkRadio,2018-02-06 12:57,545,2472,"Anybody else have tears in their eyes? #FalconHeavy. pic.twitter.com/0OG2A2rFsP",,,#FalconHeavy,"960980919296327680",https://twitter.com/StarTalkRadio/status/960980919296327680
"Nicole Stott",Astro_Nicole,2018-02-06 12:57,9,51,"Two!!! Very cool! #IsThereLifeOnMars #FalconHeavy @SpaceXhttps://twitter.com/spacex/status/960980119312453632 …",,@SpaceXhttps,#IsThereLifeOnMars #FalconHeavy,"960980905803345920",https://twitter.com/Astro_Nicole/status/960980905803345920
"Sascha Pallenberg",sascha_p,2018-02-06 12:57,37,156,"This is probably the coolest marketing/pr-stunt in history. Very well done @Tesla #FalconHeavy #SpaceX pic.twitter.com/BuVDKxv8JN",,@Tesla,#FalconHeavy #SpaceX,"960980891299405826",https://twitter.com/sascha_p/status/960980891299405826
"Nick Larsson",nicklarsson,2018-02-06 12:57,9,33,"DON'T PANIC, comforting message for the Starman in #SpaceX #FalconHeavy right now pic.twitter.com/zzrjY1JWbJ",,,#SpaceX #FalconHeavy,"960980878754308096",https://twitter.com/nicklarsson/status/960980878754308096
"Senad🐈",retrokram,2018-02-06 12:57,189,269,"Wow, future is now! #FalconHeavy pic.twitter.com/gXxSi3CaDk",,,#FalconHeavy,"960980841462685697",https://twitter.com/retrokram/status/960980841462685697
"Mark Polansky",Astro_127,2018-02-06 12:57,17,67,"If you didn't watch launch of #FalconHeavy today, you missed something spectacular. Bravo Zulu #SpaceX. Way to go @astro_g_dogg !",,@astro_g_dogg,#FalconHeavy #SpaceX,"960980841303339014",https://twitter.com/Astro_127/status/960980841303339014
"SpaceXUpdates",SpaceXUpdates,2018-02-06 12:57,503,1835,"Webcast has ended! Still awaiting word from the core booster. #FalconHeavy #SpaceX pic.twitter.com/3R3C1G4d5k",,,#FalconHeavy #SpaceX,"960980828938436608",https://twitter.com/SpaceXUpdates/status/960980828938436608
"Ted Sullivan",karterhol,2018-02-06 12:57,23,242,"The @StarTrekRoom just went bananas watching #FalconHeavy #wowwowowowowow",,@StarTrekRoom,#FalconHeavy #wowwowowowowow,"960980822483337216",https://twitter.com/karterhol/status/960980822483337216
"~Marietta",MariettaDaviz,2018-02-06 12:57,47,91,"Breaking News: SpaceX Just Launched its Most Powerful Rocket! #FalconHeavy pic.twitter.com/klG4xHwu7S",,,#FalconHeavy,"960980812018614272",https://twitter.com/MariettaDaviz/status/960980812018614272
"Emily Atkin",emorwee,2018-02-06 12:57,134,553,"I don't understand how you could watch #FalconHeavy launch into space, watch the boosters land perfectly, then tell me humans aren't smart enough to solve climate change",,,#FalconHeavy,"960980807954427904",https://twitter.com/emorwee/status/960980807954427904
"US Fish and Wildlife",USFWS,2018-02-06 12:57,132,494,"The peregrine falcon is a crow-sized bird, weighing just over two pounds with a wingspan of approximately 3 feet. Not sure we'd call that #falconheavy pic.twitter.com/RqirZk0Pqd",,,#falconheavy,"960980805840404481",https://twitter.com/USFWS/status/960980805840404481
"Dave Bernhardt 🌎",AstrobiologyGuy,2018-02-06 12:57,109,287,".. and #Starman makes his journey into deep space #FalconHeavy #SpaceX pic.twitter.com/thNyVkbaxI",,,#Starman #FalconHeavy #SpaceX,"960980789960892416",https://twitter.com/AstrobiologyGuy/status/960980789960892416
"Odin Omen",Odin_Omen,2018-02-06 12:57,12,87,"The coolest thing I’ve everseen was watching these 2 rockets come back home in perfect sync. Beautiful. #SpaceX #falconheavy https://twitter.com/spacex/status/960980119312453632 …",,,#SpaceX #falconheavy,"960980781396119553",https://twitter.com/Odin_Omen/status/960980781396119553
"Dave Dickinson",Astroguyz,2018-02-06 12:57,114,184,"Nailed it.... synchronized landing of the two #FalconHeavy boosters back on land: congrats to @SpaceX on a great and historic launch! #NASASocial pic.twitter.com/58YXUrzqtG",,@SpaceX,#FalconHeavy #NASASocial,"960980777168195585",https://twitter.com/Astroguyz/status/960980777168195585
"Lance Ulanoff",LanceUlanoff,2018-02-06 12:57,64,185,"We’re going to Mars!!!!! @SpaceX #FalconHeavy pic.twitter.com/hOP4wbbzei",,@SpaceX,#FalconHeavy,"960980774240620544",https://twitter.com/LanceUlanoff/status/960980774240620544
"Kevin Yap",iKevinY,2018-02-06 12:57,38,227,"That synced #FalconHeavy booster landing was probably the coolest thing to ever grace a livestream. Hats off to @elonmusk and the whole team at @SpaceX. https://twitter.com/SpaceX/status/960980119312453632 …",,@elonmusk @SpaceX,#FalconHeavy,"960980769991671808",https://twitter.com/iKevinY/status/960980769991671808
"Scott Lowe",ScottLowe,2018-02-06 12:57,536,1766,"Two booster rockets landing themselves in perfect sync is probably the coolest goddamn thing I've ever seen. #FalconHeavy pic.twitter.com/H9UNDgo5M2",,,#FalconHeavy,"960980766753607680",https://twitter.com/ScottLowe/status/960980766753607680
"Paul Daly",PaulDalyROI,2018-02-06 12:57,116,245,"Car in space! #FalconHeavy pic.twitter.com/p8n5By2VPF",,,#FalconHeavy,"960980752195375104",https://twitter.com/PaulDalyROI/status/960980752195375104
"Roadshow",roadshow,2018-02-06 12:57,79,264,"Peace out, Star Man. #FalconHeavy pic.twitter.com/BCfovzbaWS",,,#FalconHeavy,"960980744322428928",https://twitter.com/roadshow/status/960980744322428928
"Nikki",SkepticNikki,2018-02-06 12:57,107,492,"I just watched the #FalconHeavy launch and it was beautiful. The fact that same humans that can launch a rocket into space can simultaneously believe a talking snake made a woman eat a cursed apple just boggles my mind.",,,#FalconHeavy,"960980719710490624",https://twitter.com/SkepticNikki/status/960980719710490624
"Becky DePodwin",wx_becks,2018-02-06 12:57,53,128,"This is real. It's a car floating in space, put there by a rocket ship, powerd by boosters that separated and landed themselves back simultaneously on earth. #future #SpaceX #FalconHeavy pic.twitter.com/BZWnUyqXgk",,,#future #SpaceX #FalconHeavy,"960980712378814469",https://twitter.com/wx_becks/status/960980712378814469
"Georgia Tech",GeorgiaTech,2018-02-06 12:57,82,409,"Absolutely no words. Just Goosebumps. #FalconHeavy A *HELLUVA* job, @SpaceX (and all of the Helluva Engineers who are there.) pic.twitter.com/LioiqTnPx4",,@SpaceX,#FalconHeavy,"960980692808228864",https://twitter.com/GeorgiaTech/status/960980692808228864
"Satya Patel",satyap,2018-02-06 12:56,15,99,"Watching the #FalconHeavy test flight was witnessing history and the future at the same time. No words for how stunning.",,,#FalconHeavy,"960980650894409729",https://twitter.com/satyap/status/960980650894409729
"Planetary Society",exploreplanets,2018-02-06 12:56,4345,8627,"Dang, that's pretty. #FalconHeavy pic.twitter.com/xADeiEyEGD",,,#FalconHeavy,"960980643747217408",https://twitter.com/exploreplanets/status/960980643747217408
"Epic Cosmos",EpicCosmos,2018-02-06 12:56,80,224,"Congratulations #SpaceX!! This was absolutely amazing!! On to Mars!!! #FalconHeavy #Starman pic.twitter.com/ErhvEVGy3u",,,#SpaceX #FalconHeavy #Starman,"960980638001180672",https://twitter.com/EpicCosmos/status/960980638001180672
"Evelyn Janeidy Arevalo",JaneidyEve,2018-02-06 12:56,93,318,"IM SOO HAPPY! @ELONMUSK AND THE SPACEX TEAM IS AMAZING! #FalconHeavy #FalconHeavyLaunch pic.twitter.com/ifN9Gpw0UB",,@ELONMUSK,#FalconHeavy #FalconHeavyLaunch,"960980584892911616",https://twitter.com/JaneidyEve/status/960980584892911616
"Dianna Cowern",thephysicsgirl,2018-02-06 12:56,15,151,"The rocket went from 2000km/hr to 3000km/hr in 14 seconds (according to the livestream). That's only 2 Gs if I'm doing all my math right, but that's a LOT of Gs for a giant rocket! #FalconHeavy",,,#FalconHeavy,"960980570351153152",https://twitter.com/thephysicsgirl/status/960980570351153152
"Dave Kass",dkass,2018-02-06 12:56,43,261,"sorry I was busy being inspired by an immigrant who just sent the biggest rocket ever into space #FalconHeavy",,,#FalconHeavy,"960980569097203712",https://twitter.com/dkass/status/960980569097203712
"Adam Allington",aallington,2018-02-06 12:56,27,78,"I'm sorry, but this is just so cool. Landing a rocket rocket like it was yard dart on a summer day. #FalconHeavy pic.twitter.com/Q4Ow9lADHa",,,#FalconHeavy,"960980556082241538",https://twitter.com/aallington/status/960980556082241538
"SEC Country",SECcountry,2018-02-06 12:56,12,73,"#FalconHeavy has more claim to a National Championship than UCF",,,#FalconHeavy,"960980546926075904",https://twitter.com/SECcountry/status/960980546926075904
"TicToc by Bloomberg",tictoc,2018-02-06 12:56,2637,5431,"SpaceX successfully relands #FalconHeavy boosters #tictocnews pic.twitter.com/YNt88urMI4",,,#FalconHeavy #tictocnews,"960980540835770368",https://twitter.com/tictoc/status/960980540835770368
"Glen Gilmore",GlenGilmore,2018-02-06 12:56,41,60,"The Falcon Heavy is launching with the first car astronaut. ... It’s a Tesla, of course. #Tesla #SpaceX #FalconHeavy #TechTuesday #tech #innovation #entrepreneurlife pic.twitter.com/Nk0m8qrXWY",,,#Tesla #SpaceX #FalconHeavy #TechTuesday #tech #innovation #entrepreneurlife,"960980507075993600",https://twitter.com/GlenGilmore/status/960980507075993600
"Mary Kish",MerryKish,2018-02-06 12:56,21,186,"The SpaceX Falcon Heavy launch on @Twitch is so magical. Its the perfect combination of brilliant engineering, human ingenuity and the insane fandom of Twitch. #FalconHeavy https://clips.twitch.tv/ColorfulTangibleKiwiNerfRedBlaster … pic.twitter.com/B57klGgaGd",,@Twitch,#FalconHeavy,"960980480488194048",https://twitter.com/MerryKish/status/960980480488194048
"Phil Plait",BadAstronomer,2018-02-06 12:56,1071,2430,"The Tesla Roadster with Starman spacesuit on their way to orbit. Seriously. Wow. #FalconHeavy pic.twitter.com/8DR8q0LQhK",,,#FalconHeavy,"960980457205780482",https://twitter.com/BadAstronomer/status/960980457205780482
"ABC7 Eyewitness News",ABC7,2018-02-06 12:56,36,91,"#LIVE: #FalconHeavy side cores have landed http://abc7.com/live/23340 pic.twitter.com/H59kcRAi5k",,,#LIVE #FalconHeavy,"960980451295862784",https://twitter.com/ABC7/status/960980451295862784
"Dr. Tanya Harrison",tanyaofmars,2018-02-06 12:56,101,211,"Yep, a #TeslaRoadster in Space. #FalconHeavy #FalconHeavyLaunch pic.twitter.com/hUiqyBLV6s",,,#TeslaRoadster #FalconHeavy #FalconHeavyLaunch,"960980450461274112",https://twitter.com/tanyaofmars/status/960980450461274112
"Matt Lanza",mattlanza,2018-02-06 12:56,87,189,"#FalconHeavy plume showing up on GOES-16. pic.twitter.com/ZxYyt4xX9P",,,#FalconHeavy,"960980428818612224",https://twitter.com/mattlanza/status/960980428818612224
"WIRED Science",WIREDScience,2018-02-06 12:55,3340,5584,"Now that's what you call a landing https://www.wired.com/story/spacex-gears-up-to-finally-actually-launch-the-falcon-heavy … #FalconHeavy pic.twitter.com/Cr5KIwFp5R",,,#FalconHeavy,"960980409172615168",https://twitter.com/WIREDScience/status/960980409172615168
"Thomas Hern",ThomasMHern,2018-02-06 12:55,26,107,"Hey Kim Jong-un, This is how it's done. #FalconHeavy pic.twitter.com/GqyFSybx5z",,,#FalconHeavy,"960980390411370496",https://twitter.com/ThomasMHern/status/960980390411370496
"Chris Johnson",c_f_johnson,2018-02-06 12:55,22,73,"Mind blown! #FalconHeavy pic.twitter.com/OOxAYvdPg8",,,#FalconHeavy,"960980380277862400",https://twitter.com/c_f_johnson/status/960980380277862400
"Morgan Brennan",MorganLBrennan,2018-02-06 12:55,9,88,"Just watched 2 SpaceX boosters return to earth to Cape Canaveral in tandem. 4 sonic booms. #falconheavy",,,#falconheavy,"960980372296257537",https://twitter.com/MorganLBrennan/status/960980372296257537
"Catherine Q.",CatherineQ,2018-02-06 12:55,31,134,"They freaking DID IT! 2 boosters confirmed landed on land. #FalconHeavy pic.twitter.com/3vauNERlH1",,,#FalconHeavy,"960980361240072192",https://twitter.com/CatherineQ/status/960980361240072192
"Jason Rabinowitz",AirlineFlyer,2018-02-06 12:55,96,218,"Just chilling in a car in space... #FalconHeavy pic.twitter.com/MxLyOQG2gd",,,#FalconHeavy,"960980356110389248",https://twitter.com/AirlineFlyer/status/960980356110389248
"HelloGreedo",HelloGreedo,2018-02-06 12:55,12,236,"Oh my God the boosters landing. Beautiful. Chills. I have something in my eye... #FalconHeavy",,,#FalconHeavy,"960980338305654785",https://twitter.com/HelloGreedo/status/960980338305654785
"Emily Calandrelli",TheSpaceGal,2018-02-06 12:55,89,214,"LOOK at that Roadster! #FalconHeavy pic.twitter.com/Z7bMXKNtLP",,,#FalconHeavy,"960980324577558528",https://twitter.com/TheSpaceGal/status/960980324577558528
"Steve Kim",Fobwashed,2018-02-06 12:55,140,268,"This is pretty damn cool... #falconheavy pic.twitter.com/HEIYQfUB7g",,,#falconheavy,"960980313173196800",https://twitter.com/Fobwashed/status/960980313173196800
"Digital Trends",DigitalTrends,2018-02-06 12:55,182,553,". @elonmusk just successfully launched a @Tesla into space on the @SpaceX #FalconHeavy! pic.twitter.com/SxkH6yTIIh",,@elonmusk @Tesla @SpaceX,#FalconHeavy,"960980296760872960",https://twitter.com/DigitalTrends/status/960980296760872960
"Bad Father Han Solo",BadFatherHan,2018-02-06 12:55,94,598,"The real #FalconHeavy. pic.twitter.com/NXvdnpRf3O",,,#FalconHeavy,"960980292952567808",https://twitter.com/BadFatherHan/status/960980292952567808
"Dai Lama",WelshDalaiLama,2018-02-06 12:55,53,178,"Now this is how the 21st century was supposed to be. Eccentric billionaires doing mad shit in space. Fantastic @elonmusk #FalconHeavy pic.twitter.com/upEwLH0FRR",,@elonmusk,#FalconHeavy,"960980271842643968",https://twitter.com/WelshDalaiLama/status/960980271842643968
"Holger Klein",holgi,2018-02-06 12:55,44,180,"What a time to be alive #FalconHeavy",,,#FalconHeavy,"960980269917523974",https://twitter.com/holgi/status/960980269917523974
"Greg Dee",GregDeeWeather,2018-02-06 12:55,188,347,"Omg! That's insane! Synchronized booster landing! #FalconHeavy #FalconHeavyLaunch pic.twitter.com/Pkqs84pKGp",,,#FalconHeavy #FalconHeavyLaunch,"960980245523427329",https://twitter.com/GregDeeWeather/status/960980245523427329
"Cosmic Carol",Cosmic_Carol,2018-02-06 12:55,166,484,"OH MY GOD!!!!! I AM A MESS!!!!!!! NAILED THOSE SIDE BOOSTER LANDINGS!!!!!! #falconheavy pic.twitter.com/aDixefIPlE",,,#falconheavy,"960980236346249218",https://twitter.com/Cosmic_Carol/status/960980236346249218
"Starman",SpaceX_Starman,2018-02-06 12:55,69,216,"Silence at last. Nice view, actually! #FalconHeavy",,,#FalconHeavy,"960980234903392257",https://twitter.com/SpaceX_Starman/status/960980234903392257
"Michele Bannister",astrokiwi,2018-02-06 12:55,42,79,"This is INCREDIBLE. Truly we are in the future #FalconHeavy https://twitter.com/shannonmstirone/status/960979970297180161 …",,,#FalconHeavy,"960980212946296834",https://twitter.com/astrokiwi/status/960980212946296834
"WESH 2 News",WESH,2018-02-06 12:55,239,470,"Here's the moment the #FalconHeavy took flight: http://bit.ly/2E52cmF pic.twitter.com/0XzdtSTm6W",,,#FalconHeavy,"960980211381698561",https://twitter.com/WESH/status/960980211381698561
"StarTalk",StarTalkRadio,2018-02-06 12:55,127,352,"The Falcons have landed! #FalconHeavy @SpaceX pic.twitter.com/K5l7n1e7IR",,@SpaceX,#FalconHeavy,"960980185733623813",https://twitter.com/StarTalkRadio/status/960980185733623813
"TrekCore.com 🖖",TrekCore,2018-02-06 12:55,76,237,"Wow wow wow. #StarTrek #FalconHeavy @elonmusk pic.twitter.com/Zzy0cvCUmB",,@elonmusk,#StarTrek #FalconHeavy,"960980184156573702",https://twitter.com/TrekCore/status/960980184156573702
"Jaana B. Dogan",rakyll,2018-02-06 12:55,22,113,"That booster landing felt like an animation. Tears in my eyes. Humans are amazing. #FalconHeavy",,,#FalconHeavy,"960980169421832192",https://twitter.com/rakyll/status/960980169421832192
"Emre Kelly",EmreKelly,2018-02-06 12:55,46,145,"One word comes to mind: WOW. #FalconHeavy #SpaceX pic.twitter.com/e9y475e0NZ",,,#FalconHeavy #SpaceX,"960980168083898373",https://twitter.com/EmreKelly/status/960980168083898373
"Alasdair Allan",aallan,2018-02-06 12:54,31,100,"Perfect landing by the sideboosters. #SpaceX #FalconHeavy pic.twitter.com/q0nndTzsfO",,,#SpaceX #FalconHeavy,"960980163084345344",https://twitter.com/aallan/status/960980163084345344
"Andrea Feczko",AndreaFeczko,2018-02-06 12:54,19,149,"Watching @Tesla #FalconHeavy rocket felt like I had been transported back to the 1950's & 60's- SO COOL!! pic.twitter.com/vgRvs64c0P",,@Tesla,#FalconHeavy,"960980156369244160",https://twitter.com/AndreaFeczko/status/960980156369244160
"Sean O'Kane",sokane1,2018-02-06 12:54,69,117,"BOTH SIDE BOOSTERS LAND #FALCONHEAVY https://www.theverge.com/2018/2/5/16961610/falcon-heavy-launch-date-time-watch-spacex … pic.twitter.com/WThi92SyrO",,,#FALCONHEAVY,"960980142968442882",https://twitter.com/sokane1/status/960980142968442882
"Edan Clay 🇺🇸",EdanClay,2018-02-06 12:54,33,153,"Okay, holy sh*t, that was impressive when the two SpaceX #FalconHeavy landed right next to each other vertically!",,,#FalconHeavy,"960980133166403585",https://twitter.com/EdanClay/status/960980133166403585
"Greg Diamond",gdimeweather,2018-02-06 12:54,166,364,"Side boosters have landed back on earth. THIS IS SO SICK #FalconHeavy pic.twitter.com/orVoBcpl7J",,,#FalconHeavy,"960980128091267078",https://twitter.com/gdimeweather/status/960980128091267078
"DutchSpace",DutchSpace,2018-02-06 12:54,62,159,"Dual booster landing makes for pretty pictures #FalconHeavy pic.twitter.com/ufulQYz7SV",,,#FalconHeavy,"960980094025166849",https://twitter.com/DutchSpace/status/960980094025166849
"Alternative NOAA",altNOAA,2018-02-06 12:54,13,117,"Phenomenal! . @SpaceX #FalconHeavy",,@SpaceX,#FalconHeavy,"960980084600528896",https://twitter.com/altNOAA/status/960980084600528896
